Name	Title	Coding	Subreddit
t3_jzc3li	New Jersey Lawmaker Pushes To Disbar Rudy Giuliani For Deceitful, ‘Absurd’ Election Cases	Other	politics
t3_jzi4ou	With nearly all votes counted, the 2020 presidential election wasn't that close	Other	politics
t3_jznsvu	Georgia GOP Senator Kelly Loeffler Just Got Caught Violating the Law | Will the Senate’s richest member be held to account for her blatantly illegal solicitation of campaign cash?	Other	politics
t3_jzgfji	Why Won’t Emily Murphy Just Do Her Job? In delaying the transition, the General Services Administration chief appears to be making an ideological choice.	Other	politics
t3_jzj8pk	Congress should cancel its Thanksgiving recess and pass another stimulus bill	Other	politics
t3_jzi95i	Refusing to certify legitimate votes is a felony | Opinion	Other	politics
t3_jzhrk4	The left is accused of authoritarianism – but it's the right that gets away with it	Other	politics
t3_jzhnl4	Ted Cruz Tweeted A Tone-Deaf Thanksgiving Meme While Texas Morgues Overflowed With COVID Victims	Other	politics
t3_jzlncn	This Is the Beta Test for a Future Where Republicans Will Simply Never Accept a Democratic Victory	Other	politics
t3_jzi3gz	The Republican Party has split in two. Let’s keep it that way.	Other	politics
t3_jzgni2	Can This Get Any More Pathetic? The president and his enablers may look like fools, but they are causing real damage.	Other	politics
t3_jzie6k	Michigan set to certify election results Monday despite GOP challenge	Other	politics
t3_jzh1lm	Lincoln Project attacks "unpatriotic" and "dangerous" Republican rising stars in new ad	Other	politics
t3_jzgzab	Epidemiologist warns of “contagion” of violent speech coming “from the White House”	Other	politics
t3_jz9uzj	DeSantis hires Ohio Uber driver to rig Covid stats	Other	politics
t3_jzjx1p	Our democracy is holding. Americans will remember who defended it — and who didn’t.	Other	politics
t3_jzpxy7	Yes, We Should Still Get Rid of the Electoral College	Other	politics
t3_jz91j4	Democrats must fight for $15 — for Georgia and for the future	Other	politics
t3_jzjvt3	Republicans created an anti-democratic mob	Other	politics
t3_jzs6ku	Michigan AG warns on election fraud claims: A false claim of criminal activity is a crime	Other	politics
t3_jz9z0z	Scranton, Pennsylvania, honors famous 'scrappy kid' turned President-elect	Other	politics
t3_jzho2z	A North Texas superintendent is openly defying the state mask mandate in schools. No one is stopping him.	Other	politics
t3_jzshte	Dianne Feinstein to step down as top Democrat on the Senate Judiciary panel | The 87-year-old was criticized for her handling of Amy Coney Barrett's contentious Supreme Court confirmation hearings	Other	politics
t3_jzgxk3	GOP Sen. Cramer says it's 'past time' to start transition as challenges continue	Other	politics
t3_jzoz36	Wisconsin GOP chair says Republicans are "trying to disenfranchise people," amid post-election turmoil	Other	politics
t3_jzkpsf	The Birther Myth Stuck Around For Years. The Election Fraud Myth Might Too.	Other	politics
t3_jz8fzj	A Hail Mary': Lt. Gov. Fetterman Responds To Pennsylvania Mail-In Ballot Lawsuit From Republicans	Other	politics
t3_jzk0l9	Allegheny Co. Board Of Elections Votes 2-1 To Certify General Election Results	Other	politics
t3_jz9q93	Georgia GOP shifts strategy to prioritize vote-by-mail ahead of runoff elections	Other	politics
t3_jzhdsi	Florida Republican Lawmaker Wants an Accused Murderer Elected to Congress	Other	politics
t3_jzkwh8	Iran in the Crosshairs?' Reports of Secret Meeting Between Netanyahu, MbS, and Pompeo Spark Fears of War Plot	Other	politics
t3_jznoa2	Supreme Court’s Lack of Attention to GOP Emergency Petition Suggests High Court ‘Has No Interest’	Other	politics
t3_jz9j27	Governor Cuomo Calls on Congress to Renew and Expand Critical Support Programs for Unemployed Americans Amid COVID-19 Pandemic	Other	politics
t3_jzoq9m	Georgia extends use of absentee ballot drop boxes for Jan. 5 runoff amid surge in requests	Other	politics
t3_jzolvy	Surgeon General Reminds WH That COVID Restrictions Apply There Too	Other	politics
t3_jzbdl7	Socialism Is Bad Until a Capitalist Like David Perdue Gets Paid | Opinion	Other	politics
t3_jziiq3	Attention, Sen. Grim Reaper: More will die without another stimulus bill	Other	politics
t3_jzjwo0	Profiles in Cowardice	Other	politics
t3_jznpns	Why the Republicans Are Like the 1860 South: Don’t like the election’s outcome? Then split the nation.	Other	politics
t3_jzke7v	Georgia Senate race reminds Republicans they don't have a lock on 'God talk'	Other	politics
t3_jz9qk5	Two more House members announce they have Covid-19	Other	politics
t3_jzg5ak	Sen. Schumer pushes govt. to invoke Defense Production Act to mitigate COVID-19 surge	Other	politics
t3_jznrcd	Pentagon reports $5B in improper payments to civilian workforce	Other	politics
t3_jzqixu	Democrats reject GSA offer to delay briefing on transition	Other	politics
t3_jz8w6q	Republicans Rewrite an Old Playbook on Disenfranchising Black Americans	Other	politics
t3_jzhdky	Eight mayors: We need a Marshall Plan for Middle America	Other	politics
t3_jzq3ey	Chairman Nadler to GSA: Perform Your Duty and Ensure Peaceful Transition of Power	Other	politics
t3_jzmmoz	For interracial couples, Kamala Harris and Doug Emhoff are a ‘monumental’ symbol	Other	politics
t3_jzq735	Record amount of absentee ballots requested for Georgia runoff elections	Other	politics
t3_jzpdev	Mohave County certifies election results, becoming final Arizona county to do so	Other	politics
t3_jzk542	Economists call for more stimulus checks	Other	politics
t3_jzmmfn	Ted Cruz Gets His Election Predictions Thrown Back In His Face	Other	politics
t3_jzk7gl	Deb Haaland Could Shatter Yet Another Glass Ceiling as the First Ever Native American in a Presidential Cabinet	Other	politics
t3_jzgw5s	Goodbye To All That — Leaving the GOP	Other	politics
t3_jzqv3f	US can kill its own citizens without review when state secrets are involved, DOJ lawyer argues	Other	politics
t3_jztaah	Dianne Feinstein to step down as top Democrat on Senate Judiciary Committee following SCOTUS backlash	Other	politics
t3_jzmrvz	Surgeon General Adams: All Americans, even at the White House, should avoid large holiday gatherings	Other	politics
t3_jzkrud	Portman: No proof of mass fraud that would change election result	Other	politics
t3_jzpj8x	The Real Lesson of Herman Cain’s Death | For Republicans, Black people’s suffering will always be someone else’s problem.	Other	politics
t3_jzpi1q	400 Years After the ‘First Thanksgiving,’ the Tribe Who Fed the Pilgrims Continues to Fight for Their Land Amid Another Epidemic	Other	politics
t3_jzi65k	Israeli PM Netanyahu secretly flew to Saudi Arabia for meeting with Pompeo and crown prince	Other	politics
t3_jzae3i	L.A. County suspends outdoor dining at restaurants as coronavirus surges	Other	politics
t3_jzou6q	N.Y. Senate Democrats declare supermajority in Albany	Other	politics
t3_jzp7an	Members of law enforcement sue to halt marijuana legalization in South Dakota	Other	politics
t3_jzihp1	‘Society is broken’: Users are pissed that people are being paid to stand in long COVID testing lines — 'This is so f*cking dystopian.'	Other	politics
t3_jznyq8	GOP Senator Portman says there's "no evidence" that election fraud would change results "in any state"	Other	politics
t3_jzhj8e	As Arizona Counties Certify Election Results, Senate President Karen Fann Still Looking For Fraud Evidence	Other	politics
t3_jzleel	Wisconsin presidential recount in 4th day, with few changes	Other	politics
t3_jztrbg	Dianne Feinstein to step down as top Democrat on Senate Judiciary Committee following SCOTUS backlash	Other	politics
t3_jzlg7d	How to Help the Democrats Win Georgia	Other	politics
t3_jzospq	Inaccurate early vote count in one Michigan county was a human error, not a failure of the software	Other	politics
t3_jzslfs	Woman Says Georgia ICE Facility Gave Her Unwanted Gynecological Surgery. Now She's Being Deported	Other	politics
t3_jzqgra	Workers go on strike at 11 nursing homes in Illinois, demanding higher wages and COVID-19 pandemic hazard pay	Other	politics
t3_jzrueo	Robert Reich: The Republicans' Legacy is Profiles in Cowardice	Other	politics
t3_jzlr1s	The "What happened in your state last week?" Megathread, Week 46	Other	politics
t3_jzuc80	Ironically enough, it’s Rudy Giuliani who has ties to Venezuela	Other	politics
t3_jzquea	Democrats 'Insist' On Tuesday Briefing By GSA Head On Delayed Transition	Other	politics
t3_jzm1n1	Mask Mandates Work To Slow Spread Of Coronavirus, Kansas Study Finds	Other	politics
t3_jzqzwb	Stocks jump on news of Yellen as Treasury pick	Other	politics
t3_jzmhm7	Watch live at 1: Board of State Canvassers to vote on certifying Michigan election results	Other	politics
t3_jzpcaw	Republican Wisconsin congressman Bryan Steil tests positive for COVID	Other	politics
t3_jzpbbh	Could Giuliani Really Get Disbarred? Ethics Complaints Explained	Other	politics
t3_jzjfiq	White House plans holiday party as Americans urged to stay home	Other	politics
t3_jztyd2	GSA chief says decision to allow transition to begin was 'solely mine'	Other	politics
t3_jzn33v	Whitmer, courts could take action if Board of State Canvassers fails to certify	Other	politics
t3_jzshll	Feinstein won't seek top Judiciary Committee spot following complaints from progressives	Other	politics
t3_k048pi	Stacey Abrams says 750K Georgians have requested ballots for runoff	Other	politics
t3_jzumbx	AOC criticises Mitch McConnell for dismissing Senate as coronavirus cases spike: 'I don't know how these people can sleep at night'	Other	politics
t3_k0cl04	‘People are going hungry as you tweet from vacay’: AOC doubles down attacks on senate for failure to pass Covid relief bill	Other	politics
t3_k08f1c	Congressman seeks to have Rudolph Giuliani disbarred over attempts to overturn election	Other	politics
t3_k03olk	Jaime Harrison launches new PAC to help Democrats in Georgia runoffs as he eyes DNC chair	Other	politics
t3_k050s7	Seattle's 2021 budget includes millions for community programs and 18% cuts to police	Other	politics
t3_jzw72b	A dark money mystery in Florida centers on the campaign of a spoiler candidate who appeared to help a Republican win by 32 votes	Other	politics
t3_k04weg	Georgia Dems will knock on doors with Senate at stake	Other	politics
t3_k01wfe	Giuliani admits to exaggerating claims of fraud after saying Detroit had more voters than citizens	Other	politics
t3_k0631x	Atlanta Hawks and Falcons team up to open early voting site for key Georgia runoff	Other	politics
t3_k07mq6	Rudy Giuliani Went to Court and Made a Compelling Argument—for His Own Disbarment	Other	politics
t3_k035vy	Attorney General Barr Will Go Out With a Whimper, Not a Bang	Other	politics
t3_k08wp4	Time for Democrats to Drain the Real Swamp	Other	politics
t3_jzzyfs	Following the money behind two apparent shill candidates in Florida state Senate races	Other	politics
t3_k06vvg	I'm exaggerating a bit': Giuliani's voter fraud admission	Other	politics
t3_k05zlx	‘He’s Not Kushner’: Israelis Who’ve Worked With Blinken Welcome His Pick as Secretary of State	Other	politics
t3_k0ddv4	N.J. cops must wear body cameras under new laws Gov. Murphy just signed	Other	politics
t3_k04rl6	Ocasio-Cortez knocks McConnell for dismissing Senate without passing COVID-19 relief	Other	politics
t3_k09xpl	Michigan AG investigating threats against Wayne County canvassers	Other	politics
t3_k06v6v	Jaime Harrison: "We have to transform the Democratic Party"	Other	politics
t3_k0aqul	The Good News Is That John Kerry Believes In Climate Change	Other	politics
t3_k06z58	Texts: US census manager told counters to use fake answers	Other	politics
t3_k0bzmf	‘Ghost candidates’ blamed for siphoning votes in Florida Senate races	Other	politics
t3_jzv1j3	Melania Still Has to Give a F--k About Christmas	Other	politics
t3_k092fh	An outstanding choice.’ Elizabeth Warren praises choice of Janet Yellen as Treasury secretary - The Boston Globe	Other	politics
t3_jzwbqe	South Dakota governor refuses to mandate masks despite record-breaking coronavirus spike	Other	politics
t3_jzzi17	White Nationalist President to Veto Defense Bill if Military Bases Don’t Keep Confederate Names	Other	politics
t3_k041go	Pa. Lt. Gov. Fetterman says GOP 'put a Grubhub order in for chaos' after the election	Other	politics
t3_k08tqa	Why Stacey Abrams Is Confident Georgia Will Stay Blue	Other	politics
t3_jzxj0i	Law enforcement officers ask courts to stop legal marijuana	Other	politics
t3_jzvfsb	It Was a Good Day for Democracy	Other	politics
t3_k0b2ox	Nevada Supreme Court certifies election results	Other	politics
t3_jzvphc	After criticism, Feinstein to step down as top Judiciary Dem	Other	politics
t3_k01rr8	QAnon Lies Are Taking Over Election Conversations Online	Other	politics
t3_k06lgn	Unsanitized: We’ve Given Almost Nothing to States and Cities for Vaccine Distribution	Other	politics
t3_k0ekqi	Ocasio-Cortez, Cruz trade jabs over COVID relief: People 'going hungry as you tweet from' vacation	Other	politics
t3_k05exe	The ruling elite's war on truth: America's leaders are increasingly disconnected from reality	Other	politics
t3_jzy57e	Ted Cruz Mocks Covid-19 Safety Warnings As Texans Die | All In | MSNBC	Other	politics
t3_k0bwrl	How do we avoid future authoritarians? Winning back the working-class is key	Other	politics
t3_k09n8b	Go Big, and Stay Big': Economists Call for $3 Trillion Covid Relief Package to Stop Nation's Descent Into Ruin | "The Senate's failure to provide crucial relief and recovery aid has left families without a lifeline and will severely damage prospects for recovery."	Other	politics
t3_k0957p	Jaime Harrison Would Be ‘All In’ If Called On To Lead DNC	Other	politics
t3_k0dyl7	William Barr’s Bloodthirsty Lame Duck Execution Spree Is Unprecedented	Other	politics
t3_k0d0cj	New York Democrats Claim Supermajority in State Senate	Other	politics
t3_jzw7lb	Aaron Van Langevelde Has More Spine Than the Entire Republican Caucus in Congress	Other	politics
t3_k03mra	USS John S. McCain challenges Russia’s claims to Peter the Great Bay in Sea of Japan	Other	politics
t3_k0econ	Key House Democrat Asks SEC to Find Out if Perdue Sub Deal Was as Shady as It Looks	Other	politics
t3_k08qm5	Stacey Abrams Says More Than 750K Have Requested Ballots for Senate Runoff	Other	politics
t3_jzycy0	David Dinkins, NYC’s first black mayor, dead at 93	Other	politics
t3_k03sd7	The Snake-Oil Salesmen of the Senate	Other	politics
t3_k06ieq	Foreign observers shocked by chaos over U.S. election	Other	politics
t3_k05le1	Ohio Senior Assistant Attorney General cited for leaving two Upper Arlington crashes on same morning	Other	politics
t3_jzuxnt	Feinstein to step aside as top Democrat on Senate Judiciary Committee	Other	politics
t3_k09dp7	Despite the CDC’s Eviction Ban, Thousands of Tenants Are Losing Their Homes | Across the country, tenants are finding that the eviction moratorium is riddled with loopholes and ineffectively enforced.	Other	politics
t3_k095lc	Postal union leaders: Pandemic-driven mail decline emphasizes need for USPS aid	Other	politics
t3_k0fxum	House Democrats Vow To Vote On Recreational Marijuana	Other	politics
t3_k0cqap	On day five of election recounts in Milwaukee, all observers were given poop emoji wristbands from Wisconsin Center staff	Other	politics
t3_k04bov	The Tragedy of the 2020 Census	Other	politics
t3_k0f8s1	"Boy, did we screw up": Charles Koch renounces partisanship while pouring money into Georgia GOP	Other	politics
t3_k09tlo	Sidney Powell is a beacon of hope to sad Qanon supporters	Other	politics
t3_jzx0m3	Black Caucus: Renaming Confederate bases must be part of final defense bill	Other	politics
t3_k0e0kx	Minnesota certifies 2020 election results	Other	politics
t3_k0c4ug	Nearly 400 unopened absentee ballots from Milwaukee's south side found during recount	Other	politics
t3_k04nc9	Ted Cruz, AOC spar over delayed COVID relief after McConnell approves Senate recess	Other	politics
t3_k0fuja	Last whistleblower fired from Texas Attorney General Ken Paxton's office days after suing for retaliation	Other	politics
t3_k0f9u0	Education Department removed tool for defrauded students 9 days after launch	Other	politics
t3_k0d1ti	Mnuchin to Put $455 Billion in Funds Out of Yellen’s Easy Reach	Other	politics
t3_k0fm53	Indiana Asks the Supreme Court to Let Them Strip Rights from Same-Sex Parents | The justices have shown interest in a case that could begin the rollback of marriage equality.	Other	politics
t3_k0evew	Give it a rest, Republicans — no one wants to take away Turkey Day	Other	politics
t3_k0cpxm	Dianne Feinstein to step down as top Democrat on Senate judiciary panel	Other	politics
t3_k0ayzy	Federal stimulus would give "more degrees of freedom" for possible lockdown, Gov. Phil Murphy says	Other	politics
t3_k0ga6s	AOC says Republicans holding stimulus check hostage over demand for corporate COVID immunity	Other	politics
t3_k09dl7	Minnesota state board meets to certify election results	Other	politics
t3_jzxhxb	Georgia State Election Board to consider emergency election rules for Jan. runoff	Other	politics
t3_k0eubu	Ossoff, Warnock to knock on doors in runoff campaigns	Other	politics
t3_k05yh2	The democracy hangs on — by just enough	Other	politics
t3_jzwayf	Democrats were passive and got steamrolled — because the Republicans were aggressive	Other	politics
t3_jzvlup	Yellen closes in on becoming first woman to hold three most powerful economic posts	Other	politics
t3_k07bl7	Census manager told counters to use fake answers, texts show	Other	politics
t3_k0en5g	Trans senator Sarah McBride gives artful masterclass in putting spiteful trolls in their place	Other	politics
t3_k0efh3	We’ll Soon Be Rid of Steve King —But Not His Demagoguery	Other	politics
t3_k0sd46	Under Governor Noem – South Dakota leads the world in death rate From COVID-19 - World expert says Noem’s lack of leadership is “Equivalent to manslaughter	Other	politics
t3_k0rk1f	Perdue and Loeffler’s Well-Timed Stock Trades Give Georgia Democrats an Opening — “These are just bad people who you shouldn’t be trusting”	Other	politics
t3_k0sqtf	Newsmax CEO Says Its Coverage Is Not Accurate, They Have No Evidence of Election Fraud	Other	politics
t3_k0siww	U.S. citizens detained for speaking Spanish at Montana grocery store settle suit against U.S. Customs and Border Protection	Other	politics
t3_k0t2ws	US border patrol closes ‘kids in cages’ detention facility until 2022	Other	politics
t3_k0tiv7	Key Senate Republican faces questions about well-timed investments	Other	politics
t3_k0pth3	ICE Expelled 33 Immigrant Children Back To Guatemala After A Judge Said They Couldn't	Other	politics
t3_k0rl5c	With US in COVID-19 panic, Sen. Perdue saw stock opportunity	Other	politics
t3_k0q2dk	Happy Thanksgiving to All Those Who Told the Truth in This Election | Civil servants, elected officials and judges did their jobs and protected democracy.	Other	politics
t3_k10dnw	Sen. Perdue Insisted He Had No Input At All On Stock Buys. New Evidence Shows He Did.	Other	politics
t3_k0jqf8	Republican John James concedes in Michigan Senate race	Other	politics
t3_k0xeu2	Indigenous people across the US want their land back -- and the movement is gaining momentum	Other	politics
t3_k0yte4	Stock Trades by Senator Perdue Said to Have Prompted Justice Dept. Inquiry	Other	politics
t3_k0qsap	It Wasn't Ideology That Sank House Democrats. It Was Bad Strategy.	Other	politics
t3_k0k93l	Bid to hold another massive pro-gun rally in Virginia thwarted when gun-control advocates got permits first	Other	politics
t3_k0swyw	Amid Covid panic, Georgia Sen. Perdue saw stock opportunity	Other	politics
t3_k0ul6i	Democrats Claim Veto-Proof Majority in N.Y. Senate, Pressuring Cuomo	Other	politics
t3_k0uokq	Ga. Sen. Perdue boosts wealth with well-timed stock trades	Other	politics
t3_k118m2	‘An Admission of Wrongdoing, For Sure’: NRA’s Tax Returns Reportedly Show Top Executives Diverted Significant Assets for Personal Use	Other	politics
t3_k0mgkj	Bernie Sanders backs Alabama Amazon unionization: ‘Mr. Bezos...must not interfere’	Other	politics
t3_k0vhf3	Ossoff calls on Georgia Republicans Perdue and Loeffler to require masks at events as COVID surges	Other	politics
t3_k0jc0t	It’s Not That Complicated. Cancelling Student Debt Is Good.	Other	politics
t3_k0u6np	Congress Isn't Passing Pandemic Relief, But They Are Passing The Coronavirus	Other	politics
t3_k0j6un	Unequal Justice: The Treachery of Samuel Alito — His record of arch-conservatism makes him more closely akin to a Fox News host than a Supreme Court Justice.	Other	politics
t3_k0x68f	Permit Denied for Alaskan Mine Project	Other	politics
t3_k0xnjr	Ga. Sen. Perdue Boosts Wealth With Well-Timed Stock Trades. The Republican senator quickly sold off and bought the same stock in the early days of the pandemic, avoiding a sharp loss.	Other	politics
t3_k0uube	America Is Run by Geezers | In an election between two septuagenarians, the elderly dominated turnout like never before—more than offsetting a surge in the youth vote.	Other	politics
t3_k12uem	FBI Investigated Georgia Republican Sen. David Perdue Over Suspicious Stock Trades	Other	politics
t3_k0ta2a	COVID-19 Sick Leave Likely Prevented Thousands Of Cases. It’s About To Expire.	Other	politics
t3_k0ud5r	Jewish leaders defend Raphael Warnock after Loeffler attacks	Other	politics
t3_k0xyvy	GOP poised to gerrymander its hold on power — Democrats fall short in nearly every key state. Republicans will have power to gerrymander 188 congressional districts while Dems hold control over just 73 seats	Other	politics
t3_k0sowo	U.S. border officials close Texas warehouse where chain-link ‘cages’ for migrants became a symbol of mistreatment	Other	politics
t3_k0xpps	Army Corps says no to massive gold mine proposed near Bristol Bay in Alaska	Other	politics
t3_k0tpuc	More than 125 economists, including Obama's former top economic advisor, sign a letter urging Congress to send a 2nd round of $1,200 stimulus checks	Other	politics
t3_k0swzs	Julia Louis-Dreyfus and Veep Cast to Reunite for Virtual Table Read to Get Out the Vote in Georgia — The Veep cast is getting together to do a table read of the episode “Mother,” which follows a recount during a presidential election.	Other	politics
t3_k0vb5w	Four Seasons, Part II? Maddow Finds Something Weird In Next Big Giuliani Event	Other	politics
t3_k0jcpt	You don’t have a ‘right’ to a lawyer when you’re trying to steal an election	Other	politics
t3_k0s3op	Wall Street rocks as food lines grow	Other	politics
t3_k0pyq3	Jane Mayer: Charles Koch’s partisan regrets are part of cyclical ‘charm offensive’	Other	politics
t3_k0mtpo	Canceling Medical Debt Is a Moral Imperative	Other	politics
t3_k0ztis	“Stop the Steal” Republicans Are the New Anarchists | In Georgia’s runoffs and across the country, the radicals are on the right.	Other	politics
t3_k0sjtf	Republicans Rediscover the Dangers of Selling Bunk to Their Constituents - Cynical public speech aimed at winning political power has consequences.	Other	politics
t3_k130g5	Romance novelists raise $400,000 for Georgia Senate races – with help from Stacey Abrams	Other	politics
t3_k0wnze	Janet Yellen will champion Main Street, not Wall Street	Other	politics
t3_k10oqt	Manhattan DA appeals Manafort dismissal to NY’s high court	Other	politics
t3_k1176e	‘Thanksgiving leftovers won’t taste as good if you’re on a ventilator,’ health department warns	Other	politics
t3_k137ay	House Democrats subpoena private prison operator in forced hysterectomy case	Other	politics
t3_k0tcni	Fauci urges Americans to sacrifice traditional Thanksgiving to save lives	Other	politics
t3_k0z5ed	David Perdue: GOP Senator faces scrutiny over stock trades made as Covid spread in US	Other	politics
t3_k0ya7w	2 Senators Introduce National Face Mask Legislation as U.S. Sees Highest COVID Daily Death Toll Since May	Other	politics
t3_k0veud	David Perdue Boosted Wealth With Well-Timed Stock Trades As Pandemic Hit	Other	politics
t3_k0jx9o	Pardon for Michael Flynn under discussion at the White House	Other	politics
t3_k0y9te	Laura Ingraham Gives Fox Viewers a Dose of Reality: It’s Over	Other	politics
t3_k0re9j	He's an ex-Proud Boy. Here's what he says happens within the group's ranks	Other	politics
t3_k0xdq1	Manhattan DA appeals dismissal of Manafort charges to NY high court	Other	politics
t3_k0ymx4	Scientists Are Becoming More Politically Engaged	Other	politics
t3_k0v6lp	Here's something to give thanks for this Thanksgiving: our democracy survived	Other	politics
t3_k0tgez	A growing number of Americans are going hungry | 26 million now say they don’t have enough to eat, as the pandemic worsens and holidays near	Other	politics
t3_k144y4	Sen. David Perdue’s Stock Trading Continues to Have Remarkable Timing	Other	politics
t3_k0x7ag	University of the Arts faculty in Philadelphia have voted to unionize	Other	politics
t3_k0j3yv	Rudy Giuliani honors David Dinkins in death but led racist rally against him in office	Other	politics
t3_k106ie	Mississippi Gov. Refuses Statewide Mask Mandate, Says Health Experts Are 'Completely Wrong' About Its Effectiveness	Other	politics
t3_k10s9c	L.A. County moves to create new juvenile justice system focused on 'care,' not punishment	Other	politics
t3_k0w618	Ga. Sen. Perdue boosts wealth with well-timed stock trades	Other	politics
t3_k10hpx	The 2020 election wasn't 'stolen.' Here are all the facts that prove it.	Other	politics
t3_k0kuz5	More than 100 million Americans are out of the labor force	Other	politics
