Name	Title	Coding	Subreddit
t3_k0ssj4	State Republican Steps Down Only Three Weeks After Winning Reelection	Other	Conservative
t3_k0rxlt	CDC may shorten recommended COVID-19 quarantine period to between 7 and 10 days	Other	Conservative
t3_k12kk2	Pennsylvania Judge Halts Further Vote Certification Steps	Other	Conservative
t3_k0zm8v	Sen. Booker Introduces Bill to Transfer Land to Black Farmers	Other	Conservative
t3_k0y29w	Pennsylvania Judge Blocks State From Certifying Election Results For POTUS And All Other Races	Other	Conservative
t3_k0sdff	Poll Shows Growing Democratic Opposition to Cheap Labor Migration	Other	Conservative
t3_k0l4sc	Attorney [Lin Wood] Challenging Georgia Election Outcome Appeals Case	Other	Conservative
t3_k0ryvk	Rigged-election claims in Georgia fuel Republican fears of losing Senate	Other	Conservative
t3_k0xoon	NYC to Have Coronavirus Checkpoints, Sheriff Warns of 'Consequences' for Violating Quarantine	Other	Conservative
t3_k0py58	Europe must not succumb to the Soros network	Other	Conservative
t3_k0m77p	Group Files Emergency Petition in Wisconsin After Identifying 150,000 Potentially Fraudulent Ballots	Other	Conservative
t3_k131gv	Joanna Williams: Covid restrictions show we’re willing to kowtow to authority	Other	Conservative
t3_k0t4on	Georgia voters registered at postal, commercial addresses that appeared to be residential, study	Other	Conservative
t3_k0svpi	WATCH: Fulton County Poll Manager Susan Voyles Recounts Election Improprieties in Georgia Recount	Other	Conservative
t3_k0j8kf	NYC Will Have Covid Checkpoints at Key Bridges and Crossings	Other	Conservative
t3_k13due	Sheriff Donny Youngblood says KCSO will not respond to calls for large gatherings	Other	Conservative
t3_k13i5h	Happy Thanksgiving General Flynn!	Other	Conservative
t3_k12dsg	Dr. Mike is called out for hypocrisy after he's seen partying maskless	Other	Conservative
t3_k0s8dr	BLM leader in Breonna Taylor protests fatally shot in carjacking : TheGrio	Other	Conservative
t3_k12is8	Politicians’ Attacks On Thanksgiving Gatherings Are Not ‘Data-Based,’ Epidemiologists Say	Other	Conservative
t3_k0u3hp	Obama to be honored by PEN America with Voice of Influence Award. During the ceremony, Obama will discuss freedom of expression and the importance of truth in a world of misinformation.	Other	Conservative
t3_k12ail	Analysis - Pennsylvania Judge Blocks Election Certification Over Constitutionality of Mail-In Voting	Other	Conservative
t3_k12z67	Douglas Murray: It's liberal hysteria to think cutting foreign aid will turn UK into an international pariah	Other	Conservative
t3_k12xm8	David Aaronovitch: Infantile obsession with walkouts and martyrdom proves UK’s left isn’t interested in real business of politics	Other	Conservative
t3_k12qox	Judge orders Pennsylvania halt certification of election results as fight over mail-in ballots continues	Other	Conservative
t3_k0wu3h	Los Angeles Bans Outdoor Dining Without Evidence Linking It to New Cases	Other	Conservative
t3_k13lbt	Democrat Jon Ossoff Claims ‘Oversight’ in Omitting Payment from Chinese Communist-Linked Company	Other	Conservative
t3_k12s8z	Florida Democrats Praying to Satan in the House Chamber	Other	Conservative
t3_k0rq2h	Election observers given poop emoji wristbands during vote recount in Wisconsin	Other	Conservative
t3_k14e3n	Pennsylvania state judge sides with GOP, halting election certification	Other	Conservative
t3_k107xb	New Pennsylvania coronavirus measures include stay-at-home advisory, Thanksgiving Eve ban on alcohol sales at bars and restaurants	Other	Conservative
t3_k0ya4t	Penguin Random House staffers broke down in tears over release of Jordan Peterson book: report	Other	Conservative
t3_k0ku9s	Heritage Tech Expert Exposes TikTok’s China Ties on ‘60 Minutes’	Other	Conservative
t3_k0vj5j	Black Lives Matter Leader Calls L.A. Mayor Garcetti A ‘Liberal White Supremacist,’ Speaks Out Against Potential Cabinet Appointment	Other	Conservative
t3_k0ycn2	Pennsylvania governor halts alcohol sales day before Thanksgiving	Other	Conservative
t3_k13rw5	Gov. Cuomo brutally mocked by columnist for accepting Emmy award: 'He was fantastic on television'	Other	Conservative
t3_k0zs54	U.S. Weekly Jobless Claims Jump to 778,000	Other	Conservative
t3_k0wrij	Sidney Powell Wants Zoom Meeting Where Georgia Official Refused Audit	Other	Conservative
t3_k0t9s2	Scott Peterson, CA death-row inmates got COVID-19 benefits in massive scam: report	Other	Conservative
t3_k0t8kd	Massachusetts Democrats Push Unlimited Abortion in Annual Budget -- The amendments would expand abortion after fetal viability and erase parental-consent requirements for minors seeking abortions.	Other	Conservative
t3_k0t2vg	Who Really Runs The Drudge Report?	Other	Conservative
t3_k11igx	5 things to know about NY Gov. Andrew Cuomo’s coronavirus nursing home controversy	Other	Conservative
t3_k0xhc3	California Paid Millions for Unemployment Claims in Prisoners’ Names, Prosecutors Say	Other	Conservative
t3_k11g5p	2020 Election Fraud Evidence Compiled	Other	Conservative
t3_k12w0h	BLM Protester Who Spat in Cop's Face Walks Free After Apology	Other	Conservative
t3_k12vkg	Allister Heath: UK is facing ruin, as a result of Covid Response	Other	Conservative
t3_k0lerd	Urban-Rural Divide Shapes American Culture &amp; Politics	Other	Conservative
t3_k0wi87	The Numbers Don’t Lie (about racial crime rates)	Other	Conservative
t3_k0namr	Treasury, Reserve Bank told Government it could just print money to pay for Covid-19	Other	Conservative
t3_k12qq1	The Year 2020 Was A NightMare; Should We Be Thankful This Thanksgiving?	Other	Conservative
t3_k10fzs	Pittsburgh forms Coronavirus task force to enforce guidelines	Other	Conservative
t3_k0zpa5	Sen. Booker Introduces Bill to Transfer Land to Black Farmers	Other	Conservative
t3_k0o8tl	Sidney Powell plans to file Georgia election-related lawsuit 'no later than tomorrow'	Other	Conservative
t3_k13tpd	Daniel Lacalle: The ‘Great Reset’ and the Risk of Great Interventionism	Other	Conservative
t3_k11jof	The New Woke Times	Other	Conservative
t3_k10vjo	COVID crackdown underway as 'substantial' restrictions coming to NYC	Other	Conservative
t3_k10vha	YouTube Suspends OAN as Liberal Senators Call for Censorship	Other	Conservative
t3_k1043t	New Lockdown a Blow to Philly Restaurants	Other	Conservative
t3_k0yndi	Proposal Seeks To Prohibit Gatherings In LA County As Pandemic Surges	Other	Conservative
t3_k0urr1	New Mexico governor shuts down grocery stores with new public health order	Other	Conservative
t3_k11qjn	This young Cuban man responds to AOC.	Other	Conservative
t3_k0v8sr	NYC's COVID checkpoints are back: Cops out 'in force' at travel spots	Other	Conservative
t3_k1314q	UK Covid Cops Bust Women's Dinner Party	Other	Conservative
t3_k10mvq	One Nation Under Google: How Google Can (and Does) Change Election Outcomes	Other	Conservative
t3_k106hl	U.S. republic needs loyalty, confidence of its citizens	Other	Conservative
t3_k0xfda	WATCH: Uzbekistani Migrant Rescued from Texas Border River	Other	Conservative
t3_k0jz7e	Arizona PROP 208 – Big Tax Increase Possible in Arizona	Other	Conservative
t3_k11ggk	Citi Joins Mastercard In Allowing Transgenders To Use Their ‘Chosen Name’ Without Legal Change	Other	Conservative
t3_k0ut0g	Report: Facebook hatched 'emergency' plan using 'secret internal ranking' to suppress 'right-wing' news sources post-election	Other	Conservative
t3_k0nkxe	Cost of Lockdowns: A Preliminary Report	Other	Conservative
t3_k15453	Levin on Thanksgiving: No Thanks to Media, America Is a ‘Special Country’	Other	Conservative
t3_k153sj	“Father Knows Best's” 1954 Thanksgiving Prayer: 'We Thank Thee for the Privilege of Living as Free Men'	Other	Conservative
t3_k14e7q	Syrian Refugee Camps breeding Islamic terrorists	Other	Conservative
t3_k0yycj	Even If Mad About Election, Don’t Sit Out Georgia Runoffs	Other	Conservative
t3_k0vidp	Xi Focus: Xi stresses military training to raise capability of winning wars - Xinhua | English.news.cn	Other	Conservative
t3_k1634i	Twitter has suspended Pennsylvania State Senator Doug Mastriano after he lead the Senate Hearing today about election fraud	Other	Conservative
t3_k1ejjq	Please...	Other	Conservative
t3_k1l6u5	Gorsuch with the tactical nuke in his concurrence	Other	Conservative
t3_k1fwqo	Guess who’s not invited!	Other	Conservative
t3_k1ewqv	The sad life of those that are obsessed with Reddit groups that they hate	Other	Conservative
t3_k1e5dk	US Supreme Court Blocks Cuomo's NY Coronavirus Limits on Houses of Worship	Other	Conservative
t3_k1fdtx	This time they really are telling the truth... cOme oN gUys...	Other	Conservative
t3_k16zil	Calfiornia Governor Newsom Should Be Worried – The Petition To Recall Him Has Already Broken The Halfway Point At 750K Signatures	Other	Conservative
t3_k1gd4m	Report: “F” Grades Have Gone Up 83% Since Remote Learning Began	Other	Conservative
t3_k1fiuo	The nation’s highest court sided with the Roman Catholic Diocese of Brooklyn and Orthodox Jewish synagogues that sued the governor over the state-imposed caps in areas declared red and orange zones. “Even in a pandemic, the Constitution cannot be put away and forgotten."	Other	Conservative
t3_k1kd74	Twitter Blocks 'Potentially Harmful' Links to Sidney Powell Election Lawsuit	Other	Conservative
t3_k171id	Over 20K Votes Cast In GA From People Who Didn't Meet Residency Requirement	Other	Conservative
t3_k18z8n	Sydney Powell releases the 'Kraken'.	Other	Conservative
t3_k1d9nf	When Conservatives and Liberals were given the opportunity to fill out a moral Foundations questionnaire and told to predict how their ideological counterpart would respon, Conservatives were more accurate in their predictions than liberals, suggesting conservatives understand their opposition more.	Other	Conservative
t3_k1aarh	Supreme Court rules against Cuomo, blocks coronavirus restrictions on some New York houses of worship	Other	Conservative
t3_k16was	Sidney Powell E filing case in GA soon! 100 pages + Exhibits!	Other	Conservative
t3_k1l7hj	Happy thanksgiving California!	Other	Conservative
t3_k1iuc1	Suspect In San Francisco Area Fatal Stabbings Was Deported 3 Times, Not Turned Over To Authorities Due To Sanctuary Policy	Other	Conservative
t3_k17ctv	Kracken Released On Georgia! Attorney Sidney Powell Tweets Request For Info From Secretary Of State &amp; Announces Huge Law Suite Filing On Lou Dobbs	Other	Conservative
t3_k1fm8n	Morning Greatness: SCOTUS Smacks Down Cuomo’s Religious Restrictions	Other	Conservative
t3_k1hsel	Denver Mayor Jets Off to Houston After Telling People to Avoid Thanksgiving Travel	Other	Conservative
t3_k1brf2	Memory sticks used to program Philly’s voting machines were stolen from elections warehouse	Other	Conservative
t3_k1i48f	Sidney Powell’s Website Apparently Blocked by Twitter	Other	Conservative
t3_k1l88k	Thanksgiving: 51K Pounds of Roasted Turkey, Other Holiday Treats Flown to U.S. Warfighters Overseas	Other	Conservative
t3_k1nqrf	Apple is reportedly planning to move production out of China due to ongoing US-China trade war	Other	Conservative
t3_k1fb17	Food deemed non-essential as New Mexico governor shuts down grocery stores.	Other	Conservative
t3_k18gbh	India bans 43 more mobile apps as it takes on China	Other	Conservative
t3_k1g74n	Kraken Released: Sidney Powell Files Mother Of All Lawsuits In Georgia	Other	Conservative
t3_k1f73c	After 400 Years, The Top Reason People Come To America Is Still Freedom	Other	Conservative
t3_k168zo	Fighting Words - “Systemic racism” is an assertion made reflexively by Democrats that is never accompanied by evidence.	Other	Conservative
t3_k1d9cd	Sidney Powell Files Lawsuit in Georgia Alleging 'Massive Election Fraud'	Other	Conservative
t3_k1f50l	Supreme Court strikes down Cuomo's COVID restrictions on religious services in New York	Other	Conservative
t3_k1dqso	Gov. Mike Parson to Missourians: 'Government has no business' regulating gatherings in homes	Other	Conservative
t3_k16rj4	Study finds 84% fewer hospitalizations for patients treated with controversial drug hydroxychloroquine	Other	Conservative
t3_k1ig5v	Johns Hopkins: COVID Has Had No Effect On US Death Rate	Other	Conservative
t3_k15sns	Denver Mayor Flies to Family Thanksgiving, Said to 'Avoid Travel'	Other	Conservative
t3_k1ik0f	Kentucky Coffee Shop Defies Covid Orders As Line Of Supportive Customers Stretches Out The Door	Other	Conservative
t3_k17021	Facebook Suppressed Breitbart, Promoted CNN, Following Election	Other	Conservative
t3_k1f4kw	New Suit in Michigan Alleges ‘Dominion Computer Fraud’ and ‘Illegal Conduct’ by Election Workers	Other	Conservative
t3_k16a45	Pennsylvania state judge sides with GOP, halting election certification	Other	Conservative
t3_k1fiqq	Rep.-elect Lauren Boebert plans Thanksgiving 'funeral' for dead turkey in defiance of Colorado guidelines	Other	Conservative
t3_k1c673	Republican David Valadao Unseats Democrat T.J. Cox in California; Avenges 2018 Loss	Other	Conservative
t3_k1g5i3	Supreme Court Backs Religious Challenge To Cuomo’s Covid Restrictions; Barrett Delivers Decisive Vote	Other	Conservative
t3_k1a8ni	Governor Newsom Orders Police To Go Door To Door Arresting Anyone Not Depressed And Alone	Other	Conservative
t3_k16zbz	Kalkaska County board of commissioners approved resolution calling for Gov. Whitmer's impeachment	Other	Conservative
t3_k1pnkw	Alex Trebek Left a Thanksgiving Message for America: “Keep the faith, we’re going to get through all of this, and we will be a better society because of it.”	Other	Conservative
t3_k1q44y	Recently Pardoned Turkey Found Dead After Claiming To Have Dirt On Hillary Clinton	Other	Conservative
t3_k1fkqv	Report: Dead People Voted in Close New York Congressional Race	Other	Conservative
t3_k15ynt	After warnings to avoid travel, Denver Mayor Hancock flies to visit family for Thanksgiving	Other	Conservative
t3_k1jhax	Twitter Suspends Col. Doug Mastriano After He Leads PA Hearing on Election Fraud	Other	Conservative
t3_k19o6s	Sidney Powell group’s Michigan affidavit also just released.	Other	Conservative
t3_k1frb0	New Suit in Michigan Alleges ‘Dominion Computer Fraud’ and ‘Illegal Conduct’ by Election Workers	Other	Conservative
t3_k18mlk	Lin Wood: ‘11th Circuit granted my Emergency Motion for Expedited Review of lawsuit challenging validity of GA election procedure’	Other	Conservative
t3_k1fwcc	What happened to the olive branch? Alyssa Milano calls Michael Flynn (and others) an 'a**hole'	Other	Conservative
t3_k1cypk	Supreme Court temporarily bars New York from setting church attendance limits	Other	Conservative
t3_k1gg12	Supreme Court rules against Cuomo's coronavirus limits -- with Barrett playing key role	Other	Conservative
t3_k1fexf	Give Thanks…	Other	Conservative
t3_k18zai	Defending the Republic – Sidney Powell's Legal Defense Fund	Other	Conservative
t3_k1j334	Vermont Governor Goes Full Leftist Dictator: Schools Will Question Students About Thanksgiving, Boot Those Who Gathered	Other	Conservative
t3_k1bdy9	Subpoena in Georgia Election Lawsuit Seeks Video Footage From Voting Site	Other	Conservative
t3_k1asrp	BREAKING: Sidney Powell Releases The KRAKEN On Michigan and Georgia!	Other	Conservative
t3_k17seo	Andrew McCarthy: Gen. Flynn Should Not Have Needed a Pardon -- "Plainly, the interview was a perjury trap."	Other	Conservative
t3_k1lgg1	Nancy Pelosi condemns Michael Flynn Pardon: "An act of grave corruption and a brazen abuse of power."	Other	Conservative
t3_k1lal0	GOP Poll Watcher and Fraud Expert Gives Explosive Testimony About What He Observed Happen in Delaware County, PA: "In all cases the chain of custody was broken... in all cases they didn't follow any of the procedures defined by the Board of Delaware County of Elections."	Other	Conservative
t3_k1hrrj	New book meticulously debunks NYT’s 1619 Project–plus offers positive, accurate narrative of America’s past	Other	Conservative
t3_k1g0vm	School Votes to Remove a Rock Because It Was Called a Racist Name Nearly a Century Ago	Other	Conservative
t3_k1ei8p	What lockdown? New congresswoman Lauren Boebert of Colorado is holding Thanksgiving 'funeral' for turkey. Solves the issue of limiting Thanksgiving gatherings to 10 people while allowing 30 at funerals.	Other	Conservative
t3_k1dk98	Supreme Court Blocks Covid Restrictions on Religious Services in NY	Other	Conservative
t3_k18ftk	Obama used signature process to disqualify opponents	Other	Conservative
t3_k1mys7	Update to Michigan Affidavit. Some precincts reporting 780, 400 percent turnout	Other	Conservative
t3_k1fjic	DUMB AND DUMBER': How Cuomo And De Blasio Ruined New York	Other	Conservative
t3_k1es8y	Sidney Powell released the Kraken in Georgia	Other	Conservative
t3_k1c2nl	Michigan Gov. Gretchen Whitmer Nominated for Time 'Person of the Year'	Other	Conservative
t3_k1nrmw	Florida Governor Extends Ban On Local Enforcement Of Mask Mandates, Business Restrictions	Other	Conservative
t3_k1h672	Thousands in Georgia use fake addresses on registration	Other	Conservative
t3_k1bpvv	Sidney Powell's Georgia Complaint	Other	Conservative
t3_k1697w	Mysterious Orange-Haired Vigilante Smuggles Thousands Of Beer Kegs Into Prohibition-Era Pennsylvania	Other	Conservative
t3_k1o0sj	Rush Limbaugh Just Gave A Thanksgiving Goodbye – Rush Says His Listeners Gave Him “One Of The Greatest Lives”	Other	Conservative
t3_k1hp9a	Americans Should Be Free to Decide How to Celebrate Thanksgiving	Other	Conservative
t3_k1pm5l	Witness Testifies at Pennsylvania Election Hearing: Voting Machines 'Built to Be Manipulated'	Other	Conservative
t3_k16pzu	Denver mayor warns against holiday travel, then hops on a plane to visit family for Thanksgiving	Other	Conservative
t3_k1ncp8	Sidney Powell Files New Michigan Lawsuit	Other	Conservative
t3_k19owq	Appeals Court Grants Expedited Review Over Lin Wood's Lawsuit Challenging Georgia Election Procedures	Other	Conservative
t3_k18j28	2 NYPD officers shot in Queens, suspect dead	Other	Conservative
t3_k17cew	Doctors Without Borders: Socialists Are Blocking Our Specialists from Entering Venezuela	Other	Conservative
t3_k1kd38	Powell Lawsuit in Michigan Alleges 'Dominion Computer Fraud' and 'Illegal Conduct' by Election Workers	Other	Conservative
t3_k1k7q4	Sidney Powell Files Lawsuit in Georgia Alleging 'Massive Election Fraud'	Other	Conservative
t3_k1c5gx	Appeals Court Grants Expedited Review Over Lin Wood's Election Lawsuit in Georgia	Other	Conservative
t3_k1a8ko	Here is a link to the Michigan affidavits - [Exhibit Exhibit 1 – #1, Att. #1 in King v. Whitmer (E.D. Mich., 2:20-cv-13134) – CourtListener.com]	Other	Conservative
t3_k1kkww	Staffers Crying Over Jordan Peterson Book Cured By Forcing Them To Read Jordan Peterson Book	Other	Conservative
t3_k1ijou	Denver’s Democrat Mayor Blasted Over His Response To Violating His Own Coronavirus Recommendations	Other	Conservative
t3_k1hgkp	Lawsuit Sidney Powell Filed in Georgia	Other	Conservative
t3_k1776p	Banned Catholic pro-life midwifery student wins apology and payout	Other	Conservative
t3_k1njtt	Gov. Cuomo calls SCOTUS ruling on gatherings ‘irrelevant’	Other	Conservative
t3_k18e07	Pa. AG Rejects Fraud Hearing as 'Fake,' 'Devoid of Reality'	Other	Conservative
t3_k18lvb	Michigan county clerk fights for election integrity	Other	Conservative
t3_k1azzh	Redacted affidavit for China / Iran Interference [.PDF]	Other	Conservative
t3_k1q8ib	Sidney Powell Suit Makes 30 Allegations in Bid to Invalidate Georgia Election Results	Other	Conservative
t3_k1px41	Cuomo calls Supreme Court church ruling ‘irrelevant’ despite decision	Other	Conservative
t3_k1hvzx	Seattle mayor to cut police department budget 18% after City Council approval	Other	Conservative
t3_k18u2a	Sanctuary Outrage: Criminal alien arrested in two murders after California released him repeatedly	Other	Conservative
t3_k187l1	San Antonio Mayor Ron Nirenberg Issues 10 pm City Curfew for Thanksgiving Night, Barely Giving Local Residents a 24 Hour Notice	Other	Conservative
t3_k18an7	(And So It Begins) - Pa. Slams Judge's 'Overreach' in Delaying Vote Certification	Other	Conservative
t3_k1f7t3	Fight against electoral fraud is a fight against totalitarianism	Other	Conservative
t3_k1cglv	BREAKING: Sidney Powell Releases the 'Kraken' in Georgia with Explosive New Lawsuit	Other	Conservative
t3_k1hmeb	Thanksgiving: On Being Grateful for Our Gifts and Blessings	Other	Conservative
t3_k1dqio	Judge rules California can't deny man wanting 'QUEER' on his license plate	Other	Conservative
t3_k1pm0i	PCR-Based Covid Testing Has Failed- "A false positive pseudo-epidemic is a well described phenomenon in the medical literature which results in an exponential rise in diagnosed cases and deaths but no excess deaths."	Other	Conservative
t3_k1mt8s	Poll Watcher Describes Pennsylvania Election Irregularities, Including 47 Missing USB Cards	Other	Conservative
t3_k16pm0	Days before Christmas, Jupiter and Saturn will look like one bright star — some believe the alignment is the same described in the Bible	Other	Conservative
t3_k1qvsv	Multiple Oregon elected officials face backlash for tropical vacations during COVID-19 surge	Other	Conservative
t3_k1d22a	Legal Group Files Lawsuit Challenging Over 200,000 Ballots in Georgia	Other	Conservative
t3_k1c3p3	Affidavit for electronic interference in Dominion Voting Systems	Other	Conservative
t3_k1f85l	Senseless Restrictions on Outdoor Activities Undermine the Goal of Curbing COVID-19	Other	Conservative
t3_k187ir	Dr. Barbara Ferrer got her PhD in social welfare from Brandeis and she has banned outdoor dining because it spreads covid in LA County. She isn't a doctor or have a background in biology/med school	Other	Conservative
t3_k1pxc0	Listen: Rush Limbaugh on the ‘True Story of Thanksgiving’ — ‘Long Before Karl Marx’ the Pilgrims Experimented with Socialism -- It didn't work.	Other	Conservative
t3_k1mnc5	Mattis failed to disclose role with global consultant tied to China in bombshell column	Other	Conservative
t3_k18mtm	Wait...A Judge Halts PA From Taking Further Steps in Certifying Its Election Results?	Other	Conservative
t3_k1f4vw	Lives And Livelihoods Will Be Destroyed While Dems Wait Until 2021 For The Vaccine And Stimulus	Other	Conservative
t3_k19ohf	George Washington: Thanksgiving Proclamation, 3 October 1789	Other	Conservative
t3_k18ipz	Lucky Joe gets phone call from China President Xi Jinping	Other	Conservative
t3_k1qs4y	Amistad Project Files Litigation Calling More Than 150,000 Wisconsin Ballots into Question	Other	Conservative
t3_k1hqam	Roman Catholic Diocese of Brooklyn Reacts to SCOTUS Ruling on Religious Freedom	Other	Conservative
t3_k186nr	Antifa Burns Nazi Manifesto's Section On Racism, Preserves Remainder As Part Of Own Platform	Other	Conservative
t3_k15twi	Bexar County judge, San Antonio mayor issue nightly curfew for Thanksgiving weekend	Other	Conservative
t3_k1qici	Complaint filed by Powell and L. Lin Wood in Michigan (Eastern District Court), Quotes from Whistleblower who Witnessed Chavez, Smartmatic Conspire	Other	Conservative
t3_k16jyd	Schiff, Nadler Call Flynn Pardon 'Abuse of Power'	Other	Conservative
t3_k1ht24	California AG's Brief Claims "Hate Speech" Is Constitutionally Unprotected	Other	Conservative
t3_k1gx4f	Mum's appointments cancelled due to Covid is told of cancer over ZOOM	Other	Conservative
t3_k1es20	Thanksgiving: Mayflower Compact Foundation of American Liberty	Other	Conservative
t3_k1f5ts	The Smartmatic Story: From Venezuela With No Love	Other	Conservative
t3_k1cna2	Denver mayor flying to Houston despite warning not to travel	Other	Conservative
t3_k19702	Be Grateful for Capitalism This Thanksgiving	Other	Conservative
t3_k16sb6	Firestorm on Twitter in Spain after trending topic calls for burning priests	Other	Conservative
t3_k1ogsc	Witness Testifies at Pennsylvania Election Hearing: Voting Machines 'Built to Be Manipulated'	Other	Conservative
t3_k1blcl	Small Social Gatherings and Dinners Aren’t Driving the Virus	Other	Conservative
t3_k1r4mc	‘Orwellian’: Parler CEO Eviscerates Facebook’s ‘Secret Internal Algorithm’	Other	Conservative
t3_k1k1u0	Supreme Court rules against Cuomo&amp;amp;apos;s coronavirus limits -- with Barrett playing key role	Other	Conservative
t3_k1agch	Feels like there are 2 separate realities	Other	Conservative
t3_k15ylk	The picture of U.S economy is worrisome, economists cry out	Other	Conservative
t3_k15poj	Conservatives only Discord Server	Other	Conservative
t3_k1f4lb	Giving Thanks in America	Other	Conservative
t3_k18g77	Pennsylvania Slams Judge’s ‘Overreach’ in Certification Ruling	Other	Conservative
t3_k1r36e	BBQ Rebellion: Restaurant Owner Arrested After Days of Defying Toronto Lockdown	Other	Conservative
t3_k1q5sy	China: State media step up campaign to muddy probe into Covid origin	Other	Conservative
t3_k1pxwe	UK: Number of children referred to social services for gang exploitation continues to rise	Other	Conservative
t3_k165xx	NYC sheriffs expanding COVID checkpoints for out-of-state visitors ahead of Thanksgiving	Other	Conservative
t3_k1ozi3	x Pentagon Purges Leading Advisors From Defense Policy Board	Other	Conservative
t3_k1d8rg	Watch Lou Dobbs Berate Young FOX News Hack on Live TV After He Minimized and Mocked GOP Hearing in Pennsylvania	Other	Conservative
t3_k18va7	Covid vaccination to get essential for international travellers | Flash News	Other	Conservative
t3_k18hh8	Wall Street banks slam lending proposal as ‘unworkable’ and ‘political’	Other	Conservative
t3_k1gity	Calvin Coolidge on the importance of Thanksgiving	Other	Conservative
t3_k1pyfz	Spain’s Government Declares War on the Spanish Language	Other	Conservative
