Name	Title	Coding	Subreddit
t3_k0effc	America is back' , says Biden as he unveils team	T	politics
t3_jzzo0f	Trump is worried Giuliani and legal team are ‘fools making him look bad’	TS	politics
t3_k0bzv9	Trump Stress-Tested the Election System, and the Cracks Showed	TS	politics
t3_k08031	Trump: I’ll Keep Charging Fraud Until Randy Quaid Is Satisfied	EF	politics
t3_k0g55x	Treasury Secretary Mnuchin is moving $455 billion of unspent stimulus money into a fund the incoming Biden administration can't deploy without Congress	TP	politics
t3_k0cv6t	Biden: 'It’s a team that reflects the fact that America is back'	T	politics
t3_k02obo	Opinion | Guess Whose Votes Trump Doesn’t Want Counted	EF	politics
t3_k08b0h	Pennsylvania certifies Biden as winner of presidential vote	ER	politics
t3_k0qkgl	Biden says the White House is cooperating fully with his transition, but that Trump still won't speak to him	T	politics
t3_k0wvag	Mueller prosecutor Andrew Weissmann says Trump should be investigated and charged with potential federal crimes after leaving office	TS	politics
t3_k0ujll	Trump adviser who was with Giuliani at press conference tests positive for coronavirus	C	politics
t3_k0scsk	To Prevent 'Another Right-Wing Authoritarian' Even Worse Than Trump, Sanders Says Democrats Must Pursue Bold Working Class Agenda	TS	politics
t3_k0wcwi	Obama says Americans voted for Trump because Republicans cast white men as ‘victims’	ER	politics
t3_k114eb	Megathread: President Donald Trump Pardons General Michael Flynn	TP	politics
t3_k0oad4	Roger Stone-linked group urges voters to write in Trump in Georgia runoffs as revenge against GOP | A fringe group of Republicans is trying to sink the GOP's Senate hopes as retaliation after Trump's loss in Georgia	TP	politics
t3_k0ve3q	Prosecuting Trump is the only way to heal the nation	TS	politics
t3_k0ps90	Trump's staffers are reportedly now avoiding him to stay out of legal jeopardy	TS	politics
t3_k0pdv5	Georgia secretary of state: My family voted for Trump. He threw us under the bus anyway.	ER	politics
t3_k0x6x6	Donald Trump is losing thousands of Twitter followers after election defeat	TS	politics
t3_k0qym3	Trump Seemed to Go Along With Biden's Transition Only After Aides Told Him He Didn't Have to Admit He Lost	T	politics
t3_k0v9ok	Fauci says he would 'absolutely' serve on a Biden coronavirus task force	BP	politics
t3_k0w7hg	Biden says Trump 'will go down in history as being one of the most irresponsible presidents'	TS	politics
t3_k0sg86	Schiff on possible Flynn pardon: Trump is 'acting like an organized crime figure'	TS	politics
t3_k0pueo	Flat-Out Sabotage' Already Underway as Mnuchin Tries to Put $455 Billion in Covid Funds Out of Biden Team's Reach	C	politics
t3_k0ysz6	Scarborough says he'll never return to Republican party after GOP supported Trump	TS	politics
t3_k0tujg	A New Jersey congressman is seeking to disbar Trump's personal attorney Rudy Giuliani after he touted election-related conspiracy theories	TS	politics
t3_k0mhkc	Biden Says It Would Be 'Difficult' To Lose Sanders Or Warren From Senate For Admin.	BP	politics
t3_k0ucpe	In refusing to acknowledge Biden win, McConnell again puts politics ahead of country	ER	politics
t3_k0zcp6	In an apparent dig at the Trump administration, Obama says Biden's foreign policy team will 'know where countries are'	TS	politics
t3_k0m346	Any Republican unwilling to defy Trump is not worthy of the label ‘patriot’	TS	politics
t3_k0ssez	China’s president Xi Jinping finally congratulates Joe Biden on election win	T	politics
t3_k0tp5h	McConnell Called Trump on Air Force One After Ginsburg Died, ‘Told’ the President ‘You’ve Gotta Nominate Amy Coney Barrett’: Report	TP	politics
t3_k0zt1g	‘We’re at war with the virus, not with one another’: Biden delivers Thanksgiving address as nation reels from coronavirus	C	politics
t3_k0rq4b	Secretary of State Brad Raffensperger releases scathing op-ed criticizing President Trump	TS	politics
t3_k0w03e	Biden’s IRS could finally give Trump’s tax returns to Democrats	BP	politics
t3_k0vri0	Trump's about to turn the GOP into one long, humiliating episode of 'The Apprentice'	TS	politics
t3_k0ss25	Twitter Users Mock Melania Trump's ‘Who Gives A F**k About Christmas’ Tree	TS	politics
t3_k0urqy	Adam Schiff Says If Trump Pardons Flynn He'd Be 'Acting Like An Organized Crime Figure'	TS	politics
t3_k0t1hf	Gaetz Urges Trump To Go Wild With Pardons, Including A Self-Pardon, To Own The Libs	TP	politics
t3_k0tmzh	El Paso moves to collect outstanding debt from 2019 Trump campaign rally	TP	politics
t3_k0kkvp	Trump Hasn’t Taken Questions From the Press in Three Weeks. He Just Held a Press Conference That Lasted 90 Seconds	TP	politics
t3_k0ki19	Minnesota certifies Biden victory	ER	politics
t3_k0rv3j	Trump's economic team accused of 'sabotaging' Biden before exiting	T	politics
t3_k0jm6y	McConnell Told Trump to Nominate Amy Coney Barrett on Night of Ginsburg's Death, Ex-Chief of Staff Says	TP	politics
t3_k0lq56	Fox News Ratings Plummet After Election. Is President Trump’s Criticism the Cause?	O	politics
t3_k0q91z	How Trump’s conspiracy theories have inspired some supporters to boycott the Georgia runoffs	TS	politics
t3_k0wd4c	Trump cancels plans to attend Pennsylvania GOP event on election	TP	politics
t3_k0u20u	Trump to reportedly join Rudy Giuliani at Pennsylvania election event after aides 'tried talking him out of' going	TP	politics
t3_k0w4pc	Rahm Emanuel doesn’t deserve a job in Biden’s administration	T	politics
t3_k0v7l7	Biden to receive first daily presidential briefing on Monday	T	politics
t3_k0yc64	New Poll Shows 68% of Americans Want Senators to Block Any Corporate Biden Nominees | Progressives are calling on the president-elect to reject a "Corporate Cabinet" and instead pick "people dedicated to working in service of the general welfare."	T	politics
t3_k0zcsn	Biff is president': Michael J. Fox says Trump has played on 'every worst instinct in mankind'	TS	politics
t3_k0wmlm	Trump bails on surveillance treaty used to monitor Russia, guts program of resources	TP	politics
t3_k0j6dp	Biden becomes first presidential candidate to win more than 80 million votes	ER	politics
t3_k0tgk3	Georgia secretary of state says Trump threw him under bus despite his support	TP	politics
t3_k12qwf	Trump suddenly irrelevant, Biden steals Thanksgiving spotlight with call for unity	TS	politics
t3_k11x1z	Trump Complains On Speakerphone To PA GOP That No One Will 'Overturn' Election For Him	EF	politics
t3_k0wtut	Trump’s transgender ban has harmed US military, experts find	TP	politics
t3_k10zvu	Mnuchin clawback may “sabotage” Biden by blocking $455B in COVID-19 funds — it may also be “illegal”. A watchdog says Mnuchin’s move violated the Cares Act. Democrats call it downright "corrupt"	C	politics
t3_k0r4z7	Trump to join Rudy Giuliana at a hotel in Pennsylvania for a Republican hearing into baseless voter fraud claims	EF	politics
t3_k0uq8x	AOC and Ilhan Omar sign petition calling on Biden not to give Bruce Reed administration role	T	politics
t3_k0rwl3	Biden Promises Bill Providing Pathway to Citizenship for 11 Million Illegal Immigrants in First 100 Days	BP	politics
t3_k13ard	Almost everything Trump said at a Republican event in Pennsylvania about the election was a lie or a conspiracy theory	TS	politics
t3_k0qym5	Can Trump's lawyers be disciplined for making false claims?	O	politics
t3_k11o5n	DOJ Is Still Trying to Defend Trump Against Rape Accuser E. Jean Carroll’s Lawsuit During Lame-Duck Session	TS	politics
t3_k0zwpq	Trump demands election results ‘overturned’ and claims GOP poll watchers ‘treated like a dog’	ER	politics
t3_k12h7v	Joe Biden Should Investigate Trump, Dem Rep Argues: 'We Cannot Dismiss Accountability'	BS	politics
t3_k0ml97	Biden officially tops 80 million votes, beating Obama's record by 10 million	ER	politics
t3_k0zes8	Trump campaign sued for attempting to disenfranchise Black voters	EF	politics
t3_k0r986	Biden searches for attorney general to restore Justice Dept.’s independence, refocus on civil rights	T	politics
t3_k0jv46	Trump campaign announces Arizona public hearing on election, but lawmakers say none is planned	EF	politics
t3_k0kyt4	Donald Trump plans to pardon former national security adviser Michael Flynn – reports	TP	politics
t3_k0qbo2	Canceling Student Debt Is Very Good. Biden Won’t Do It Unless We Make Him.	BS	politics
t3_k0tmc3	AOC insists Joe Biden can forgive student loans by executive order despite constitutional questions	BS	politics
t3_k0n40v	Trump's coup failed – but US democracy has been given a scare	O	politics
t3_k11y4x	Mueller prosecutor says next attorney general should investigate Trump	TS	politics
t3_k10g9z	Bernie Sanders Criticizes Trump for Touting Dow Record as Millions of Americans Won't Have Enough Food on Thanksgiving	TS	politics
t3_k0rpg4	Archbishop Gregory stood up to Trump. Now he’s about to be the first Black cardinal in U.S.	T	politics
t3_k0vvgw	60% of US Voters Support Biden Canceling $50,000 of Student Loan Debt Per Person: Poll	ER	politics
t3_k0zjrf	Trump Knows His Lawsuits Don’t Stand a Chance, But He’s Using Them to Raise Money for His Next Move	O	politics
t3_k0qm85	Geraldo Rivera joins fellow Fox News host Laura Ingraham in urging viewers to accept Trump's defeat, saying he can't 'continue denying the results of the election'	ER	politics
t3_k0w5xq	Republicans Are Really Trying to Argue that Biden’s Cabinet Picks Are Corrupt	BS	politics
t3_k115zd	Trump calls into Pennsylvania hearing, rambles about voter fraud on speakerphone	EF	politics
t3_k0zoxm	Truly Grotesque': On Way Out the Door, Trump Prioritizes Bringing Back Executions by Firing Squad and Electrocution	TP	politics
t3_k0uxvn	Georgia secretary of state says he's a Trump voter 'now being thrown under the bus by him'	TP	politics
t3_k10by4	Trump's Tweets Attacking the Election Echo Russian Trolls	EF	politics
t3_k0yqon	The Trump administration is aiming to bring back firing squads and electrocutions for some federal executions	TP	politics
t3_k0obaj	Wisconsin officials: Trump observers obstructing recount	EF	politics
t3_k0z706	Trump Lawyer Jenna Ellis Defends Truth Using Fake Teddy Roosevelt Quote | The campaign’s legal adviser posted a tweet using a quote falsely attributed to the 26th president defending truth.	TS	politics
t3_k12bmp	Pennsylvania AG and Lt. Gov blast Trump, "fake" GOP election hearing: "devoid of reality"	TS	politics
t3_k0x266	Biden: I am not going to shut down the economy, period	BP	politics
t3_k0k7de	Mike Pompeo Is a Global Arsonist. Can Biden Put Out His Fires? | The secretary of state is igniting diplomatic infernos left and right, leaving the next administration with untold damage on its hands.	O	politics
t3_k12s6a	House Democrats seek list of Trump appointees "burrowing in" to Biden administration	T	politics
t3_k0jrc7	Trump Is Said to Plan Pardon of Flynn	TP	politics
t3_k13uia	Ocasio-Cortez doubles down on Biden keeping Emanuel out for 'covering up a murder'	BS	politics
t3_k0xlfj	Trump cancels trip to GOP fraud “hearing” at Pennsylvania Wyndham after Giuliani exposed to COVID-19. The campaign said similar "hearings" were planned in Michigan and Arizona, but that was news to GOP officials there	C	politics
t3_k0t74f	Trump's bizarre Georgia play: He wants to show Republicans he's still the boss	TP	politics
t3_k0uq91	Ga. GOP Secretary of State Says Trump 'Threw' His Family 'Under the Bus'	TS	politics
t3_k0tigo	Obama criticizes Trump on pandemic response: 'It's not rocket science'	TS	politics
t3_k0vbim	Trump’s Team Is Sabotaging the Transition	T	politics
t3_k0n63e	Sanction Trump’s Election Lawyers—Now!	O	politics
t3_k0u1nd	Putting Trump past us is like exiting an abusive relationship: it takes time. Under Trump many had a ‘collective hypervigilance and anxiety of what he might do next’, experts say – so how do we unpack these past four years?	O	politics
t3_k0t0ml	Fact check: Trump lawyer Sidney Powell falsely stated he won election 'by a landslide'	ER	politics
t3_k0wk7g	Judge Rules Against Trump Ploy to Force Elderly Into Nursing Homes. Decision Blocks Effort to Keep States from Deducting Insurance, Union Dues from Home Healthcare Workers	TP	politics
t3_k12fkx	Trump’s Lawyers Just Performed Another Embarrassing “Election Fraud” Show	TS	politics
t3_k0vm1n	Joe Biden to deliver a Thanksgiving address seeking US unity	BP	politics
t3_k13c26	Trump’s hopes sputter to end in Michigan. ‘It’s over, and they know it.’	TP	politics
t3_k0qxw7	Trump Lawyer’s Latest Praise Of The President Goes Viral For All The Wrong Reasons : Jenna Ellis described Donald Trump as a “WARRIOR.” Critics had a field day.	TS	politics
t3_k0zh1q	Trump pushing through dozens of last minute policy changes – including use of firing squads	TP	politics
t3_k0pk8a	Trump Races to Weaken Environmental and Worker Protections, and Implement Other Last-Minute Policies, Before Jan. 20	TP	politics
t3_k0nd17	Trump Reportedly Planning To Pardon Michael Flynn, Start Of Spree	TP	politics
t3_k0q6ay	Trump Plans to Attend Republican Election Hearing With Giuliani	TP	politics
t3_k0v7qa	Another Trump campaign advisor tests positive for coronavirus as Giuliani heads to Gettysburg	C	politics
t3_k0sjsl	A warning from Europe: Trump may be leaving, but right-wing populism is not	O	politics
t3_k0qrz6	Biden laid out his first 100 days in office and said he wouldn't use DOJ as his personal 'vehicle' to investigate Trump	BP	politics
t3_k0zek5	Rouhani: Iran and US can return to time before Trump	BP	politics
t3_k1043w	Trump’s handling of coronavirus pandemic ‘shambolic’, says Obama	O	politics
t3_k11tae	DOJ appeals ruling that said it can't take the place of Trump in E. Jean Carroll defamation suit	TS	politics
t3_k0uf58	Canvassing board certifies Joe Biden's win in New Mexico	ER	politics
t3_k10uhs	Trump rants about overturning the election even as administration begins transition to Biden	ER	politics
t3_k0kaf1	Biden’s win brings new hope for peace deals with Denmark and Canada	BP	politics
t3_k0wf6f	GA Secretary Of State: My Family Voted Trump And Was ‘Thrown Under The Bus’	TS	politics
t3_k0uv7d	Trump’s Election Lies Failed, but the Damage Is Done | Trump’s supporters, already steeped in white grievance, are predictably receptive to the idea that “illegal voters” have succeeded in stealing their democracy.	O	politics
t3_k0uawe	Trump tweets string of falsehoods about Wisconsin absentee voters	ER	politics
t3_k0zqlf	Biden gives Thanksgiving address from Delaware	BP	politics
t3_k10ua8	White House Weighs Pardon Blitz Before Trump’s Exit	TP	politics
t3_k0swn8	Biden says he hasn't heard from Trump directly	T	politics
t3_k0rrfe	What do Trump's 'Muslim ban,' Ukraine, and Biden smear campaigns have in common? Giuliani. |	O	politics
t3_k0r0vi	The Transition Delay Is Going to Cost Lives - Biden’s transition to the presidency may finally begin, but the ramifications of Trump’s lame-duck sabotage will linger well beyond Inauguration Day	T	politics
t3_k0lxlj	Ingraham admits Trump lost — and saying otherwise is “lying”: “This constitutes living in reality”	ER	politics
t3_k0twoj	Joe Biden’s early picks for top advisors signal a return to stability, experience and sobriety	T	politics
t3_k0r3eo	Former Republican House speaker Paul Ryan tells Trump to concede and stop ‘undermining democracy’	ER	politics
t3_k0jgvv	Janet Yellen, Biden’s Treasury Pick, Could Be Key To Confronting Climate	T	politics
t3_k0zb6z	Joe Biden becomes first presidential candidate in U.S. history to surpass 80 million votes	ER	politics
t3_k0j044	Comment: The Damage Done, the Job Ahead — Expect Trump to keep lying from the sidelines, and for his followers to stand by him.	O	politics
t3_k0jukw	Trump tells confidants he plans to pardon Michael Flynn	TP	politics
t3_k0o7wk	Biden transition event disorienting for its competence, normalcy	T	politics
t3_k0ll9c	“This Keeps Me Up at Night” Radicalization experts fear what Trump’s fringes will do now—and they aren’t certain how to stop it.	O	politics
t3_k0zp9f	President-elect Biden Delivers Thanksgiving Address	BP	politics
t3_k101h5	Biden urges Americans to recommit to fighting pandemic in Thanksgiving address	C	politics
t3_k0te8w	President-Elect Biden Hits 80 Million Votes In Year Of Record Turnout	ER	politics
t3_k0xkq3	Trump’s Embarrassingly Bad Legal Case in Pennsylvania No wonder his campaign kept swapping out its lawyers.	TP	politics
t3_k0kves	America is back': Biden formally introduces national security, foreign policy team	BP	politics
t3_k0s17r	Biden Says It Would Be 'Difficult' To Lose Sanders Or Warren From Senate For Admin	BP	politics
t3_k0k8ic	Pennsylvania officials tell court to reject Donald Trump campaign appeal as new lawsuit filed in Wisconsin	ER	politics
t3_k11ip5	Column: Brace yourself for Trump’s scorched-earth attacks on health and safety	O	politics
t3_k13n1j	Shameful': Progressives are angry Biden is considering a Cabinet post for Rahm Emanuel despite his handling of the police shooting of an unarmed Black teenager	BS	politics
t3_k0k34c	Trump crams one last racist policy into his final days as president	TS	politics
t3_k1169e	Joe Biden Says the U.S. Will Lead on Climate. But First He Has to Regain World Leaders' Trust	BP	politics
t3_k124r4	How Democrats should exploit Trump’s continued effort to hold the GOP hostage	O	politics
t3_k0kxxw	Biden’s Appointment of John Kerry as Climate Envoy Sends a ‘Signal to the World,’ Advocates Say	T	politics
t3_k0yz88	Trump team’s bizarre legal fight channels the McCarthy era	TS	politics
t3_k0jll7	Mueller 'pit bull' calls for Biden attorney general to investigate Trump	BS	politics
t3_k0j6go	Trump and a Lesson in How Coups Fail	O	politics
t3_k0k3zh	Transition Gets Underway in Earnest as Biden Team Fans Out Across Capital	T	politics
t3_k0lrm0	A reliable pandemic forecasting model says cases will nearly double by Inauguration Day. As case numbers explode across the country, Biden is poised to inherit a drastically worse crisis	C	politics
t3_k0x19o	Trump Legal Team Wants Rudy Giuliani to Argue in Federal Court Again, But There Are Some Problems	TP	politics
t3_k10put	Joe Biden calls for shared sacrifice to fight the pandemic as Trump rails about baseless election accusations	C	politics
t3_k0wlug	Trump lawyer details far-fetched strategy to reverse Pennsylvania win for Biden	ER	politics
t3_k0mgqg	Donald Trump ‘plans to pardon’ former aide Michael Flynn	TP	politics
t3_k14dck	Trump takes his fraud claims to a hotel ballroom — by phone	EF	politics
t3_k0vsz3	Losing Hasn’t Changed Trump’s Stance on White Supremacy	O	politics
t3_k0r99r	Black voters concerned that Trump campaign's efforts to overturn election targeted them	ER	politics
t3_k0spjx	Trump shares bizarre videos and tweets by actor Randy Quaid about voter fraud, Fox News	EF	politics
t3_k11ggr	Trump refuses to accept Biden's win as transition proceeds	T	politics
t3_k0w5uj	Biden Announces First LGBTQ+ Appointee in His Administration	T	politics
t3_k0r8i1	Never Trumpers' Admit Trump Has Taken Over GOP, But They're Staying To Fight	O	politics
t3_k0tynj	Michigan lawmakers told Trump they have no role in election	ER	politics
t3_k0qrcf	Trump carries on a fight everyone else is abandoning	TS	politics
t3_k0qdok	Explainer: Can Trump's lawyers be disciplined for making false claims?	TS	politics
t3_k1dokd	Trump's inner circle is telling him that Giuliani and the rest of his legal team are making him look like an idiot, report says	TS	politics
t3_k16as8	Steve Schmidt: ‘We’ve entered the corrupt pardon phase of the Trump coup’	TS	politics
t3_k1fhlv	Mueller prosecutor says Trump should be investigated and face charges after leaving office	TS	politics
t3_k1cko2	Obama says lives could have been saved if Trump hadn't disbanded pandemic response unit	C	politics
t3_k15yeb	‘Absolutely No Allegations of Any Fraud’: Pa. Court Rejects Trump Campaign’s Appeal Over 69 Mail-In Ballots	EF	politics
t3_k1g099	Pranksters have claimed a Trump 2024 campaign website domain which labels Trump a 'loser'	TS	politics
t3_k1dsa2	Donor Sues Pro-Trump Group for $2.5 Million for Failing to Prove Voter Fraud	TS	politics
t3_k1lnms	Trump Is About to Hand Over Sacred Apache Land to a Mining Company	TP	politics
t3_k17277	Giuliani thinks Trump ‘may have won Virginia’ despite Biden winning state by nearly half a million votes	ER	politics
t3_k1ezlz	Trump’s conspiracies have MAGA world talking Georgia boycott	TS	politics
t3_k1as4m	El Paso lawyered up to try and collect $570,000 owed to the city by the Trump campaign from a rally 2 years ago	TS	politics
t3_k1g08g	Ex-Trump lawyer Sidney Powell files typo-filled lawsuits in Michigan, Georgia	TP	politics
t3_k1in3b	Why Biden shouldn't extend an olive branch to Republicans	O	politics
t3_k1en3v	Donald Trump Retweets Call to Pardon Himself	TP	politics
t3_k1ca3s	Trump urges Americans to ‘gather’ for Thanksgiving in direct contradiction of official Covid guidance	C	politics
t3_k17xny	Pro-Trump Group Donor Sues Over Failure to Expose Election Fraud	EF	politics
t3_k1i58k	Why Biden Has It Harder Than FDR and Lincoln — They had big congressional majorities to pass the New Deal and fund the Union Army. Biden is the rare crisis president without the majorities he needs.	O	politics
t3_k1ghc7	Donor sues pro-Trump group over failure to prove voter fraud: 'Empty promises'	TS	politics
t3_k1gtvp	Indian country showed up to beat Trump. How can you show up for Indian country?	O	politics
t3_k1oj3g	Trump supporters reportedly calling for boycott of key Georgia Senate races	ER	politics
t3_k1hz0i	Shame the Random, Unknown Government Officials Aiding Trump’s Coup Attempt	TS	politics
t3_k1eqs1	Want to Be Like FDR, Joe Biden? Make Your Thanksgiving Proclamations Rallying Cries - The 32nd president used every tool—even Thanksgiving Proclamations—to promote a moral vision for social and economic justice. Biden should do the same.	BS	politics
t3_k18fep	Wounded' Trump caves on Biden transition as allies abandon him	T	politics
t3_k178xy	Over 30 Trump Campaign Lawsuits Have Failed. Some Rulings Are Scathing. As President Trump continues to litigate the 2020 election, some judges have lost all patience. Here are some excerpts of their rulings.	ER	politics
t3_k1at5v	Representatives for 'Tiger King's' Joe Exotic are said to be chasing Trump down for a pardon and spending thousands of dollars to get it	TP	politics
t3_k1k1dk	Ex-GOP Pennsylvania governor condemns Trump's Gettysburg meeting as attempt "to undermine the republic"	TS	politics
t3_k1p866	Trump says he will leave the White House if Electoral College votes for Biden	ER	politics
t3_k1fr77	Trump’s Last Act: Risking National Security to Honor the Confederacy. He promises to veto the Defense Appropriations Authorization Act if it forces to Pentagon to change the names of bases and ships.	TP	politics
t3_k1e6ky	Obama says Republicans won votes for Trump by wrongly framing white men as victims	ER	politics
t3_k1f7lj	Joe and Jill Biden in Thanksgiving op-ed: 'We can be apart without being alone'	BP	politics
t3_k1cwkm	Donald Trump Is the Ultimate Super-Spreader | Trump didn’t merely bungle this country’s pandemic response; he stoked the flames of this third and largest surge.	O	politics
t3_k1h7nv	Get ready for Donald Trump’s shadow government — via Twitter and Fox News: Other Republicans, in fear of the wrath of Trump’s supporters, will obstruct Joe Biden at every turn.	O	politics
t3_k1gz8z	Trump’s Thanksgiving Message Urges People To ‘Gather,’ Despite Raging Pandemic	C	politics
t3_k169vg	Donald Trump Shares Deep State Conspiracy Article That Says 'We Are at War'	TP	politics
t3_k1jggr	Leading House Dems Demand 'Full Accounting' on Trump Order Allowing Purge of Federal Workforce	BP	politics
t3_k1o6m0	Comedians Buy Trump 2024 Website Domain to Call President a 'Loser'	TS	politics
t3_k1fxbr	Trump shares tweet saying he should pardon himself, rest of his admin	TP	politics
t3_k1hyjh	Biden takes his cue from Muhammad Ali as he copes with a dope — As Ali did with Foreman, Biden has let his rival punch himself out.	BS	politics
t3_k1mhcs	Trump retweets post from GOP ally Matt Gaetz suggesting the president pardon himself and whole administration	TP	politics
t3_k1mlgj	Midnight Ruling Exposes Rifts at a Supreme Court Transformed by Trump	TP	politics
t3_k1exsn	Obama says Republicans portrayed white men as ‘victims’ to win votes for Trump	ER	politics
t3_k1j285	Biden Urged to 'Honor Indigenous Sovereignty and Immediately Halt' Fossil Fuel Pipelines	BS	politics
t3_k1i6ol	Investor Sues to Get His $2.5 Million Back After Supporting True the Vote’s Flailing Pro-Trump Election Suits.	TS	politics
t3_k17k4y	Trump wages war on our country and the rule of law one last time	TS	politics
t3_k1e7r8	Trump retweets congressman urging him to pardon himself	TP	politics
t3_k1m30w	Some Trump voters still believe he can retain the presidency	ER	politics
t3_k1i78k	PA Lt. Governor to Trump lawyer Giuliani: Where's the voter fraud? | Rudy Giuliani and Donald Trump are still attacking Pennsylvania's election results. The commonwealth's Lt. Governor John Fetterman says the evidence for that fraud simply does not exist.	EF	politics
t3_k1fqxm	Biden predicted a GOP 'epiphany' after the election. Trump's standing in the way.	BS	politics
t3_k19487	Over phone, Trump tells Pennsylvania hearing U.S. election must be ‘turned around’	ER	politics
t3_k17yc5	Biden Urged to 'Honor Indigenous Sovereignty and Immediately Halt' Fossil Fuel Pipelines	BS	politics
