Name	Title	Coding	Subreddit
t3_jzlvmf	Walmart Thanks Government For Completely Obliterating Their Small Business Competition	Other	Conservative
t3_jzg2l7	Holocaust Museum In Florida Sparks Outrage After Adding George Floyd Exhibit	Other	Conservative
t3_jzisoe	After Trans Activists Try To Ban The Book ‘Irreversible Damage,’ It Becomes A Bestseller -- Trans activists keep bullying businesses into removing content through fear tactics rather than by countering the message with their own better one.	Other	Conservative
t3_jzm37a	This would literally kill me	Other	Conservative
t3_jzigda	Gavin Newsom Alerted To Illegal Activity By The Sound Of Children’s Laughter	Other	Conservative
t3_jzgsw6	Nearly 40 Shot Friday into Sunday Morning in Lightfoot's Chicago	Other	Conservative
t3_jzr6s5	Michigan's State Board of Canvassers votes to certify election	Other	Conservative
t3_jzl0m1	Harvard creating new ‘antiracism’ librarian job. It pays up to $240,300 per year.	Other	Conservative
t3_jzdeil	Beijing-Controlled News Outlet Paid US Newspapers Millions To Publish Propaganda This Year	Other	Conservative
t3_jzi3j1	‘It Will Be Epic’: Sidney Powell Releases Another Statement After Lawyers Say She’s Not On Team	Other	Conservative
t3_jzetu8	Calls for Britain to give asylum to Pakistani Christian girl forced to marry Muslim man who abducted and gang-raped her	Other	Conservative
t3_jznn1y	White Anti-Racism Author Robin DiAngelo Paid More Than Black Woman To Speak At Same Diversity Forum	Other	Conservative
t3_jzc6ln	Protesters take to the streets in California to bash Newsom's curfew orders	Other	Conservative
t3_jznunb	AOC suggests criticizing socialism is racist after reeling Dem colleagues blast radicalism	Other	Conservative
t3_jzikib	‘You’re Such A D**k’: New Jersey Gov Confronted Eating Maskless Outside With His Family	Other	Conservative
t3_jzr86o	Michigan board certifies Nov. 3 election results as one GOP canvasser dissents	Other	Conservative
t3_jzmmir	Climate Change Alarmist Harrison Ford Seen Landing Private Jet to Pick Up Son Ahead of Thanksgiving	Other	Conservative
t3_jzmo2n	U.S newspapers got paid millions to publish Chinese propaganda	Other	Conservative
t3_jzbvjq	‘You Can’t Enforce’ Thanksgiving Lockdowns, New Mexico Governor Says	Other	Conservative
t3_jzl8e6	Police Union Tells Embattled New York Subway Riders 'You're on Your Own' amid the recent rash of shoving incidents by unhinged assailants	Other	Conservative
t3_jzgqo5	“Burn It Down” -- Activists in Seattle want to abolish police, prisons, and courts.	Other	Conservative
t3_jzl2bz	Media Unveils Bold New Plan to Win Latino Support by Calling Them Racist	Other	Conservative
t3_jzd2gt	Late Justice Scalia's son blasts Harris for insinuating Catholic charity a hate group	Other	Conservative
t3_jzl07r	George Takei: ‘I Want to Live in a Country Where Kaepernick is Seen as a Hero and Kyle Rittenhouse Is Seen as a Terrorist’	Other	Conservative
t3_jzpsuv	Wauwatosa Mayor: "Guns have no place in shopping malls or other places in which crowds of people gather. Mayfair has a strict no-gun policy. If the shooter had complied with that policy, no one would have been hurt yesterday."	Other	Conservative
t3_jz9ec9	UK Physician - "Frankly, if it had not been for mainstream media and the government, I would not have even noticed there were a pandemic. I experienced no excessive dying, and no excessive becoming seriously ill."	Other	Conservative
t3_jzakuc	Michael Flynn: Sidney Powell temporarily suspended from Twitter	Other	Conservative
t3_jznw1e	Bill Gates Smears Parler and its Users	Other	Conservative
t3_jz8p9z	Sidney Powell Releases Statement	Other	Conservative
t3_jzb775	Dominion Voting Systems says it is 'physically impossible' for their machines to switch votes for candidates	Other	Conservative
t3_jzo4qi	AOC Suggests Criticizing Socialism Is Racist After Reeling Dem Colleagues Blast Radicalism	Other	Conservative
t3_jz96qb	Mass Protest at CNN: Your Fake News Gig Is Up	Other	Conservative
t3_jzlvqt	If the 2020 Election Was Held in a Foreign Country, the State Department and Western Media Would Declare it "Fraudulent" -	Other	Conservative
t3_jzlp06	Majority say they want GOP in control of Senate: poll	Other	Conservative
t3_jzjqn4	HISTORIC: Netanyahu Meets Saudi Prince in Saudi Arabia, Reports Say	Other	Conservative
t3_jzbq3q	Oregon governor backs idea of alerting authorities on neighbors who violate COVID-19 restrictions	Other	Conservative
t3_jzdp3j	Civil Disobedience: WATCH Angry business owners RESIST Cuomo's enforcement visit by Health Dept, Sheriff ⋆ The Savage Nation	Other	Conservative
t3_jzbcek	Do as I say, not as I do: California's top Democrats display their hypocrisy over COVID-19	Other	Conservative
t3_jzgnxw	WHO Director Dr. Tedros Moves the COVID-19 Goalposts Right Off the Playing Field. He wants you to know that vaccines won’t really change anything in response to COVID-19. His statement defies the management of any virus and there is no science to support it.	Other	Conservative
t3_jze123	After Pelosi Claims She Wants To Provide Relief – Records Show 40 Times The House Democrats Blocked Relief Aid	Other	Conservative
t3_jzbqfd	The U.S. has withdrawn from the Treaty on Open Skies	Other	Conservative
t3_jzit8p	America Needs A Special Counsel To Investigate Election Integrity, Stat -- With credible allegations of fraud compounding by the day, the American people deserve a special counsel investigation to set the record straight.	Other	Conservative
t3_jzdeqx	Statement from Sidney Powell to "WE THE PEOPLE"	Other	Conservative
t3_jzjdwn	Union Bosses Sink Bernie Sanders as Labor Secretary	Other	Conservative
t3_jziasi	Israel’s Netanyahu, Saudi Crown Prince Hold First Known Meeting	Other	Conservative
t3_jzn6nr	Progressives Declare War on Asians, Meritocracy and STEM - Asian Dawn	Other	Conservative
t3_jzfo1b	In Oregon Crack cocaine was legalized in a November 3rd referendum along with all other illicit drugs while plastic straws were prohibited. The Oregon Health Authority however wants people to stay safe and remember to pull your mask back into place between puffs on your crack pipe.	Other	Conservative
t3_jzpa5n	Dominion CEO Admits In Testimony This Year to Congress: Machines Rely On Chinese Parts From 'Screen Interface Down To Chip Level'	Other	Conservative
t3_jztb40	Stacey Abrams: ‘More than 750,000’ Georgians Requested Ballots for Runoff	Other	Conservative
t3_jzphli	Fury Erupts as George Floyd Exhibit Opens at Holocaust Museum	Other	Conservative
t3_jzntuf	Victor Davis Hanson: A Time of Chaos Upon Chaos Atop Chaos -- There is a series of battles to come in January 2021, in 2022, and in 2024 that will be definitive, if the chaos of 2020 does not become even more chaotic.	Other	Conservative
t3_jzjsi1	Viral Video: NJ Gov. Phil Murphy Confronted At Restaurant For Not Wearing Mask	Other	Conservative
t3_jznvgj	Another Democratic Governor Shuts Down State, Orders Masks Indoors And Outdoors	Other	Conservative
t3_jzl9we	Annoyed ABC Scolds Americans 'Not Listening,' Visiting Family on Thanksgiving	Other	Conservative
t3_jzky42	Portman: No proof of mass fraud that would change election result	Other	Conservative
t3_jzd21w	A dozen compelling allegations of voting irregularities in 2020 election	Other	Conservative
t3_jzmoe1	In threat to Iran, US sends heavy bombers to Middle East via Israel	Other	Conservative
t3_jzg5xr	California School District Bans Use of Classic Books in Classroom Over Racism Complaints	Other	Conservative
t3_jz9kq9	Guatemalan protesters storm Congress, light building on fire as clashes with government forces escalate	Other	Conservative
t3_jzlm2e	Newsom pressured to pick ‘woman of color’ to fill Senate seat. Former San Francisco Mayor Willie Brown is pushing Maxine Waters among others.	Other	Conservative
t3_jznk67	Antiracism Icon Robin DiAngelo Paid More Than Black Woman for Same Job	Other	Conservative
t3_jzm8ty	George Soros-linked election software company lies about ties with Dominion | One America News Network	Other	Conservative
t3_jznztj	Liberals’ race rhetoric is a power grab	Other	Conservative
t3_jzn6ft	Propaganda, Election Fraud and the Death of Journalism	Other	Conservative
t3_jzfv1z	Lib Priest's Bashing of ACB's Latest Decision Accidentally Admits We Were Right All Along	Other	Conservative
t3_jzajlb	Dr. Michael Yeadon, former VP of Pfizer, explains in video why the pandemic is essentially over	Other	Conservative
t3_jzrnbw	Pennsylvania bans alcohol sales at bars, restaurants on Thanksgiving Eve as COVID cases climb	Other	Conservative
t3_jzpk3o	Pennsylvania Bans Sale Of Alcohol At Bars, Restaurants Ahead Of Thanksgiving	Other	Conservative
t3_jzot34	Georgia extends use of absentee ballot drop boxes for Jan. 5 runoff amid surge in requests	Other	Conservative
t3_jzhkq9	Banks Give Black-Owned Businesses Advantage on Supply-Chain Finance Terms. Programs spring from multibillion-dollar commitments banks made to expand lending and investment after Black Lives Matter protests this year	Other	Conservative
t3_jz9gxv	Nicolas Sarkozy, former President of France goes to trial on charges of corruption	Other	Conservative
t3_jzqcst	The 2005 Carter-Baker Report Predicted Election Madness 15 Years Ago	Other	Conservative
t3_jzk9ow	LORD SUMPTION: Wrong for government to tell us what to do at Christmas	Other	Conservative
t3_jzpjnf	Qantas Airlines First to Require COVID Vaccine for International Flyers: 'That’s a Necessity'	Other	Conservative
t3_jzl4xr	DC bill wants to allow kids to take vaccines without parents	Other	Conservative
t3_jzr7e8	ICYMI: Diebold, the company accused of rigging the 2004 election for Bush, was bought out by Dominion in 2010.	Other	Conservative
t3_jzl009	The Latest Memorial to George Floyd Is in a Holocaust Museum	Other	Conservative
t3_jzsv09	AOC calls out Kyle Rittenhouse's $2 million bail release as 'protection of white supremacy'	Other	Conservative
t3_jzjms3	China Proposes Global 'Track and Trace' System for Travel Reset	Other	Conservative
t3_jznk71	CDC Advises Family Households To Ostracize College Students Returning Home For Thanksgiving	Other	Conservative
t3_jzmb9p	House GOP wins suggests party growth, possible majority in 2022 | One America News Network	Other	Conservative
t3_jzl531	Will Republicans Learn From The 2020 Election?	Other	Conservative
t3_jzozry	Florida Holocaust Museum sparks fury by adding George Floyd exhibit	Other	Conservative
t3_jzp9ef	Business Owners March Against Governor Murphy's Executive Orders	Other	Conservative
t3_jzp1ge	Election Fraud Is Too Important To Be Left To Conspiracy Theorists	Other	Conservative
t3_jzqot1	COVID-19 vaccines could be required for certain jobs	Other	Conservative
t3_jzk30j	Kevin McCarthy: Voters Have Rejected Pelosi's 'Socialist' Agenda	Other	Conservative
t3_jzq127	Tennessee Ban On Abortions Due To Down Syndrome, Race, Sex Partially Upheld By Appeals Court	Other	Conservative
t3_jzjhvd	5 NBA Players Meet With Pope Francis To Talk Social Justice	Other	Conservative
t3_jzmf8v	: Election 2020 -- Are we witnessing the beginning of the end of wokeism?	Other	Conservative
t3_jzl8yl	Pope Francis hosts NBA players to talk social justice.	Other	Conservative
t3_jzj86s	France: Macron and his Islamic Rivals | Jayzoq	Other	Conservative
t3_jzsnjz	CNN Drowned Out by Protesters Chanting 'CNN Sucks! CNN Sucks!'	Other	Conservative
t3_jzrtf9	The Lancet says the PCR false positive rate is unknown but could be up to 4%. Others have suggested 5%. We are testing 1.5 million a day. That's a FP rate of 75,000 a day if the 5% is true. The more we test the more FP there are.	Other	Conservative
t3_jzrfch	The Government's Reckless Student Lending is Creating a Budget Hole Akin to the 2008 Crisis, New Analysis Shows	Other	Conservative
t3_jzpv35	School allows boy into girls locker room while girls cry their privacy will be violated	Other	Conservative
t3_jziqzk	Inside the Fight to Abolish Police in Philadelphia	Other	Conservative
t3_jzh16z	"Kracken" is a ClA Hacking Program	Other	Conservative
t3_jz8cld	Wikileaks Dump - “KRAKEN” is a CIA Hacking Program	Other	Conservative
t3_jzqcvx	2005 Carter-Baker Report Could Have Averted Problems With 2020 Voting	Other	Conservative
t3_jzho94	Watergate reporter Carl Bernstein lists 21 GOP senators	Other	Conservative
t3_jzpn2o	Top 50 Conservative Colleges	Other	Conservative
t3_jzo284	Conservatives, speak up	Other	Conservative
t3_jznv4k	These NHS Staff Were Told The Rushed Swine Flu Vaccine Was Safe, And Now They’re Suffering The Consequences	Other	Conservative
t3_jzn0r6	Official How-To Guide for Safely Celebrating Thanksgiving in 2020. By following our guide, readers can comfortably socialize with their friends and family instead of living in isolation from their loved ones because of a virus with a 99.997% survival rate.	Other	Conservative
t3_jzit58	Who’s Afraid of the Common Good?	Other	Conservative
t3_jzie34	Help! Pollsters Have Fallen and They Can't Get Up!	Other	Conservative
t3_jztzwp	James Freeman: U.S. Media and Covid	Other	Conservative
t3_jzswjy	Lawmakers, Experts Warned of Election Vulnerabilities Years Ago	Other	Conservative
t3_jzs9qp	Private employers have qualified right to mandate employee COVID-19 vaccination	Other	Conservative
t3_jzr3q8	Joe Nocera: Schools Don’t Spread Covid. Teachers' Unions Don’t Care.	Other	Conservative
t3_jzl0wn	Why not ‘My Fuhrer’? Appeals court grills public college on forcing professor to call male student ‘miss’	Other	Conservative
t3_jzipm0	Democrats plan to bring back earmarks. Ready the pork barrel!	Other	Conservative
t3_jzfmoi	AstraZeneca; Covid Vaccine 70% Effective	Other	Conservative
t3_jzpb5r	Study: Canceling Student Loan Debts Won't Significantly Stimulate Economy	Other	Conservative
t3_jznr75	The Antifa Playbook	Other	Conservative
t3_jzmb1i	Here Is The Evidence	Other	Conservative
t3_jzjndl	Op-Ed: 2020 Election Results Show No Irregularities, By Ruth Bader Ginsburg	Other	Conservative
t3_jzji2k	What Makes Internet Trolls Tick?	Other	Conservative
t3_jzfyhc	Making sense of the news about Sidney Powell	Other	Conservative
t3_jztyv8	NBA Players Meet With Pope Francis At The Vatican To Discuss Social And Economic Justice	Other	Conservative
t3_jzrtr8	Florida might not force you to get a COVID vaccine — but it can. Here's why	Other	Conservative
t3_jzmp24	Taxes are Too High Right Now	Other	Conservative
t3_jzltdg	Christianity and the Future of American Conservatism | Mark Movsesian	Other	Conservative
t3_jzfytp	It's getting bad out there better cancel 4th of July.	Other	Conservative
t3_jzd882	Democrats Do Drama – We Need to Stay Resolved, Disciplined, and Driven	Other	Conservative
t3_jz8xxm	The 10 Best Anti-Riot Memes	Other	Conservative
t3_jzu1f1	Bill McGurn: A Heap of Thanksgiving Hypocrisy	Other	Conservative
t3_jzrilt	Emma Hogan: In an age of uncertainty, the 1980s look defiant	Other	Conservative
t3_jzqbom	Bloomberg editorial: Canceling student loan debt is a bad idea	Other	Conservative
t3_jzf5o6	Ricky Schroder poses with accused Kenosha shooter after helping fund his $2 million bond	Other	Conservative
t3_jzc1yg	Twitter to Open New ‘Spaces’ Feature First to ‘Women’ and ‘Marginalized’ Voices	Other	Conservative
t3_jz8xm9	L.A. County suspends outdoor dining at restaurants as coronavirus surges	Other	Conservative
t3_jzm76o	Why Fewer People Should Go to College	Other	Conservative
t3_jzixcy	Are Covid Patients Gasping ‘It Isn’t Real’ As They Die?	Other	Conservative
t3_jzfj32	Lee Smith: Behind the Scenes, Obama Never Left	Other	Conservative
t3_jztc6y	Apple lobbying against Uighur Forced Labor Prevention Act: Report	Other	Conservative
t3_jzt4eg	Prohibition in Pennsylvania: Governor halts alcohol sales day before Thanksgiving	Other	Conservative
t3_jzsvpu	Conservative Activist on Georgia's Second Recount: The Most Important Part Is Matching Signatures	Other	Conservative
t3_jzryh4	Charles Moore: The lack of opposition to (UK) Johnson’s Green Crusade is a sure sign of trouble	Other	Conservative
t3_jzqv4e	Former Pfizer Chief Science Officer: "Pandemic is Over", "Second Wave" based On False-Positive Tests	Other	Conservative
t3_jzjmci	Unemployment benefits are the worst kind of pandemic relief	Other	Conservative
t3_jzfdy5	Ilana Mercer: Simplest Source of Voter Fraud Is Baked Into the System (Noncitizen voters)	Other	Conservative
t3_jzad11	Henry Cabot Lodge on conservatism as the "great secret" of American political success—and the fundamental errors that define progressivism	Other	Conservative
t3_jz91f8	Hyperinflationary Great Depression Coming – Economist John Williams (Because of Loony Liberal Lockdowns?)	Other	Conservative
t3_jzu7dj	Mayor de Blasio’s New York City in chaos	Other	Conservative
t3_jzk8tb	George Soros-Linked Election Software Company Lies About Ties With Dominion	Other	Conservative
t3_jzfqw0	The “OFFICE”...	Other	Conservative
t3_jzsvyh	Oregon Gov. Brown says people should call the police on their neighbors if they see COVID restriction violations	Other	Conservative
t3_jzcdl4	Betsy Devos Department of Education: A Teacher's Defense	Other	Conservative
t3_jzb61v	Fighting Words	Other	Conservative
t3_jz9z58	Dems’ twisted vaccine politicking may put our recovery at risk: Devine	Other	Conservative
t3_jzugnr	Tennessee Court of Appeals upholds law banning abortions for Down syndrome! Life is winning!	Other	Conservative
t3_jzt3qq	John Cleese Accused Of Transphobia After Expressing Support For J.K. Rowling	Other	Conservative
t3_jzh8qm	All Americans Should Celebrate Thanksgiving Despite Covid	Other	Conservative
t3_jzubg1	Gerard Baker: Obama think's he's Moses leading us to the ‘Promised Land’ (Funny read)	Other	Conservative
t3_jzfz2b	Health Care is Not a Right, but a Service. We Must Remind Leftists of that Fact	Other	Conservative
t3_jztms2	Exhibit Q Ramsland Affidavit – #7, Att. #1 in Wood v. Raffensperger (N.D. Ga., 1:20-cv-04651) – CourtListener.com	Other	Conservative
t3_jzta45	Mark Levin educates on civil litigation for the ignorant talking heads	Other	Conservative
t3_jztzqb	Poll: Should state governments regulate how people can celebrate holidays during COVID-19?	Other	Conservative
t3_jztbif	Coronavirus updates: Los Angeles County closes in-person dining; 20M could get vaccine in December; CDC warns against cruise ships	Other	Conservative
t3_jz8798	Obama can't credibly racialize his party's failures - Former President Barack Obama continues to believe the world revolves around him.	Other	Conservative
t3_jz89z7	National Security Source Confirms “A Piece of Hardware Has Been Secured” in Germany	Other	Conservative
t3_jzt4d8	Illinois removes thousands of available hospital beds from state COVID-19 database	Other	Conservative
t3_jzrwbz	Political Lists and Facsisn: The Lincoln Project Terrorizes the Opposition	Other	Conservative
t3_jzav7h	Article from Sidney Powell	Other	Conservative
t3_jzsumw	Obama Talks and Talks and Talks About His Memoir and His Greatness. -- The Former President is fixated on “truth”—something that mattered very little to him during his presidency.	Other	Conservative
t3_k05bxt	Oregon Gov: People Should Report Neighbors’ Thanksgiving Gatherings With Too Many People	Other	Conservative
t3_k0c5qz	John Cleese, under fire from woke mob, hopes they all 'fry in their own sanctimoniousness and narcissistic posturing'	Other	Conservative
t3_k02cs1	California Pastor Temporarily Turns His Chapel Into a Strip Club to be Deemed "Essential"	Other	Conservative
t3_k06r8d	Congress Just Got Swept By A Red Wave – Out Of 27 ‘Toss-Up’ House Races, The Republicans Took All Of Them	Other	Conservative
t3_k08ub0	Pennsylvania Certifies Nov. 3 Election Results, Gov. Wolf Says	Other	Conservative
t3_k06tdi	Sidney Powell Keeps Telling Kids Their Christmas Presents Are Going To Make Their ‘Freaking Heads Explode’	Other	Conservative
t3_jzyr3p	‘No Masks, All Indoors’: Award-Winning Journalist Claims 22 People Attended Newsom Dinner, Not 12, $15k Bar Bill	Other	Conservative
t3_k06nuj	Feinstein drops out of Democratic leadership in Senate	Other	Conservative
t3_k02344	Mitt Romney Should Be Getting Nervous – His Senate Seat Could Be Challenged By Conservative Actor Scott Baio	Other	Conservative
t3_k07t2w	Journalist says Gavin Newsom's COVID-snubbing dinner party was far worse than reported: Attendees now 'privately laughing' at controversy'	Other	Conservative
t3_k068ed	Michigan County Board Approves Resolution to Impeach Gov. Whitmer - Truly Times - Conservative News	Other	Conservative
t3_k08m37	Fifth Circuit Permits Texas and Louisiana to Defund Planned Parenthood	Other	Conservative
t3_k08yfx	State Governor Frees All Drug Dealers To Provide Prison Space For Families Celebrating Thanksgiving	Other	Conservative
t3_k0dqhe	Chinese Government Lays Off Entire Propaganda Team As American Media Doing Their Job For Them	Other	Conservative
t3_jzyx43	Oregon Imposes 30 Days In Jail For Thanksgiving Gatherings	Other	Conservative
t3_k03hok	Hours After Gov. Newsom Enacts California Order – “Curfew Crashers” In 16 Cities Flood The Golden StateStreets	Other	Conservative
t3_k07311	Virginia Study: Remote Learning Damaging Students’ Education	Other	Conservative
t3_k07dth	US can kill its own citizens without review when state secrets are involved, DOJ lawyer argues	Other	Conservative
t3_k031hj	Federal Appeals Court: Texas, Louisiana Can End Planned Parenthood Funding	Other	Conservative
t3_k08gcr	Pope Francis backs George Floyd protests, slams COVID-19 skeptics in book	Other	Conservative
t3_jzzgdh	Seattle: Another 34 police officers leave as downtown businesses report an increase in crime	Other	Conservative
t3_jzx045	Media on All Out Assault on Governor Noem as she refuses to issue mask mandate	Other	Conservative
t3_jzvqkn	Pope Francis book backs George Floyd protests, blasts virus skeptics	Other	Conservative
t3_k07swg	Some college students plan to 'educate' conservative family members about their political, social views over Thanksgiving	Other	Conservative
t3_k06lxq	Feinstein to Step Down as Ranking Judiciary Dem after Progressive Disappointment with Barrett Hearings	Other	Conservative
t3_k00wfd	Walmart Thanks Government For Completely Obliterating Their Small Business Competition	Other	Conservative
t3_k0f9xd	OANN suspended from YouTube for 'misinformation'	Other	Conservative
t3_k02srs	Get ready for major backlash to the next wave of lockdowns. As public-health experts have largely jettisoned any claim to public trust.	Other	Conservative
t3_k0c84l	Rand Paul says the 'vast majority' of voting must be in person to mitigate potential for fraud	Other	Conservative
t3_k0986c	McConnell Pushing Forward, Relentlessly Confirming Judges	Other	Conservative
t3_jzx9o8	Gov. Cuomo floats hosting his elderly mom for Thanksgiving, sparks uproar	Other	Conservative
t3_k096u0	WALSH: New HBO Documentary On ‘Transkids’ Accidentally Tells Disturbing Truth	Other	Conservative
t3_jzzutr	Breaking: Founder of Overstock.com 100% confident that election was rigged and can prove it forensically through code..	Other	Conservative
t3_k08pkj	Twitter decided to censor posts that ‘could undermine faith’ in election process before a single vote was cast on election day	Other	Conservative
t3_jzvn0g	Gov. Andrew Cuomo Calls Sheriffs Who Won't Enforce His Thanksgiving Restrictions Dictators	Other	Conservative
t3_k0aqfo	Republican Sen. Perdue says he would fly AOC to Georgia to campaign for his Democratic opponent.	Other	Conservative
t3_k00v11	To Avoid Thanksgiving Restrictions, Family Having Several "Clumps of Cells" Over Instead	Other	Conservative
t3_k035iz	Patrick Byrne of Overstock: This election was rigged — deeply	Other	Conservative
t3_k05ash	Alleged Money Trail from China to Georgia Hints at Rigged Results and Certification Flip-Flops	Other	Conservative
t3_k08gpc	Why Does Gov. Andrew Cuomo Continue To Single Out Jews?	Other	Conservative
t3_k0do6x	CNN’s serious journalist Bryan Stelter says conservatives joining Twitter alternative, Parler, is a "threat to Democracy"	Other	Conservative
t3_k0b75h	Just Hours After Being Placed In Cuomo's Possession, Emmy Statue Dies Of COVID. "The Emmy was placed in a nursing home for safekeeping and almost immediately contracted the virus, passing away just hours later"	Other	Conservative
t3_k0cy07	After Fending Off Pandemic Challenger, Planned Parenthood Retains Title For Most Americans Killed In 2020	Other	Conservative
t3_k06dee	Tlaib denounces Pompeo's decision to recognize BDS as antisemitic	Other	Conservative
t3_k0d7ge	Group files emergency petition in Wisconsin after finding 150,000 potentially fraudulent ballots	Other	Conservative
t3_k0c6kn	In Seattle, 34 more officers ditch the force as city slashes police budget for a second time	Other	Conservative
t3_k0353k	Are the Republicans Writing Their Own Political Obituaries? Having your win stolen blatantly and yet concede it without a fight is not a sign of the moral high ground. Instead, it is a death sentence to your political future.	Other	Conservative
t3_k0deuw	Gov. Cuomo Cancels Thanksgiving with His 89-Year-Old Mother After Backlash	Other	Conservative
t3_k08zt9	Post-George Floyd, a Wave of 'Anti-Racist' Teaching Sweeps K-12 Schools Targeting 'Whiteness'	Other	Conservative
t3_k04l2n	Brits Who Test Negative For Covid-19 Could Get 'Freedom Pass' To Avoid Restrictions	Other	Conservative
t3_k05hsh	Maryland GOP Gov. Hogan: 'No Constitutional Right To Walk Around Without A Mask' (Video)	Other	Conservative
t3_k0d2ok	New Arkansas bill to criminalize nearly all forms of abortions	Other	Conservative
t3_k056rr	Strategic Disinformation and the 2020 Election -- The intelligence community is no longer prepared to defend America against foreign deception and disinformation.	Other	Conservative
