Name	Title	Coding	Subreddit
t3_jzs4qi	Detroit had more vote errors in 2016 when Trump won Michigan by a narrow margin. He didn’t object then.	ER	politics
t3_jzqk4b	Secret Service members asked about protecting soon-to-be-former president Trump full time in Florida: Sources | Agents in Trump's detail have been asked about relocating to West Palm Beach.	T	politics
t3_jzn0c8	Biden taps John Kerry as Special Presidential Envoy for Climate, marking the first time the NSC will have an official dedicated to climate change	BP	politics
t3_jzfpm4	Trump set on veto of defense bill over renaming bases honoring Confederates	BP	politics
t3_jz9j4j	Trump legal team shuns Sidney Powell as insiders and national security officials see no evidence supporting her voting machine claims	EF	politics
t3_jzfulz	Republicans as a multicultural working class party? That's Trump-level delusional thinking.	TS	politics
t3_jz8wcb	Dominion rep responds to Trump campaign claims in Fox News interview: 'Physically impossible' to switch votes	EF	politics
t3_jzaoie	In last-ditch bid to stay in office, Trump deploys his favorite tactics to bully and intimidate	TS	politics
t3_jzsjpm	Trump is reportedly worried that his legal team is made up of 'fools that are making him look bad'	TS	politics
t3_jzkuz6	Trump Faces Growing Calls From Biz Leaders To Concede After Legal Battles Fall Flat	T	politics
t3_jzqzld	Trump campaign forces Georgia taxpayers to pay for second recount after first one confirms its loss. A hand recount of nearly 5 million votes confirmed Biden's win, but Team Trump wants to milk taxpayers even more	EF	politics
t3_jzsr22	Michigan certifies election results, making Biden's win official	ER	politics
t3_jzhlu7	Trump's 'elite, strike force' legal team starts to shrink	TS	politics
t3_jzr5yp	Michigan Certifies Joe Biden's Election Victory	ER	politics
t3_jzorhc	Trump fears Giuliani, other lawyers in Biden vote challenge are ‘fools that are making him look bad’	TS	politics
t3_jztm0i	Trump Campaign’s Actual Argument in Appeals Court: We’re Only Trying to Disenfranchise 1.5 Million Voters, Not 6 Million Pennsylvanians	EF	politics
t3_jzobu4	Behind the scenes, Trump frustrated with his legal team's maneuvers	TS	politics
t3_jzlcxd	Trump Could Push Don Jr. and Ivanka in 2024, but Trumpism Is a Hard Sell Without Him	TP	politics
t3_jzmeyu	New report details Trump effort to seize thousands of acres of private land for border wall	TP	politics
t3_jzozd1	Why the Trump campaign’s big legal flameout in Pennsylvania seems like a turning point, even for Republicans	ER	politics
t3_jza1rz	Trump campaign cuts ties with attorney Sidney Powell after bizarre election fraud claims	EF	politics
t3_jzrye4	Michigan votes to certify Biden's win over Trump	ER	politics
t3_jzofom	Biden moves forward as GOP breaks with Trump rise	T	politics
t3_jzcjw9	Twitter, Facebook will hand official accounts over to Biden administration	T	politics
t3_jziwyr	What if Trump won’t leave the White House? A hostage negotiator, an animal-control officer, and a toddler whisperer have advice	T	politics
t3_jzo44d	Two years ago this week Trump was mocking a turkey for refusing to concede an election	T	politics
t3_jzc0q0	Trump’s lonely G-20 marks a fitting end	TS	politics
t3_jzquzq	GOP senator: No indication of widespread voting irregularities, window for Trump challenges is 'closing'	EF	politics
t3_jzk79i	Former GOP Ohio Governor Says Republicans Are Either ‘Afraid’ or ‘in Complete Lockstep’ With Trump	TS	politics
t3_jzpbvs	Biden chooses former Fed Chair Janet Yellen to be Treasury secretary, report says	BP	politics
t3_jzfcif	Trump Is Running Out Of Time As Key States Set To Certify That Biden Won	ER	politics
t3_jzbggz	The Motley Crew Leading Trump’s Election Challenges | Jared Kushner wanted a “James Baker-like” figure, but he ended up with a ragtag bunch of lawyers led by a raving Rudolph Giuliani, who made his first appearance in federal court in this century.	EF	politics
t3_jzlzl3	After looming so large in Washington, Donald Trump has shrunk into a small, petty man	TS	politics
t3_jzprxe	Trump’s Absurd ‘You Did It First’ Argument for Stealing the Election	EF	politics
t3_jztjh2	National Embarrassment Donald Trump Worried Lawyers Are Sullying His Pristine Reputation	TS	politics
t3_jzntq8	GM flips to California’s side in emissions lawsuit against Trump admin	TP	politics
t3_jzs06l	Michigan certifies Joe Biden's win despite Trump's GOP overtures | The Board of State Canvassers, which has two Republicans and two Democrats, confirmed the results on a 3-0 vote with one abstention	ER	politics
t3_jzsruy	Rush Limbaugh Does Full 180, Blasts Sidney Powell After Team Trump Disavowed Her	TS	politics
t3_jzhzmd	Reporter Carl Bernstein names 21 GOP senators who 'repeatedly expressed extreme contempt for Trump'	TS	politics
t3_jzr5f1	Michigan Election Board Certifies Victory for Biden	ER	politics
t3_jzk32t	Biden Backs Democrats’ Pursuit Of Bigger COVID-19 Relief Deal	BP	politics
t3_jziow1	Facebook will give presidential accounts to Biden even if Trump refuses to concede election	T	politics
t3_jzcq86	As Biden marches forward with Cabinet, Trump hopes likely to fade in key states	T	politics
t3_jzp967	General Motors Aligns With Biden, Pulls Out of Lawsuit Supporting Trump	TS	politics
t3_jz8ywc	Trump campaign legal team distances itself from Powell	TS	politics
t3_jztlp5	G.M. Drops Its Support for Trump Climate Rollbacks and Aligns With Biden	TS	politics
t3_jzidnq	A diplomatic powerhouse': Biden will nominate Linda Thomas-Greenfield as UN ambassador, reports say	BP	politics
t3_jzaxgb	Trump campaign files narrow appeal in Pennsylvania - It is seeking permission to reframe its argument again.	EF	politics
t3_jz95se	Reports: Biden to name long-time confidant Antony Blinken as Secretary of State	BP	politics
t3_jzphue	GOP senator, business leaders urge prompt Biden transition	T	politics
t3_jzb3ya	Trump campaign cuts ties with attorney Sidney Powell after bizarre election fraud claims | US news	EF	politics
t3_jzrnx5	Michigan certifies Biden victory in another blow to Trump	ER	politics
t3_jzgh8i	Antony Blinken: Biden's secretary of state nominee is sharp break with Trump era	BP	politics
t3_jzp2ts	Joe Biden nominates first woman to lead intelligence and first Latino to head homeland security	BP	politics
t3_jzoam2	Reality Forecloses on the Trump Presidency | A fading campaign collapses under the weight of finally having to back up big talk with actual substance.	TS	politics
t3_jzjyaw	Trump EPA removes tool states use to protect farmworkers, environment	TP	politics
t3_jzg3aa	Biden expected to pick longtime diplomat Linda Thomas-Greenfield as U.S. ambassador to U.N.	BP	politics
t3_jzr88b	Michigan election board certifies 154,000-vote victory for Joe Biden, another setback in Trump’s effort to overturn election results	ER	politics
t3_jzrzv8	Rush Limbaugh Knocks Trump's Lawyers For Not Providing Voter Fraud Proof	EF	politics
t3_jz8l93	Top Biden adviser seen as making tech regulation more likely	BP	politics
t3_jzsna1	King of Jordan becomes first Arab leader to speak with President-elect Biden	T	politics
t3_jzi67y	More Republicans acknowledge Biden's victory, as two key states set to certify election results	ER	politics
t3_jzn3cr	Biden Taps John Kerry For New National Security Role Focused On The Climate Crisis	BP	politics
t3_jzm6f8	Carl Bernstein names 21 GOP senators who privately express “contempt” for Trump but still enable him	TS	politics
t3_jzsfv2	Obama calls Trump era an 'anomaly' in Canada-U.S. relations	O	politics
t3_jzu2rx	Michigan Certifies Election Results, Declaring Biden Winner In New Blow To Trump	ER	politics
t3_jztkzj	Trump fears Giuliani, other lawyers in Biden vote challenge are 'fools that are making him look bad'	EF	politics
t3_jzmemb	Trump Lawyer Tries To Toss Out His Own Vote In Wisconsin Recount	EF	politics
t3_jzfp15	Trump’s Anti-LGBTQ Agenda Has Been Hidden in Plain Sight	TP	politics
t3_jzreko	Michigan's state board certifies Biden's win	ER	politics
t3_jzn4mo	Despite Trump’s prod, Mich. to consider certifying Biden win	ER	politics
t3_jzst4r	Trump fears Giuliani, other lawyers in Biden vote challenge are 'fools that are making him look bad'	EF	politics
t3_k07ocv	US election: Biden becomes first-ever presidential candidate to receive 80 million votes	ER	politics
t3_k08ewo	Brennan takes final shot at Trump: 'I leave his fate to our judicial system, his infamy to history, &amp; his legacy to a trash heap'	TS	politics
t3_k07nxi	Pennsylvania certifies Biden's victory	ER	politics
t3_k028s9	Roger Stone-Tied Group Threatens GOP: If Trump Goes Down, So Does Your Senate Majority	ER	politics
t3_k08slh	On Night of Ginsburg’s Death, McConnell Pushed Trump to Nominate Amy Coney Barrett	TP	politics
t3_jzvxxd	Trump campaign loses 5 more cases in Pennsylvania Supreme Court decision	EF	politics
t3_k055sr	Republicans sold out democracy to appease Trump's loser tantrum	TS	politics
t3_k07sfh	It Actually Was a Landslide: 80 Million Votes and Counting For Biden; The “red mirage” has vanished to reveal a blue mandate for President-Elect Joe Biden	ER	politics
t3_k0az01	Biden accuses Trump of ‘outright cruelty’ at the border as he introduces Homeland Security pick	TP	politics
t3_k06l7z	Yes, the Biden administration should hold Trump accountable	BP	politics
t3_jzuvas	Report of a 'souring' relationship between Trump and Giuliani	TS	politics
t3_k05kkv	Every Day Trump Repeatedly Emails His Supporters a Dangerous Message: Democracy Doesn’t Work. Be outraged, don’t accept the election results…and send money.	ER	politics
t3_k02n7d	Should Trump Be Prosecuted?	TS	politics
t3_jzv0k7	Politicizing masks ‘is like politicizing toilet paper,’ Biden coronavirus adviser says	O	politics
t3_k047z0	Press: Trump's biggest fear is — lock him up	TS	politics
t3_jzx12o	Here Come the Adults | Biden’s Cabinet is shaping up to be everything that Trump’s was not.	BP	politics
t3_jzyvdn	Lindsey Graham calls Biden, Pelosi and Schumer "trifecta from hell," says they'll end Electoral College	BS	politics
t3_jzvqda	Trump Lawyer Appears on Fox Touting ‘Promising’ Case in Pennsylvania After It’s Thrown Out by Judge	EF	politics
t3_k03h7b	Trump Push To Invalidate Votes In Heavily Black Cities Alarms Civil Rights Groups	EF	politics
t3_k02ya3	Rachel Maddow Rings The Alarm On How Trump's 'Setting The Place On Fire' As He Leaves	T	politics
t3_k05npo	Trump Is Still President, Even Though He’s Not Acting Like One | The federal government has essentially stopped functioning as a federal government.	TS	politics
t3_jzv6i4	‘Bye bye Trump’: Ilhan Omar and others celebrate as president finally begins transition	T	politics
t3_k05r0v	Enough cowardice: Democrats must forge ahead, without caring what the Trumpers say	T	politics
t3_jzwk4e	The Secret Service is reportedly preparing for Trump's 'post-presidency life'	T	politics
t3_jzuphz	Trump goes out with a whimper and a tweet. It was always going to be that way	T	politics
t3_k07u24	Pennsylvania governor: Democrat Joe Biden certified as winner of presidential election in state	ER	politics
t3_jzw3ni	75 Percent Of Lawyers Say They Wouldn’t Support Their Firm If They Represented Donald Trump — Lawyers do *not* approve of what Jones Day's doing.	O	politics
t3_k0bsrn	Ivanka Trump called out for boasting about drop in greenhouse emissions: "This is largely because of the pandemic"	O	politics
t3_k03r9y	‘A passing attempt at adulthood’: Stacey Abrams gives scathing reaction to Trump finally starting transition	T	politics
t3_k04x2c	Cannabis stocks surge after Trump administration sets formal transition in motion	T	politics
t3_k03hse	Trump campaign loses 5 more election cases in Pennsylvania	EF	politics
t3_k08z5i	President-Elect Joe Biden Clinches Presidency—Again—as Pennsylvania Certifies Election Results	ER	politics
t3_jzvf9k	Dr. Redlener: Trump’s denial of science has ‘poisoned’ this country	O	politics
t3_k09ns0	Pennsylvania, Nevada certify Biden as winner of presidential vote	ER	politics
t3_jzyoyz	Laura Ingraham Admits It’s Over for Trump: ‘Biden Will Be Inaugurated’	T	politics
t3_k0dtv5	White House has signed off on Joe Biden getting the President's Daily Brief	T	politics
t3_k0cdoc	Trump ignores reporter’s question about trying to pardon himself after doing so for turkey	TS	politics
t3_k033f1	Republican official: Trump efforts to undermine Georgia results could 'suppress the vote' in U.S. Senate runoff elections	EF	politics
t3_k05u50	Glum Laura Ingraham Tells Fox Viewers It’s Done: ‘I’d Be Lying’ If I Said Trump Still Had A Chance	O	politics
t3_k04a0b	Rush Limbaugh Criticizes Trump Campaign for Hyping Up 'Blockbuster' Voter Fraud Evidence: 'Nothing Happened… Not Good'	EF	politics
t3_k06g46	Shameful and Concerning He Is Even Being Considered,' Says AOC as Rahm Emanuel Floated for Role in Biden Cabinet	BP	politics
t3_k06bmj	Trump Mocked After Telling GOP to Listen to Randy Quaid's Election Demand	TS	politics
t3_jzy84b	Midtown Trump Tower To Have Reduced Security After President Leaves Office in January	T	politics
t3_jzx73a	Trump's effort to steal the election is done	EF	politics
t3_k03iou	In Break From Trump, Biden Opts for Experience, Expertise for Top National Security Jobs	BP	politics
t3_k09n7r	Nevada Supreme Court certifies Joe Biden's win in Nevada, making his win in the battleground state official	ER	politics
t3_k05ixh	2 in 3 say coronavirus relief should be Biden's top priority in first 100 days: poll	O	politics
t3_jzvrkx	Trump came in promising so much winning. He’s going out with so much whining.	T	politics
t3_k04vzj	Trump’s dam finally breaks. But we cannot go through this again.	O	politics
t3_k00ahk	Trump says he ‘will never concede’ and transition process has nothing to do with election result	T	politics
t3_k06pds	Fox News' Laura Ingraham and Tucker Carlson distance themselves from Trump	TS	politics
t3_k04qk9	Jon Ossoff Tries to Drive Wedge Between Georgia Trump Voters, GOP Senate Candidates Over Biden Win	ER	politics
t3_k0942q	Melania Trump wanted to light the White House with rainbow colors for Pride month. She got told no.	TP	politics
t3_k0d1g3	Well That Was Weird as Sh*t': As More States Certify His Defeat, Trump Holds 60-Second Briefing to Brag About Stock Market	ER	politics
t3_k0ahv4	Judge Emmet Sullivan Will Oversee Voting Rights Act Case Accusing Trump of Anti-Black Campaign to Overturn Election	EF	politics
t3_k07q55	Joe Biden crosses 80 million votes, 10 million more than Obama got	ER	politics
t3_k0azls	Trump’s Enablers Are Sabotaging the Georgia Senate Runoff Election–and Helping Democrats. There’s a weird, right-wing push to boycott January’s pivotal U.S. Senate runoffs. Is Trump angry enough to join it?	ER	politics
t3_k03zxy	The EU thanks Joe Biden for his 'clear support' in Brexit dispute with the UK	BP	politics
t3_k05ep2	Surgeon General Issues ‘Dire’ COVID-19 Warning As Trump White House Plans Indoor Parties	O	politics
t3_k08659	Pennsylvania certifies Biden victory	ER	politics
t3_k0ammd	Nevada Supreme Court Certifies Biden’s Victory Over Trump	ER	politics
t3_k0c5mr	Paul Ryan calls for Trump to accept results: 'The election is over'	ER	politics
t3_k04620	Beyond an embarrassment,' legal experts say of Trump and Giuliani's floundering efforts in court	EF	politics
t3_k07zev	Computer repairman who claimed he gave Hunter Biden data to Giuliani closes shop as laptop saga gets stranger	BS	politics
t3_k0a761	Trump brags about Dow 30,000 at surprise press conference, leaves after a minute	TP	politics
t3_k09pwl	Atlanta Hawks Arena, Which Played Huge Role in Biden Winning Georgia, to be Used Again for Senate Runoffs	ER	politics
t3_k0djl7	Trump Insists He’s Still Going to Be President as White House Landlord Asks For Forwarding Address for Security Deposit	T	politics
t3_jzzepz	Trump dismantles decades-old surveillance treaty irreparably on his way out the door	TP	politics
t3_k07jm6	Column: Trump lost and his lawsuits are garbage. But please keep donating! The grift must go on.	EF	politics
t3_jzyzyc	Should Joe Biden cancel billions in student loan debt?	BP	politics
t3_k08kqr	Pennsylvania just certified its presidential election results, officially declaring Joe Biden the winner	ER	politics
t3_k0dyrm	The Republican Party Is Dead. It’s the Trump Cult Now.	TS	politics
t3_k0a31m	Biden-Harris ticket the first in US history to surpass 80 million votes	ER	politics
t3_k02329	Revealed: Trump Officials Rush to Mine Desert Haven Native Tribes Consider Holy	TS	politics
t3_jzwb0o	Sidney Powell Undermined Georgia GOP During Crucial Senate Runoff Before Trump Campaign Cut Her Loose	TS	politics
t3_jzvx08	NYPD planning to reduce police presence, congestion around Trump Tower: Sources tell ABC News	T	politics
t3_jzy6dc	Biden Supporters In Pennsylvania Look Ahead To A 'Traditional Presidency'	T	politics
t3_k0ala4	Trump Turns to Randy Quaid for Guidance in Overthrowing Democracy	EF	politics
t3_k08xyk	Democrats didn't refuse to acknowledge Trump’s 2016 victory	T	politics
t3_k0dwtt	75% of every donation to Trump's leadership PAC could actually be spent by the president himself on things like paying family members or financing a 2024 bid	TS	politics
t3_jzvxtn	It’s time Republicans put country over Trump’s injured ego	TS	politics
t3_k0f7jr	Biden unveils a national security team without grifters, trolls or fanatics	BP	politics
t3_k08q8s	Joe Biden Certified As Winner Of Presidential Election In Pennsylvania	ER	politics
t3_k0coc2	Trump is junking a treaty - and two planes - designed to stop nuclear war	TP	politics
t3_k060rf	Laura Ingraham says that Biden will be president: ‘This constitutes living in reality’	T	politics
t3_jzx3px	Trump probably won’t be the last politician to reject an election outcome without evidence	EF	politics
t3_k0feo8	Georgia Republican Voters Consider Boycott Of Special Senate Election In Support Of Trump	ER	politics
t3_k04nof	Biden prioritizes climate crisis by naming John Kerry special envoy	BP	politics
t3_k09pft	Pennsylvania Supreme Court rejects Trump campaign's effort to block counting certain absentee ballots	EF	politics
t3_k0eshp	Trump Appointee Unconstitutionally Interfered With VOA, Judge Rules	TS	politics
t3_k06dr2	No, It Wasn’t a Coup Attempt. It Was Another Trump Money Scam.	EF	politics
t3_k0beyi	Donald Trump stands up for the Confederacy one last time	TP	politics
t3_jzwgzq	Rush Limbaugh, Michigan, GSA hammer nails into coffin of Trump's election fraud claims	EF	politics
t3_jzwrvx	NYT reporter Maggie Haberman thinks Trump's tweet is 'the closest to a concession' he'll give	T	politics
t3_k08fht	Rubio Receives Swift Dunking For Poor Attempt At Painting Biden As An Elitist	TS	politics
t3_k061wu	Republicans With Any Love of Country Must Acknowledge That Trump Has Lost	T	politics
t3_k0359b	It's over for Trump	T	politics
t3_jzvflg	Pennsylvania counties certify election results despite isolated pushback and baseless fraud claims from Trump allies	ER	politics
t3_k0e2uk	Donald Trump's Destruction Of Documents	TS	politics
t3_jzx7gy	Rush Limbaugh knocks Trump's legal team: They promised 'bombshells' at press conference and 'nothing happened'	EF	politics
t3_jzuuec	Biden team wants to understand Trump effort to 'hollow out government agencies'	TP	politics
t3_k0dncv	Marco Rubio Gets Ripped For Criticizing Biden’s ‘Ivy League’ Foreign Policy Team	TS	politics
t3_k00iks	Trump Dismantles Decades-Old Surveillance Treaty Irreparably On His Way Out The Door | Rachel Maddow	TP	politics
t3_k0bfgp	Trump shares bizarre videos and tweets by actor Randy Quaid about voter fraud, Fox News	EF	politics
t3_k0axma	Biden win over Trump in Nevada made official by court	ER	politics
t3_jzvdc2	An OAN Host Has Been Helping Rudy With Trump’s Legal Efforts	EF	politics
t3_k0d4sz	Canvassing board certifies Joe Biden's win in New Mexico	ER	politics
t3_k09adn	Pennsylvania finalizes U.S. election results for Biden: governor	ER	politics
t3_k08hk3	America survived Trump's coup attempt. The media needs to be clear about why.	EF	politics
t3_jzyror	Federal judge calls Trump suit argued by Rudy Giuliani "Frankenstein's Monster" and dismisses case	EF	politics
t3_k034z9	The Trump administration may privatize Fannie Mae and Freddie Mac — and it could disrupt the nation’s housing-finance system	TP	politics
t3_k0dmkk	State board certifies Joe Biden as winner in Minnesota	ER	politics
t3_k0as5g	Judge rebukes another frivolous Trump lawsuit, allowing Pennsylvania to certify results	EF	politics
t3_k0c4gk	Gov. Doug Ducey: 'Joe Biden did win Arizona'	ER	politics
t3_k0f9d4	Well that was weird as s***': Reporters caught on hot mic baffled by Trump's minute long press conference | The president previously warned voters that the stock market would tank if Joe Biden won the election	TP	politics
t3_k07b93	Donald Trump Is Now Retweeting Randy Quaid’s Election Rants And Do-Over Calls	EF	politics
t3_k07txz	Pennsylvania certifies Biden as winner of presidential vote	ER	politics
t3_k024k0	Biden says the Trump White House won't give him COVID stockpile information. Here it is.	TS	politics
t3_k0a3tb	Trump shares Randy Quaid video: 'Fox is dead to me'	O	politics
t3_k0afvh	Ducey acknowledges Biden victory in Arizona for 1st time	ER	politics
t3_k08vm4	Pennsylvania certifies Biden’s victory as battlegrounds make 2020 results official	ER	politics
t3_k081o8	Pennsylvania certifies results of 2020 presidential election, giving Biden the win	ER	politics
t3_k0c01b	How Trump’s conspiracy theories have inspired some supporters to boycott the Georgia runoffs	O	politics
t3_k07fhk	Janet Yellen Is Probably the Best Treasury Secretary We Could Expect from a Biden Presidency	BP	politics
t3_k05ze0	Biden cabinet: Janet Yellen set to become first female treasury secretary	BP	politics
t3_k045ov	Taiwan says is having 'good interactions' with Biden team	BP	politics
t3_k0bpfr	Two more parting shots from Trump aimed squarely at disabled workers	TP	politics
t3_k01a73	After Chaotic 4 Years, Wall St. Is Itching to Unfollow @realDonaldTrump - President Trump turned his Twitter feed into a singular source of market volatility. Now, investors are looking forward to markets free of presidential tweets.	TP	politics
t3_k0d8w9	AOC and Ilhan Omar want to block Biden’s former chief of staff	BP	politics
t3_k041rg	Europe hopes for reset, end to ‘damage control’ under Biden	BP	politics
t3_k0d7kj	Trump administration wants to cut food stamps to thousands of seniors, lawmakers say	TP	politics
t3_k0abt3	President-elect Biden Announces Foreign Policy and National Security Posts	BP	politics
t3_k01f68	Watch Laura Ingraham Finally Tell Fox News Viewers That Biden Beat Trump	ER	politics
t3_k0bb2x	Trump’s QAnon Lawyer Inspired Even More George Soros Disinformation	TS	politics
t3_jzwige	PA Supreme Court rejects Trump challenge to absentee ballots in Allegheny County	EF	politics
t3_k0ftlb	McConnell pushed Trump to nominate Coney Barrett on the night of Ginsburg's death: report	TP	politics
t3_k0f0zp	Watch Trump's Stock Market Collapse Prediction Go Down in Flames	TP	politics
t3_k03ye7	Immigration Advocates Push Biden to Not Just Bring Back DACA But Expand It	BP	politics
t3_k0c42y	Biden win over Trump in Nevada made official by court	ER	politics
t3_jzvws9	Trump previewed his legal strategy 2 years ago, when he said a turkey 'refused to concede and demanded a recount'	EF	politics
t3_k0g41t	YouTube suspends One America News, a Trump favorite, for peddling pandemic misinformation	TS	politics
t3_k09m8g	Pennsylvania certifies election results for Biden	ER	politics
t3_k0allo	Pennsylvania certifies election results, sealing state victory for Biden	ER	politics
t3_k080lt	Pennsylvania certifies Biden as winner of presidential vote	ER	politics
t3_k0e454	Paul Ryan calls on Trump to concede and end lawsuits	T	politics
t3_k083ym	Pennsylvania Certifies Biden as Winner, Driving Stake in Trump’s Legal Effort	ER	politics
t3_k0e1h9	Biden-Harris ticket surpasses 80 million votes: new record	ER	politics
t3_k039s1	Biden Puts White House on Climate War Footing	BP	politics
t3_k0dlh2	Trump's DOJ Backs Down on Deporting Women Alleging ICE Gynecological Abuse	TP	politics
t3_k08kqp	The Damage Is the Point | Trump may not be able to extend his reign, but he can aid and abet his party by further curtailing the right to vote.	EF	politics
t3_k07khz	Kremlin and Putin will not recognise president-elect Biden despite Trump announcement	T	politics
t3_k0ezft	Biden to begin receiving classified Presidential Daily Briefings	T	politics
t3_k05ynk	Fox's Laura Ingraham says Biden will be inaugurated: 'This constitutes living in reality'	T	politics
t3_k0db7w	Biden picks Alejandro Mayorkas, a son of Jewish Cuban refugees, to lead the Department of Homeland Security	BP	politics
t3_k03gjd	Biden unveils his administration as Trump's firewall crumbles	BP	politics
t3_jzw3mj	Biden names climate statesman John Kerry as climate envoy — President-elect Joe Biden has picked climate-change older statesman John Kerry for a newly created role of climate envoy for national security	T	politics
t3_k00s3i	Vt. AFL-CIO OKs strike if Trump refuses peaceful transfer of power	T	politics
t3_k0axg0	Rush Limbaugh: Trump’s Legal Team ‘Promised Blockbuster Stuff and Then Nothing Happened’	TS	politics
t3_k05ja4	Since Election Day, a Lot of Tweeting and Not Much Else for Trump	TS	politics
t3_jzv4kr	GM withdraws support for Trump lawsuit seeking to roll back auto emissions rules	TP	politics
t3_k00bnt	Trump’s legacy may be an increasingly authoritarian Republican Party	TS	politics
t3_k0anru	Trump pops into White House briefing room for one-minute impromptu speech	TP	politics
