Name	Title	Coding	Subreddit
t3_k1418a	Romance Novelists Raise Nearly $400,000 for Dems in Georgia Runoff	Other	politics
t3_k12px0	DeSantis won’t answer questions about anything. Where has he been?	Other	politics
t3_k10vq1	WH Trade Adviser Urges More COVID Relief, Including Stimulus for Families and Extending Unemployment Compensation	Other	politics
t3_k0zt0z	Even in a Pandemic, the Billionaires Are Winning	Other	politics
t3_k13kds	Fauci asks Americans to ‘sacrifice’ Thanksgiving in COVID-19 plea	Other	politics
t3_k13foo	Divided government is a path to disaster. Why won’t voters admit it?	Other	politics
t3_k0iyr2	Mnuchin Plans to Put $455 Billion Beyond Yellen’s Easy Reach	Other	politics
t3_k0zji0	With U.S. in COVID-19 panic, Georgia Sen. Perdue saw stock opportunity	Other	politics
t3_k0v8wb	With US in COVID-19 panic, Sen. Perdue saw stock opportunity	Other	politics
t3_k0ukem	Fox News Reaches Settlement With Parents of Seth Rich: A lawsuit they filed in 2018 over the network’s coverage of the murder of Mr. Rich, who had been a Democratic aide, comes to an end.	Other	politics
t3_k0rwe4	Veep' Cast Revisits Recount Episode to Get Out the Vote in Georgia	Other	politics
t3_k147eo	Obama: Republican Party members believe 'white males are victims'	Other	politics
t3_k0uogf	U.S. hits highest death toll since May with hospitals already full	Other	politics
t3_k12s6u	Cannabis group files to defend constitutional amendment	Other	politics
t3_k0jo5y	The Michigan GOP’s Fake Voter Fraud Scandal	Other	politics
t3_k13y9z	White House Thanksgiving proclamation calls for Americans to 'gather' even as Covid-19 surges	Other	politics
t3_k10v9n	Environmentalists Cheer First-Ever US Climate Envoy	Other	politics
t3_k138hg	Denver Mayor Flies to Texas for Thanksgiving After Urging City Residents to Avoid Travel Due to COVID	Other	politics
t3_k0khew	Why You Don’t Mess Around With Presidential Transitions	Other	politics
t3_k11uys	With US in Covid-19 panic, Georgia GOP Sen. Perdue saw stock opportunity	Other	politics
t3_k0siza	Record Turnout Helped Texas Republicans, So Why Are They Still Pushing to Make It Harder to Vote?	Other	politics
t3_k10pyg	U.S. Shutters Warehouse Where Migrants Were Kept in ‘Cages’	Other	politics
t3_k1gh9w	Bernie Sanders Says U.S. Can Cancel All Student Debt if It Can Give the Top 1% $1 Trillion in Tax Breaks	Other	politics
t3_k1j7mf	"Where the f***ing stimulus at?": TikTok video rant at Mitch McConnell watched Over 2 million times	Other	politics
t3_k1fgge	Black Lives Matter raising half a million for Democrats in Georgia Senate runoffs	Other	politics
t3_k1g6bn	Republicans are right: democracy is rigged. But they are the beneficiaries	Other	politics
t3_k16b8b	Joe Scarborough to Nicolle Wallace: Some of our old friends, ‘are more loyal to a failed reality TV host’ than to the Constitution	Other	politics
t3_k1hymr	A(nother) Georgia GOP Senator Was Reportedly Investigated for Insider Trading	Other	politics
t3_k1gyz7	Sidney Powell Mocked, Scorned, Ridiculed and More Over Clumsy, Rambling, Typo-Filled ‘Kraken’ Lawsuits	Other	politics
t3_k1dhh7	Major shift at Supreme Court on Covid-19 orders — the Supreme Court voted 5-4 to bar New York state from reimposing limits on religious gatherings	Other	politics
t3_k1l6cs	Sotomayor Calls Supreme Court’s N.Y. Pandemic Ruling A ‘Deadly Game’	Other	politics
t3_k18o1l	Indiana asks Supreme Court to strip parental rights from gay couples &amp; they may succeed - The United States Supreme Court is taking unusual steps that could start the unraveling of marriage equality.	Other	politics
t3_k1m128	Florida governor Ron DeSantis accused of ‘killing spree’ after extending ban on cities from imposing own mask mandates. Miami-Dade mayor Daniella Levine Cava calls decision ‘deeply frustrating’	Other	politics
t3_k1j7py	A Georgia Republican official named as plaintiff by Sidney Powell says he never agreed to take part in lawsuit	Other	politics
t3_k18568	John Fetterman, Pennsylvania's lieutenant governor and a rising star in the Democratic Party, isn't a progressive. He says he's just being honest.	Other	politics
t3_k1maw4	Sidney Powell's 'Kraken' Voter Fraud Lawsuits Ridiculed by Legal Experts Over Typos, Lack of Evidence	Other	politics
t3_k15uit	South Dakota Police File Lawsuit to Block Measure Legalizing Marijuana Approved by Voters	Other	politics
t3_k15vll	GOP effort to invalidate more than 2.5 million votes in Pennsylvania dealt another setback	Other	politics
t3_k1jnzw	Pennsylvania Tells Top Court There Is ‘No Conceivable Justification’ for Judge’s Certification Order	Other	politics
t3_k1n5f3	Wyoming’s Governor Contracts Coronavirus After Condemning Mask Mandates in Favor of ‘Personal Responsibility’	Other	politics
t3_k1mr2m	Justice Sotomayor Upbraids SCOTUS Majority for ‘Playing a Deadly Game’ With COVID Restrictions	Other	politics
t3_k17ju3	Army Corps of Engineers Denies Permit To Controversial Alaska Gold Mine	Other	politics
t3_k1ny6m	The Rotting of the Republican Mind	Other	politics
t3_k1fpvw	New York Times: Justice Department probed Georgia Sen. David Perdue's stock sales at beginning of pandemic	Other	politics
t3_k1h9wx	This can't wait.' Why long food lines signal need for more coronavirus stimulus aid	Other	politics
t3_k19iw5	Splitting 5 to 4, Supreme Court Backs Religious Challenge to Cuomo’s Virus Shutdown Order	Other	politics
t3_k18jjk	Judge throws out lawsuit filed by Republican Dan Rodimer over election results	Other	politics
t3_k1mqix	Cuomo blames new conservative majority for High Court's COVID-19 decision	Other	politics
t3_k1e03u	Amy Coney Barrett plays decisive role as Supreme Court bars New York COVID restrictions on religious services	Other	politics
t3_k1hghp	Money promised to combat US overdose crisis sits unused	Other	politics
t3_k1gk3c	Supreme Court Blocks New York COVID-19 Restrictions On Religious Gatherings It was the first major decision since Justice Amy Coney Barrett joined the nation’s highest court.	Other	politics
t3_k1k1ey	Two School Districts Had Different Mask Policies. Only One Had a Teacher on a Ventilator.	Other	politics
t3_k19zgw	Amy Coney Barrett casts deciding vote to block limit on religious gatherings	Other	politics
t3_k1kcpr	Denver’s mayor urged residents to avoid Thanksgiving travel. Then he flew cross-country to see family.	Other	politics
t3_k188m8	A New Political Force Emerges in Georgia: Asian-American Voters	Other	politics
t3_k1hg7q	New Hampshire Republicans want to impeach the state's GOP governor for requiring people to wear a mask in public places	Other	politics
t3_k1f85d	DeSantis won’t answer questions about anything. Where has he been?	Other	politics
t3_k1jbam	Wyoming’s governor has resisted calls for a mask mandate. Now he has the coronavirus.	Other	politics
t3_k1lb55	NY Gov. Cuomo says Supreme Court decision overturning COVID restrictions for religious services has "no practical effect"	Other	politics
t3_k1i5v2	Michelle Obama reflects on how she put her anger aside for a peaceful transition	Other	politics
t3_k1e8tc	A battle over right-wing media bookings is playing out as Fox News reportedly tells guests to not appear on Newsmax	Other	politics
t3_k17cvu	Mnuchin to put $455B in COVID-19 relief funds beyond successor's reach	Other	politics
t3_k1l2es	Stimulus plans sidelined as Georgia Senate runoffs draw focus, says GOP Rep	Other	politics
t3_k1ihqn	Cuomo calls a sheriff who won't enforce mask mandate a 'dictator'	Other	politics
t3_k1fgsz	Supreme Court Blocks Attendance Restrictions Due To COVID-19 In New York	Other	politics
t3_k199ny	Supreme Court rules against NY coronavirus restrictions	Other	politics
t3_k1a1cx	In a 5-4 ruling, Supreme Court sides with religious groups in a dispute over Covid-19 restrictions in New York	Other	politics
t3_k1jm1v	Supreme Court ruling doesn’t have 'any practical effect,' Cuomo says	Other	politics
t3_k1k3w1	Federal prosecutors hold protesters for months pretrial	Other	politics
t3_k1i7x4	Georgia Senator David Perdue boosts wealth with well-timed stock trades	Other	politics
t3_k1orau	US records 2,300 COVID-19 deaths as pandemic rises with holidays	Other	politics
t3_k1p5ej	Thanksgiving Celebrations Could Double U.S. COVID-19 Death Rate to 4,000 a Day, Professor Predicts	Other	politics
t3_k1c7g8	Mocking Rudy Giuliani's Voter Fraud Claims, Elizabeth Warren Insists to Katie Porter That Square Is 'a Circle'	Other	politics
t3_k19equ	Supreme Court relieves religious organizations from some covid-related restrictions	Other	politics
t3_k1mwv5	Amid Public Health and Employment Crises, New Survey Shows Poor Americans Agree on Policy Solutions - People living in poverty across the country support a "bold policy agenda for government to make work pay and ensure that everyone has high-quality, affordable healthcare, housing, and food."	Other	politics
t3_k1mesl	Why now?' Dismay as US considers troop pullout from Somalia	Other	politics
t3_k1fuf4	Florida Gov. Ron DeSantis extends order banning local mask mandates	Other	politics
t3_k1p3e0	Fact check: Videos of shredding truck do not show ‘destruction of voter fraud evidence’ at Cobb County, GA.	Other	politics
t3_k1p7ye	Government Model Suggests U.S. COVID-19 Cases Could Be Approaching 100 Million	Other	politics
t3_k1j5fg	Supreme Court Blocks New York COVID Restrictions on Religious Gatherings | The decision itself is narrow. But it will likely be read as a free pass for churches and synagogues to spread COVID-19 with impunity.	Other	politics
t3_k1mwo7	The Next Administration Should Bring the Shadow Wars into the Light | Lethal tactics and entire campaigns launched urgently after 9/11 have corroded oversight and American standing.	Other	politics
t3_k198hm	Supreme Court blocks strict COVID-19 restrictions on some New York houses of worship	Other	politics
t3_k1bqtr	Supreme Court Says New York Can't Limit Attendance In Houses of Worship Due To COVID	Other	politics
t3_k15ys2	Head of USAID tests positive for coronavirus	Other	politics
t3_k17xoo	Pennsylvania judge orders halt to further vote certification, Gov. Tom Wolf to appeal	Other	politics
t3_k17l93	Mayor of Denver apologizes for holiday travel after advising residents to stay put	Other	politics
t3_k1a5xx	Supreme Court blocks NY from enforcing Covid limits on churches	Other	politics
t3_k19edd	West Virginia's Republican governor blasts mask critics	Other	politics
t3_k1h7if	Deliberately Distorting' Reasoning for Limiting Large Religious Gatherings, SCOTUS Rules Against New York State's Restrictions	Other	politics
t3_k18mrd	N.J. mayor gives up on trying to change people's Thanksgiving plans, "We're realistic that people aren't going to listen"	Other	politics
t3_k1kavi	John James concedes to Peters in Senate race 3 weeks after election	Other	politics
t3_k1a8dz	Coronavirus News: Supreme Court rules against NY COVID restrictions on houses of worship	Other	politics
t3_k1eq6w	The perils of voting: One disqualified voter was Tom Cotton's wife	Other	politics
t3_k1fwmq	Georgia senators call for special session to address voting issues	Other	politics
t3_k1n0ed	Hundreds of Anti-Lockdown Protesters Gather for Thanksgiving Meal at Oregon State Capitol	Other	politics
t3_k1ke0v	Can We Build a Progressive Future If We Dismiss a Large Part of the Working Class?	Other	politics
t3_k15suo	Denver mayor asks city not to travel for Thanksgiving, then heads to Mississippi	Other	politics
t3_k1jhh4	Supreme Court’s conservatives lift Covid restrictions on New York houses of worship	Other	politics
t3_k1q4a0	Julia Louis-Dreyfus spoofs Rudy Giuliani while announcing 'Veep' virtual table read	Other	politics
t3_k1qrws	Kamala Harris calls teen who went viral for painting portrait of vice president-elect	Other	politics
t3_k1fqqx	Supreme court bars Covid attendance limits at New York houses of worship	Other	politics
t3_k1822r	The radical history of the Red Power movement's fight for Native American sovereignty	Other	politics
t3_k1lohv	What hunting Bigfoot taught a Republican congressman about politics	Other	politics
t3_k1mtdw	GOP clashes as deadline to repeal tainted bailout law nears — Hopes of repealing an energy bailout law are in danger at the Ohio Statehouse as Republican lawmakers argue sharply different positions on how and whether to repeal the legislation with only weeks before Ohioans begin to pay the price	Other	politics
t3_k1j1jf	Gov. Hogan: Report that first batch of Covid-19 tests were never used 'completely false'	Other	politics
t3_k1k6sl	California officials plan to relocate thousands of homeless people from hotels	Other	politics
t3_k17gsu	Federal appeals court letter on suit over Georgia election: This court may lack jurisdiction	Other	politics
t3_k1jcfc	Consumer Bureau to Decide Who Owns Your Financial Data. What Should Banks, Fintechs Be Allowed to Do With All that They Know About You?	Other	politics
t3_k1evos	Supreme Court temporarily bars New York from setting church attendance limits	Other	politics
t3_k1gf5j	CTV News: U.S. Supreme Court blocks N.Y. coronavirus limits on houses of worship.	Other	politics
t3_k16sx4	Acting head of USAID tests positive for Covid-19	Other	politics
t3_k1lwrv	Appeals court: City of Cincinnati must pay $168K over 'invalid' trigger activator ban	Other	politics
t3_k1hxk0	Gov. Cuomo: COVID-19 winter plan to be developed after Thanksgiving data	Other	politics
t3_k1f7aj	Rationales shift as Nevada considers future of vote by-mail	Other	politics
t3_k1bvne	Why the U.S. Could Be the Big Loser in the Huge RCEP Trade Deal Between China and 14 Other Countries	Other	politics
t3_k1hcah	U.S. Supreme Court backs religious groups over New York virus curbs	Other	politics
t3_k1dmc9	Paper shredding drives false election claims in Georgia	Other	politics
t3_k182xd	The reason we know it's about to get better	Other	politics
t3_k1ly0y	Santa Clara County joins undocumented immigrant census count lawsuit	Other	politics
t3_k19gcf	Colorado Congresswoman-elect Lauren Boebert may carry Glock at Capitol	Other	politics
t3_k1eifh	Progressives Look to Wield Power in a New Place: The Foreign Affairs Committee	Other	politics
t3_k173r0	China Vows Response Following U.S. Admiral's Trip to Taiwan	Other	politics
t3_k1in6p	A Fight Over Agriculture Secretary Could Decide the Direction of Hunger Policy	Other	politics
t3_k1ia4e	Republican Devin Nunes Compares Democrats to 'Weird Star Wars Freaks'	Other	politics
t3_k1i5sb	The true story behind Thanksgiving is a bloody one, and some people say it's time to cancel the holiday	Other	politics
t3_k1hulv	11 of the most Bizarre Elections in American History	Other	politics
t3_k1h7gb	Covid-19: US Supreme Court backs religious groups over New York caps	Other	politics
t3_k1r593	New York Governor Cuomo called the Supreme Court ruling that blocked some COVID-19 restrictions on religious services 'irrelevant'	Other	politics
t3_jzjwz1	100 Republican national security experts demand GOP admit Trump loss	TS	politics
t3_jzr4dw	Michigan elections board certifies results from presidential election, sealing Biden’s win in state	ER	politics
t3_jzgzo5	Trump is not just refusing to concede, he is sabotaging nation’s interest	TS	politics
t3_jzfuso	Trump team falsely claim he was not assisted in transition by Obama	TS	politics
t3_jzj864	Business Leaders Tell GOP: Start Biden Transition or No Money for Georgia Senate Run-Offs	T	politics
t3_jzka2y	Pro-Trump Attorney Urges Republicans Not to Vote in Georgia Runoff	O	politics
t3_jzb2zh	Twitter Afire After Trump Camp Breaks With Lawyer: Lasted ‘About Half A Scaramucci’ | “Sidney Powell should refuse to concede her position from Trump’s legal team,” one critic joked.	TS	politics
t3_jz8bvm	Native American voters across Minnesota turned out to oust Trump - Vote totals were up around Red Lake, and 90% for Biden	ER	politics
t3_jzmb5h	Detroit had more vote errors in 2016 when Trump won Michigan by a narrow margin. He didn’t object then.	ER	politics
t3_jziz6f	Trump will leave office soon. But we can’t let him escape accountability for his misdeeds.	TS	politics
t3_jzg091	Biden is stealing the spotlight. Trump can't stand it.	O	politics
t3_jzmvi7	Trump's on his way out, but leaves a lasting legacy: The right's open embrace of terrorism. How did the Kenosha shooter post $2 million in bail? Because conservatives are normalizing right-wing terrorism	TS	politics
t3_jzeymy	New Zealand PM offers COVID-19 help to U.S. President-elect Biden	BP	politics
t3_jzbb0y	Reporter Carl Bernstein names 21 GOP senators who 'repeatedly expressed extreme contempt for Trump'	TS	politics
t3_jze8d0	Transition warning: Trump's mental illness is a growing danger	TS	politics
t3_jzo4ys	To Prevent 'Active Sabotage' of His Agenda, Biden Urged to Clean House of Trump Loyalists on Day One	BP	politics
t3_jzgz98	John Kasich Stunned GOP Isn’t Defending Democracy Against Trump	TS	politics
t3_jzicmc	How Ronald Reagan’s Racism Helped Pave the Way for Donald Trump’s	O	politics
t3_jzos3p	It’s Time To Consider Sanctions for Trump’s Legal Team	TS	politics
t3_jzj8y9	Republican pollster: Trump's false 'rigged' election claims may hurt GOP chances of keeping Senate	EF	politics
t3_jznq3n	Clip of Ted Cruz Saying Democrats Would Say COVID 'Magically Better' Week After Biden Wins Resurfaces	O	politics
t3_jzonsl	Former Defense Secretary Jim Mattis says Biden should toss all of Trump's 'America First' policies	BP	politics
t3_jzm9x0	Biden picks John Kerry for climate envoy on national security council	BP	politics
t3_jzgode	Trump axed campaign lawyer Sidney Powell was because 'she was too conspiratorial even for him'	TP	politics
t3_jztvos	Megathread: The GSA Has Informed President-Elect Joe Biden that the Administration is Ready to Begin the Formal Transition Process	T	politics
t3_jzh7ew	Carl Bernstein names 21 Republican senators who have ‘privately’ expressed ‘extreme contempt’ for Trump	TS	politics
t3_jzkjrv	Biden team is reportedly pushing congressional Democrats to strike an immediate stimulus deal with Republicans to stave off renewed recession	BP	politics
t3_jz9j48	Kasich: Republicans 'either in complete lockstep' or 'afraid' of Trump	O	politics
t3_jzpeei	Trump Is Blowing Up the Georgia GOP—and It Couldn’t Happen at a Better Time	TS	politics
t3_jzhuwc	New Zealand offers Biden tips on COVID-19 after successful response	BP	politics
t3_jzmtno	Tucker Carlson was attacked by Trump supporters for questioning the outlandish claims of the president's lawyer Sidney Powell before she was fired	TS	politics
t3_jzj73m	Trump’s press secretary Kayleigh McEnany heckled in briefing: ‘When will you admit you lost?’	TS	politics
t3_jzlc67	GOP Sen. Rob Portman says Biden transition funds should be released	T	politics
t3_jzlnvy	A major Trump donor’s company got a 3 percent government-backed pandemic loan. It sells title loans at a 350 percent annual rate.	TS	politics
t3_jzhcb0	What if Trump never concedes? The Constitution will end his term, conservative lawyer John Yoo says	T	politics
t3_jzmfmo	President Trump Wanted a Supreme Court Election Battle. His Current Appeal Simply Cannot Get Him There.	EF	politics
t3_jzguka	Trump handing Taliban a victory on his way out, says former national security adviser H.R McMaster	TP	politics
t3_jzgsx3	Trump legal team says Sidney Powell had no formal role, but record shows they loved her involvement	TS	politics
t3_jzba0d	Carl Bernstein names 21 GOP senators who 'privately expressed their disdain' for Trump	TS	politics
t3_jzj1p6	Group of Black voters in Detroit suing President Trump, citing voting rights abuses &amp; disenfranchisement	EF	politics
t3_jzpowr	Let’s hear it for the judges for dismissing Trump’s lawsuits	EF	politics
t3_jzlqyf	GOP senator says Biden's vote lead 'has not changed,' urges country to 'move forward'	T	politics
t3_jzjoc9	Republican former national security officials urge party to demand Trump concession	T	politics
t3_jz8td4	Here are the 3 legal cases Trump may have to face once he’s no longer president	TS	politics
t3_jzpllg	The Already Useless Trump Kids Are About to Get Even More So	O	politics
t3_jzcmj4	New Zealand leader Ardern offers virus know-how to Joe Biden | New Zealand Prime Minister Jacinda Ardern has become the latest world leader to congratulate President-elect Joe Biden on his election victory, saying she offered to share her nation’s expertise on dealing the coronavirus	BP	politics
t3_jz9k6j	Donald Trump’s legal team has been a ‘national embarrassment,’ according to one loyal Trump supporter	TS	politics
t3_jzis32	Carl Bernstein named 21 GOP senators who he said are enabling Trump's attempts to subvert US democracy by only criticizing him in private	TS	politics
t3_jzny0i	Pennsylvania Republicans Voted Against Certifying Vote in County Trump Won by 22,000	ER	politics
t3_jzmam7	Trump's top election lawyer in Wisconsin says he and his wife voted illegally in the campaign's latest legal argument	EF	politics
t3_jzpy16	On Trump, GOP's silence 'can't be excused and won't be forgiven' — For the first time, a corrupt US leader is trying to cling to power through autocratic means. Let history note who lacked the patriotism to speak up.	TS	politics
t3_jzpvbh	Rush Limbaugh criticizes Trump legal team for promising 'bombshells' and failing to deliver	TS	politics
t3_jzmqas	Conservatives spread false claim Biden invented 'office' of the president-elect	TS	politics
t3_jzg8x4	Elite Strike Force'? Trump Legal Team Throws Right-Wing Attorney Sidney Powell Under the Bus as Coup Attempt Flails	TS	politics
t3_jz9qp2	Haaland being vetted by Biden team for Interior secretary	BP	politics
t3_jzej98	Pennsylvania’s Lt. Gov. Trolls Trump, ‘Dopey’ GOP Lawsuits In Epic Tweetstorm	EF	politics
t3_jzfpdr	Donald Trump has assaulted our democracy	TS	politics
t3_jzq2dw	Poll: Majority say Trump should concede	ER	politics
t3_jzk7yg	A Federal Judge Rejected Trump's Ludicrous Pennsylvania Case With Pure Disdain	EF	politics
t3_jzla7n	Michigan voters sue Trump for allegedly disenfranchising Black voters with election interference	EF	politics
t3_jzeqq0	Opinion | Why Biden should stop parsing words and call Trump's lies a coup	TS	politics
t3_jzj1yp	Major business leaders reportedly signed a letter urging Trump to concede, and warn that 'our democracy grows weaker' the longer the presidential transition is delayed	T	politics
t3_jzd94c	Carl Bernstein Names Names: 21 GOP Senators Who've Privately Ripped Trump	TS	politics
t3_jzmus9	Donald Trump’s Bid to Steal the Election Hinges on a Shameless Homophobe Who Once Called Him a Lying, Idiotic Bully	EF	politics
t3_jzis4d	Will Trump’s Accusers Finally Get Their Day In Court? | He soon will be unable to hide from the women suing him for defamation.	TS	politics
t3_jz9yit	Representative Ilhan Omar: ‘I Hope President Biden Seizes This Opportunity’ — The president-elect has a once-in-a-generation opportunity to reorient US foreign policy so this country truly means what it says.	BP	politics
t3_jzhsuf	Trump urges state legislatures and courts to ‘flip’ results	EF	politics
t3_jzrwc2	Pennsylvania Supreme Court Kills Trump Bid to Disqualify Ballots	EF	politics
t3_jzjbng	In Another Country This Would Be Called a Coup: Detroit NAACP Head on Trump Trying to Overturn Vote	EF	politics
t3_jz8dam	Biden Chooses Antony Blinken, Defender of Global Alliances, as Secretary of State	BP	politics
t3_jziqei	Team Trump Fired QAnon Lawyer Sidney Powell But She's Tweeting Through It - Last week she was part of Trump's "elite strike force." Now she's "practicing law on her own."	TS	politics
t3_jzlbdp	Trump friend and adviser Steve Schwarzman recognizes Biden as President-elect	T	politics
t3_jzqf5t	Republican Congressman Says GOP 'Embarrassing,' Calls on Party to 'Denounce' Trump's 'Conspiracy Theories'	TS	politics
t3_jzc781	John Kasich calls Trump's refusal to concede 'absurd'	TS	politics
t3_jzji16	Trump's closest business ally just admitted that the president lost the election	ER	politics
t3_jzlipn	Sidney Powell Stricken from Trump’s ‘Elite Strike Force’ Legal Team 8 Days After President Called Her ‘Wonderful’	TS	politics
t3_jzc3y4	More Republicans are losing patience with Trump's legal absurdities	TS	politics
t3_jzdr2f	Voting machines manufacturer on Trump conspiracy theory: ‘It’s not physically possible’	EF	politics
t3_jzm28z	Biden to nominate first Latino and immigrant to run Homeland Security	BP	politics
t3_jzskav	Pennsylvania Supreme Court Reverses One of Trump’s Only Post-Election Litigation Wins	EF	politics
t3_jzebvu	Trump’s fundraising emails give spam a bad name - The election is over, but Trump's campaign is still bombarding his supporters with conspiracy-mongering demands for more money. Its exhausting.	TS	politics
t3_jzfnsj	Biden to spotlight CDC officials shunned by Trump	BP	politics
t3_jz9obr	US election 2020: Trump ally urges him to accept defeat in US vote	ER	politics
t3_jzjl2a	Republican national security experts call on Trump to concede, begin transition	T	politics
t3_jzazcu	Maryland governor says Trump should concede election, stop golfing	T	politics
t3_jzs0fi	Michigan Certifies Joe Biden's Election Victory	ER	politics
t3_jzrmc0	Trump’s Ridiculous, Sloppy Coup Attempt Just Face-Planted in Michigan	EF	politics
t3_jzsk0y	Congress Has Every Right to Keep Investigating Trump After He’s Gone	TS	politics
t3_jzrlc7	Maine certifies Biden’s victory in the state’s election	ER	politics
t3_jzqg3e	Trump campaign suffers new court loss in attempt to block Biden’s win in Pennsylvania	EF	politics
t3_jzsjjw	Over 100 CEOs threaten to cut off funds to Georgia GOP if Trump keeps blocking transition: report	T	politics
t3_jz8ss3	Trump May Announce His 2024 Bid Before Year’s End	TP	politics
