Name	Title	Coding	Subreddit
t3_k1pvhx	Charles Koch: 'Horrified' When Donations Didn't Buy Politicians' Votes On Immigration And Other Issues	Other	Conservative
t3_k1f6is	The Intimidation and Unfair Enforcement of Detroit’s Election	Other	Conservative
t3_k1jp56	US Senator calls for better threat identification technologies | Flash News	Other	Conservative
t3_k1f5i8	Five books Penguin will have to ban along with Jordan Peterson	Other	Conservative
t3_k167hw	ATF Goes Rogue on Gun Owners	Other	Conservative
t3_k1pzv2	The Pilgrims Tried Collectivism and Failed	Other	Conservative
t3_k1ne5p	Group breaks windows, tags SE Portland businesses with graffiti	Other	Conservative
t3_k1i2w6	Mike Rowe reveals he’s ‘thankful to be living in America during the most remarkable year of my life’	Other	Conservative
t3_k15y0r	WSJ Editorial Board: A Pardon for General Flynn	Other	Conservative
t3_k1o8u9	France bans citizens from filming and identifying violent police officers	Other	Conservative
t3_k1f950	400 Years Later, I Made New Discoveries About The First Thanksgiving	Other	Conservative
t3_k16wkk	Report: Moscow Plans Social Credit System	Other	Conservative
t3_k16uzv	Petition to remove Big Papa T.	Other	Conservative
t3_k15zfa	James Freeman: Thanksgiving and the American Character	Other	Conservative
t3_k1efm4	Belfast Telegraph journalist warned of threat against them by loyalist paramilitaries	Other	Conservative
t3_k1jwsb	America's Lost Landmarks: Famous Historic Buildings And Landmarks That No Longer Exist	Other	Conservative
t3_k1de1o	University of Maryland’s School of Public Policy has decreed that faculty must participate in corporate confessions of sin to the previous inhabitants of the taxpayer-funded institution’s geography. Forces Professors to acknowledge they are on "stolen land".	Other	Conservative
t3_k196aa	Report Pennsylvania's Governor Wolf To The FTC Immediately	Other	Conservative
t3_k18mt6	Jon Ossoff Ignores Sen. Perdue's Clear Vindication From Claims of Insider Trading	Other	Conservative
t3_k16qvq	Priest calls police on mother of 11 praying in empty church without a mask	Other	Conservative
t3_k1o35i	BBC news output receives lowest impartiality score of any British broadcaster, new survey finds	Other	Conservative
t3_k1hlj3	A closer look at U.S. deaths due to COVID-19	Other	Conservative
t3_k1f7xm	No, The Pilgrims Didn’t Desecrate Native American Graves, And Other Myths You Shouldn’t Believe	Other	Conservative
t3_k1emib	Obama: It’s Impossible to Have a Democracy if People Disagree With You	Other	Conservative
t3_k1d6vs	New York Times takes aim at Thanksgiving, and indoctrinating kids. Now publishing teaching guides to ensure our kids truly understand how horrible their country is.	Other	Conservative
t3_k19lph	Flashback to 5 days ago	Other	Conservative
t3_k17pfg	Have a Historically Accurate Thanksgiving!	Other	Conservative
t3_k16qac	Police say juvenile who allegedly wrote racist messages against Black Lives Matter at a grade school playground committed a misdemeanor violation	Other	Conservative
t3_k16oe3	How Very Stasi: COVID-19 Restrictions Go Full Authoritarian	Other	Conservative
t3_k15yw1	Kim Strassel: Justice for General Flynn	Other	Conservative
t3_k1q8mb	Chinese Beidou Navigation System Has exceeded American GPS In Over 165 Countries around the Globe | Flash News	Other	Conservative
t3_k1p0m5	The Difficult Way Forward	Other	Conservative
t3_k1o90i	Cuomo: State readies 'winter plan' for COVID; SCOTUS ruling 'irrelevant'	Other	Conservative
t3_k1ln1d	SCOTUS Church Ruling 'Major Step' for Ban Challenges	Other	Conservative
t3_k1enqf	Nine useful articles and data points showcasing 2020's election theft	Other	Conservative
t3_k1drcv	I'm for the Constitution': Meet the NY sheriff standing up to Andrew Cuomo this Thanksgiving	Other	Conservative
t3_k1cgwx	A Progressive Assault on Selective High Schools. Instead of fixing public education, the left tries to end testing at schools it deems inequitable.	Other	Conservative
t3_k18yo2	Open letter to patriots everywhere -- LIVE FREE!	Other	Conservative
t3_k1haod	Data Group Exposes Widespread Mail-In Ballot Fraud	Other	Conservative
t3_k19gi2	PA Senate Held Election Fraud Hearing Today: Updates on Voter Fraud Allegations	Other	Conservative
t3_k18icl	America’s still failing to protect Christians across the Middle East	Other	Conservative
t3_k1lyyr	Vladimir Putin allegedly has a secret lovechild with cleaner now worth $100M	Other	Conservative
t3_k1drmz	Glenn Beck: Here's what these Democrats should be thankful for this Thanksgiving	Other	Conservative
t3_k16ygk	America’s Critical Point in Time: The decades-long communist assault on America is reaching a climax	Other	Conservative
t3_jzta4e	Trump Administration To Start Transition Process For Biden	T	Conservative
t3_jzfqzc	Do Trump-Supporters Live in an Alternate Universe? Actually a huge number of Americans have a false impression of reality because they are being told lies by their media. The people who constantly hear these lies do live in an "alternate reality."	TS	Conservative
t3_jzqpbm	Rush Limbaugh criticizes Trump legal team for promising 'bombshells' and failing to deliver	TS	Conservative
t3_jzms1q	Pro-Trump Attorney Lin Wood Urges Republicans Not To Vote In Georgia Senate Runoff -- Unless GOP candidates help overturn the presidential election results in the state.	EF	Conservative
t3_jzti5c	GSA Sends Letter to Biden Making Resources Available for Transition	T	Conservative
t3_jz9dqx	Lou Dobbs Warns the GOP: Republican Party ‘Will Be Gone and Done’ If They Don’t Stand With President Trump	TS	Conservative
t3_jzlwxs	Bombshell: Biden takes min 98% of a 23,487 vote batch at 12:18AM in GA	ER	Conservative
t3_jzjbne	Sidney Powell Confirms Non-Affiliation With Trump Legal Team, Vows to Continue Fraud Fight	EF	Conservative
t3_jzk9j0	Sidney Powell Responds to Trump Campaign's Statement Saying She's Not Part of Legal Team -- Powell said her fight will go on anyway and closed her statement with the hashtag, "#KrakenOnSteroids"	TS	Conservative
t3_jzjzln	A Neighbor You Like Probably Voted For Trump	ER	Conservative
t3_jzitza	Why The Left Can Be So Ridiculously Self-Righteous Without Realizing It -- What we saw in the lead up to the elections, and what we’ll witness for years to come, is utter contempt for Trump voters and conservatives in general.	TS	Conservative
t3_jzjptq	Two-thirds of GOP voters support Trump running for president in 2024: survey	O	Conservative
t3_jznypc	Trump campaign takes Pennsylvania election fight to federal appeals court	EF	Conservative
t3_jzjlmh	Democrat House Losses Stemmed From Trump Increasing Voter Turnout: Rep. Richmond	ER	Conservative
t3_jzbqm7	Trump campaign demands recount, signature matching in Georgia	EF	Conservative
t3_jzpd7w	JUST IN: Third Circuit Court of Appeals Grants Expedited Review For Team Trump’s Appeal in Pennsylvania	EF	Conservative
t3_jzi0vw	5 More Ways Joe Biden Magically Outperformed Election Norms	ER	Conservative
t3_jzloh0	Watergate journalist Carl Bernstein outs 21 Republican senators who 'privately' expressed 'extreme contempt' for Trump.	TS	Conservative
t3_jzijpr	Trump Pulls Out Of Military Transparency Treaty With Russia, Europe	TP	Conservative
t3_jzu0rh	Rush Limbaugh On Trump’s Legal Team: ‘They Promised Blockbuster Stuff And Then Nothing Happened’	TS	Conservative
t3_jzqca2	Trump scores two wins as Michigan legislature, federal appeals court agree to election reviews	EF	Conservative
t3_jznr0d	Appeals Court Grants Expedited Review of Trump Campaign's Pennsylvania Lawsuit	EF	Conservative
t3_jzua12	GSA notifies Joe Biden that Trump administration is ready to start transition process	T	Conservative
t3_jzn4sl	Biden proposes John Poulos, CEO and President of Dominion Voting Systems, as Surgeon General and Head of Covid Analytics. Dominion will now be solely in charge of recording and keeping an exact count of what has become the most deadly virus in the history of the world.	BP	Conservative
t3_jzi8g6	Trump’s legal team’s statement on Sydney Powell was made to focus on the upcoming Supreme Court case. There are two separate legal pathways. One on equal protection and PA voting rules (most important right now). The second is Dominion software which will take longer.	TP	Conservative
t3_jzu8wb	Trump accepts transition to Biden can begin	T	Conservative
t3_jzo4tp	Journalist Carl Bernstein names 21 GOP senators who 'privately expressed their disdain' for Trump	TS	Conservative
t3_jzmj9c	Political Enemy List Trump Accountability Project Publicly Posted on Their Website	TS	Conservative
t3_jzpdpe	Trump's election lawsuit leads to 3rd Circuit grant for expedited review	EF	Conservative
t3_jzjgop	Open Letter Calls on Harvard to Create 'System of Accountability' for Inviting Trump Admin Alums to Campus	TS	Conservative
t3_jzpzzc	Janet Yellen Is Biden’s Pick for Treasury Secretary	BP	Conservative
t3_jzl6re	5 More Ways Joe Biden Magically Outperformed Election Norms	ER	Conservative
t3_jzntsc	GOP Former National Security Officials Urge Party to Demand Trump Concession	EF	Conservative
t3_jzkul5	Trump: More Votes Than Voters in Key Swing States	EF	Conservative
t3_jzq15s	Rush Limbaugh: Trump Needs to Hold Rallies in Georgia	TP	Conservative
t3_jzmy0e	Joe Biden is a very weak President, could start wars': Chinese government advisor | World News - Times of India	BS	Conservative
t3_jzhelc	Mike Flynn Jr. adds twist to Trump team’s statement on Sidney Powell: ‘Give this the 24hr rule …’	TS	Conservative
t3_jzud9p	Bernstein names 21 Republican senators who privately expressed contempt for Trump	TS	Conservative
t3_jzrhs0	Biden's Treasury Secretary: Janet Yellen	BP	Conservative
t3_jzkxnl	Professor causes uproar asking Biden voters to unfriend him	BS	Conservative
t3_jzmvum	Appeals Court Grants Expedited Review of Trump Campaign's Pennsylvania Lawsuit	EF	Conservative
t3_jzaqqe	An statement from Senator Toomey regarding the Pennyslvania Federal Court decision regarding the Trump campaign lawsuit.	EF	Conservative
t3_jzqyu6	Joel Kotkin: The Green End Game Runs Through Biden	BP	Conservative
t3_jzo3u5	Obama's third term: Biden reveals first cabinet picks	BS	Conservative
t3_jzaje9	Scranton dedicates 'Joe Biden Way' to honor president-elect	O	Conservative
t3_jzq2wb	Sidney Powell responds to Trump Campaign legal statement with agreement but an “epic” lawsuit is still coming this week	TS	Conservative
t3_jzhbcz	The Death Star Strategy: Is Trump Contemplating The Ultimate Constitutional Trick Shot?	TS	Conservative
t3_jzu0lg	Walter Mead: Biden’s Foreign-Policy Team Takes Shape	BP	Conservative
t3_jznsl5	Biden secretary of state pick Blinken criticized over Iraq War, consulting work	BS	Conservative
t3_jzexf7	Trump’s gains in North Philly show Latino voters are not a ‘gimme’ for Democrats	ER	Conservative
t3_jzu5h2	The Socio-Political Legacy 0f Trump	TS	Conservative
t3_jznbrr	U.S. Election: Trump legal team distances itself from lawyer after controversial comments - National | Globalnews.ca	TS	Conservative
t3_jzsxow	Trump Lawyer: Michigan Legislature Agrees to Hold Election Review Hearings	EF	Conservative
t3_jzrh4s	Hours After Biden Picks Blinken For Secretary Of State – His Closet Door Swings Open On Iraq And Consulting	BS	Conservative
t3_jzrc5e	Rep. Nunes Worried Biden Will Shut Down Durham Investigation	BS	Conservative
t3_jzdaid	Report: Maryland Gov. Larry Hogan, Anti-Trump Hero, Paid for Flawed Coronavirus Tests from South Korea	TS	Conservative
t3_jzcm4f	Report: Biden to Name Russia Hoaxer, CNN Analyst Tony Blinken Secretary of State	BP	Conservative
t3_jz8xh4	Trump campaign to appeal dismissal of election lawsuit in Pennsylvania	EF	Conservative
t3_jzlu2s	All Republicans should support President Trump's legal fights -- Any who believe that buddying up to the Biden team is a symbol of unity, and better for America, have already abandoned Trump, conservatism, and America.	TS	Conservative
t3_jzk5a1	A Circuit Breaker on Election Night? (...nearly 30 percent of Democrat voters think the election was stolen from Trump)	EF	Conservative
t3_jzieod	GOP Can't Let Trump-Hating Squishes Take Over the Party Now	TS	Conservative
t3_jzjii3	Mark Levin: Letting Trump's legal efforts play out far better than 'what the Democrats are doing to our institutions'	BS	Conservative
t3_jztzoa	The mullah report: is Biden bringing back the Iran Deal? | Spectator USA	BP	Conservative
t3_jzt2hb	Data: Trump's Anti-Globalism, Pro-Police Message Wins Over Hispanics	TP	Conservative
t3_jzsh0c	Trump Lawyer: Michigan Legislature Agrees to Hold Election Review Hearings	EF	Conservative
t3_jzl08r	Biden's Surge In Polls Motivated By Fear	O	Conservative
t3_jzkyjm	NY Mag Scientifically Proves Biden Supporters Are Racist	BS	Conservative
t3_jztwv2	Revolving Door: Obama Staffers Who Joined NBC, MSNBC, and CNN, Now Headed to Biden Admin	BS	Conservative
t3_jzrsl7	DuPont’s Shaped Biden’s "Views" (no experience!) on Business	BS	Conservative
t3_jzrfhk	Biden &amp; Corporate Charters: A Radical, Regressive Proposal	BS	Conservative
t3_jzqrab	Poll: Americans Want Biden to Stay Out of Trump Investigations &amp; Pass on Progressive Policies for Now	TS	Conservative
t3_jzkwq8	Study: Biden won thousands of illegal votes by noncitizens	EF	Conservative
t3_jzbe4j	Orwell's 1984 is prophetic: How the leftists are trying to change and erase President Trump and history	O	Conservative
t3_jz90wi	Obamas Collaborating on Anti-Trump Netflix Serie	O	Conservative
t3_jzhhqb	Once an election has been shown dirty, all voters have been disenfranchised- "Joe Biden won illegal votes from thousands of noncitizens, study shows"	EF	Conservative
t3_jzt98m	Appeals Court Grants Expedited Review of Trump Campaign's Pennsylvania Lawsuit	EF	Conservative
t3_jzrtvc	N.Y. Times op-ed admits: Trump was correct, reopen the schools	TP	Conservative
t3_jzicud	Here Comes the Biden Blame Game - If the double-dip recession hits next year, Biden will remind us over and over that it’s Donald Trump’s fault. He’ll be wrong.	BS	Conservative
t3_jz995u	President Trump in virtual G-20 remarks: "The Paris Accord was not designed to save the environment -- it was designed to kill the American economy."	TP	Conservative
t3_jzt6dy	Appeals court to review Trump's Pennsylvania case -- Legal team on track with plan to reach Supreme Court	EF	Conservative
t3_jz8s6s	Mail in ballots come in envelopes. They have creases. "Ga Poll Worker Describes Pristine Mail In Ballots, 98% for Biden"	EF	Conservative
t3_jzth0n	Seven Letter Poll: 79 Percent of Trump Voters Say Election 'Stolen'	EF	Conservative
t3_jzsv52	Hunter Biden Arrives At White House Dressed As Turkey In Hopes Of Being Pardoned By Trump	BS	Conservative
t3_k080zd	FBI Buried Hunter Biden Laptop: It’s unlikely there was ever any investigation at all.	BS	Conservative
t3_k0ao2g	Biden’s win in Nevada certified by Nevada Supreme Court	ER	Conservative
t3_k02wgo	Maxine Waters Pushes for Investigation of 'Criminal' Trump To 'Send a Message Across the World'	TS	Conservative
t3_jzx2jg	James Mattis: Joe Biden Must 'Eliminate "America First"' from U.S. Foreign Policy	O	Conservative
t3_k0ddev	Nolte: Only 3% of Trump Voters Believe Joe Biden Is Legitimate Winner	EF	Conservative
t3_k05eu0	Trump lawsuit confuses Michigan and Minnesota locations in affidavit claiming voter fraud	EF	Conservative
t3_k08cy8	Trump campaign continues to fight as more evidence of voter fraud emerges	EF	Conservative
t3_k056dg	John Brennan's breathless &amp;amp; dramatic thread bidding farewell to the president is met with calls for Trump to 'declassify everything'	O	Conservative
t3_jzzay5	Trump Won't Budge From Veto Threat Over Renaming Bases Honoring Confederates	TS	Conservative
t3_jzuvjc	Trump Administration Begins Transition Process	T	Conservative
t3_k084zn	FNC's Laura Ingraham: 'I Would Be Lying to You' if I Said There Was an 'Excellent' Chance SCOTUS Delivers Victory to Trump	EF	Conservative
t3_k0b0kz	Trump vows he’ll ‘never concede’ despite administration starting transition move	T	Conservative
t3_k0cbf4	Rashida Tlaib accused of anti-Semitism for reaction to Biden's Jewish Sec of State nominee	O	Conservative
t3_k0eyot	Joseph Nye: "Trump deserves credit for pushing back on China's abusive trade practices, but it would have been better if we worked with our allies to isolate China. Also, his trade deal has been costly for Americans without changing the trade imbalance or addressing technological issues."	TP	Conservative
t3_k0dlm3	Pennsylvania, Nevada certify election results for Biden despite Trump legal challenges	ER	Conservative
t3_k082id	Biden's Pick For National Security Adviser Is A Steele Dossier Truther	BP	Conservative
t3_k0eqm4	After joining Burisma, Hunter Biden requested meetings with Antony Blinken, Biden's Pick for Secretary of State	BP	Conservative
t3_k0ex0g	Dominion Executive: Trump is not going to win. I made f***ing sure of that.	TS	Conservative
t3_k0cb1h	Hawley 2024? Missouri Republican could be ‘Trump 2.0,’ say conservative supporters	O	Conservative
t3_jzvs4f	Trump Tells GSA, and His Team, to Begin the Transition Process; Vows to ‘Keep Up the Good Fight’	T	Conservative
t3_k085p9	Rubio derides Biden's foreign policy team: 'Polite and orderly caretakers of America's decline'	BS	Conservative
t3_k0f9nk	Where are the Republican Politicians? Have they Deserted Trump?	TS	Conservative
t3_k0dwph	Mattis says he hopes Joe Biden takes 'America First' out of national security strategy	BP	Conservative
t3_k0c7j8	Chris Evans, Zach Braff Want A List Of ‘Trump Enablers’	TS	Conservative
t3_k0elxb	The Fourth Estate: Andrea Mitchell reports that a Biden administration isn't going to be political	BS	Conservative
t3_k0fcyi	Poll: One In Six Biden Voters Would Have Changed Their Vote If They Had Known About Scandals Suppressed By Media	BS	Conservative
t3_k0flpb	Hunter Biden Arrives At White House Dressed As Turkey In Hopes Of Being Pardoned By Trump	BS	Conservative
t3_k0ei4s	Dan Bongino hints at potential run for president in 2024 if Larry Hogan runs and no Trump does	O	Conservative
t3_jzw2s8	Trump Tells GSA, and His Team, to Begin the Transition Process; Vows to ‘Keep Up the Good Fight’	T	Conservative
t3_k0flhj	Biden’s Gun-Registration Scheme Would Cost Firearm Owners Billions — If It Passed Congress and Americans Complied	BP	Conservative
t3_k0flki	Mueller Probe's Andrew Weissmann Wants Biden DOJ to Prosecute Trump	TS	Conservative
t3_k0gw1d	Holman Jenkins: Media Hysteria Is the Trump Show	TS	Conservative
t3_k0gu0e	Biden’s Cabinet: The Return of the Blob	BP	Conservative
t3_k0fhm7	The Biden Popular Front Is Doomed to Unravel	BS	Conservative
t3_k0cwtc	Google Plots to Use the Biden Administration to Avoid Accountability	BS	Conservative
t3_k0e8yx	Poll Shows Media Censorship Cheated Voters of Vital Info, Robbed Trump of Second Term	EF	Conservative
t3_k0ccte	Trump: Voters are '100% correct' that 2020 'election was stolen' -- Jenna Ellis: 'Media chatter of Joe Biden picking his cabinet is like fantasy football'	BS	Conservative
t3_k089yi	Malevolent travelers' coming if Trump's travel ban killed -- Biden has promised to eliminate executive order on 'Day 1'	TS	Conservative
t3_k0gusb	EXPLOSIVE Study: Media Suppression of 8 Key Stories 'Stole This Election' for Joe Biden	BS	Conservative
t3_k0azmb	Computer Repair Shop Involved in Hunter Biden Laptop Scandal Shuttered	BS	Conservative
t3_k07tg5	Sidney Powell responds after Trump campaign says she is not part of legal team: '#KrakenOnSteroids'	TS	Conservative
t3_k06ko7	Biden’s Student Loan Bailouts: Bad Economics, A Regressive Tax, And A Moral Hazard	BP	Conservative
t3_k07qob	Patrick Buchanan: "What Trump Will Leave in Biden's Inbox"	T	Conservative
t3_k06k0b	Two of Joe Biden's national security picks have ties to past scandals	BS	Conservative
t3_k05c36	War and more war coming with Biden’s Sec. of State Blinken	BP	Conservative
t3_k0bxsq	From revolution to restoration: Biden picks Blinken, Yellen, Kerry for plum posts	BP	Conservative
t3_k06hmi	Graham warns Biden, Pelosi and Schumer would form 'trifecta from hell' if Democrats take Senate	O	Conservative
t3_jzvyov	Perdue, Loeffler Join Trump Call for New Georgia Recount	EF	Conservative
t3_k0gldq	President Trump won?	ER	Conservative
t3_k0e90v	Secretary of state pick Antony Blinken met twice with Hunter Biden	BS	Conservative
t3_k087mh	In picking John Kerry as his cabinet-level “climate czar,” Joe Biden is signaling strong support for Rep. Alexandria Ocasio-Cortez’s costly Green New Deal. Rumors are circulating that AOC is being considered for EPA administrator or elsewhere in the administration.	BP	Conservative
t3_k0bp1y	Election Aftermath: Either Or -- It is down to an “either or” situation: either President Trump prevails in his lawsuits and multiple constitutional paths to reelection, or Joe Biden and the Democrats succeed in stealing the election.	EF	Conservative
t3_k04poa	Fearing break-up, Facebook plans to woo Joe Biden with new vaccine and climate change PR	O	Conservative
t3_k01ja2	Alan Dershowitz Says Trump Still Has ‘Two or Three Constitutional Paths’ To A 2020 Victory – But He Hasn’t Seen The Evidence To Overturn	EF	Conservative
t3_k0dv2v	WJ Live': The Viral Memo Changing the Trump Legal Strategy	TP	Conservative
t3_k0ah7t	Ted Cruz Hits AOC for Criticizing Senate Recess. "AOC seems not to know there are Democrats in the Senate. Or that Joe Biden (also a Dem) is publicly calling on Senate Dems to continue filibustering COVID relief because he thinks it will help them win Georgia.”	ER	Conservative
t3_k06f5y	2020 has been miserable in so many ways. Well here's an uplifting story guaranteed to make you smile and feel better. It's a heartwarming story of two deceased voters who made their voices heard for biden.	EF	Conservative
t3_jzyv4s	Jenna Ellis insulted Trump and his supporters in 2016. The RINOs are on the inside.	O	Conservative
t3_jzyhtm	Biden climate envoy John Kerry is a lifelong joke	BS	Conservative
t3_k0ajsq	Joe Biden Central-Planning Ambitions Dangerous	BP	Conservative
t3_k03aro	Study: Biden received thousands of non-citizen illegal votes in battleground states	EF	Conservative
t3_jzvcjq	Biden's national security adviser pick played key role in Clinton email scandal	BS	Conservative
t3_jzxk30	Study: Noncitizen votes gave Biden wins in Arizona, Georgia -- 'Decimates' claim there's 'no evidence of large-scale fraud'	EF	Conservative
t3_k04ftf	Study: Biden won thousands of illegal votes by noncitizens	EF	Conservative
t3_jzv44u	Trump Supporter Charged with Simple Assault for Breathing on Protesters	TS	Conservative
t3_k04g30	NY Mag Scientifically Proves Biden Supporters Are Racist	BS	Conservative
t3_jzyvw1	Tucker Carlson: Yes, the election was rigged for Joe Biden. Here's how	EF	Conservative
t3_k0wrot	Trump 1st President Since Carter Not to Send Troops Into New Conflict	TP	Conservative
t3_k0k9nr	Donald Trump on Mattis' Remarks that "America First" Policy Should Be Abandoned: "That says it all about Mattis. Obama fired him. I should have fired him sooner."	TP	Conservative
t3_k10tra	BREAKING: Trump pardons former national security adviser Mike Flynn	TP	Conservative
t3_k0klvg	President Trump 'is planning to pardon his national security adviser Michael Flynn'	TP	Conservative
t3_k0p5yb	Only 3% of President Donald Trump voters believe that Joe Biden legitimately won the 2020 election	EF	Conservative
t3_k1057w	Audible Gasps and Laughter From Crowd and Panel at PA Hearing When Witness Says Vote “Spikes” Went 600,000 For Biden and 3,200 For Trump (VIDEO)	EF	Conservative
t3_k0tinx	Newsmax Calls Biden Winner in Mich., Nevada, Pa. Based on Certifications	ER	Conservative
t3_k0xloo	Obama takes jab at Hispanic voters for supporting Trump.	ER	Conservative
t3_k0zuxz	Huge court win lets Trump present ballot evidence, could overturn Nevada result	EF	Conservative
t3_k0j2vo	Predicting a second Trump term, Sidney Powell says 'massive' Georgia lawsuit coming by Thanksgiving eve	EF	Conservative
t3_k0jq0y	Pennsylvania, Arizona, Michigan Legislatures to Hold Public Hearings on Election: Trump Campaign	EF	Conservative
t3_k0l7fa	Watch–Joe Biden: Amnesty for Over 11 Million Illegal Aliens Going to Senate in My First 100 Days	BP	Conservative
t3_k0jilv	White House press caught laughing at McEnany and Trump -- 'They got COVID. They lost the election'	O	Conservative
t3_k0tdrc	CNN Credits Biden for Dow Hitting 30,000 for the First Time: AIR.TV	O	Conservative
t3_k10suc	Days After Pennsylvania Tries To Certify Election – Judge Intervenes For Trump, Blocks Any Further Certification Pending Hearing	EF	Conservative
t3_k0ji3v	PA Rep. Guy Reschenthaler: Pa. Certifying Tainted Results 'Reckless' -- "Secretary Boockvar said Pennsylvania was going to go to Joe Biden before voting even started."	EF	Conservative
t3_k10qr9	BREAKING: Trump pardons former national security adviser Mike Flynn	TP	Conservative
t3_k0xmvl	Huge court win lets Trump present ballot evidence, could overturn Nevada result	EF	Conservative
t3_k0yu2x	Keith Olbermann Unhinged — ‘We need to turn Trump Hotels into prisons for his supporters’…	O	Conservative
t3_k1188p	Without Evidence, Former President Obama Accuses Hispanic Trump Voters Of Bigotry	O	Conservative
t3_k0yjr6	Major LGBT Group Urges Biden to Strip Accreditation of Christian Schools, Colleges	BP	Conservative
t3_k0t3ex	Exit Polls Suggest Little Enthusiasm for Biden among Union Members	O	Conservative
t3_k0szmt	Sorry Media, Trump Is Still President And This Is Still His Stock Market	O	Conservative
t3_k0jbio	Potential Joe Biden White House Staffer Justified Palestinian Suicide Bombers	BS	Conservative
t3_k0w69z	We did it': Fox News owner's wife celebrated Biden's projected presidential win in a tweet	O	Conservative
