Name	Title	Coding	Subreddit
t3_k0advf	Election fraud to any degree destroys trust	Other	Conservative
t3_k030ei	Democratic Member Seeks To Disbar Two Dozen Lawyers Challenging Election Results	Other	Conservative
t3_k0a7jl	Pushed Out? Feinstein Stepping Down As Lead Democrat On Judiciary Committee Following Left-Wing Criticism	Other	Conservative
t3_k03pge	Americans Across the Nation Are Rising Up Against Draconian Lockdowns	Other	Conservative
t3_k057qr	Democrat Governors are Suicidal -- or They Don’t Believe in Their Own Lockdowns	Other	Conservative
t3_k06qac	Tennessee Democrat Jim Cooper Attacks People With Down Syndrome To Mock Republican Voters	Other	Conservative
t3_jzyhp2	Pentagon Report: China Now Has World’s Largest Navy as Beijing Expands Military Influence - USNI News	Other	Conservative
t3_k086eq	When It Comes to Election Fraud, It's 'Hear No Evil, See No Evil, Speak No Evil'	Other	Conservative
t3_k09j7d	Lord Acton on the enduring significance of the American Revolution	Other	Conservative
t3_k05bqx	Stephen Moore: "Paris Climate Treaty Puts America Last"	Other	Conservative
t3_jzyl5p	One in four Rhode Islanders can't meet basic food needs, food bank's annual report says	Other	Conservative
t3_k0bmn2	Psychologist And Search Engine Expert Robert Epstein: Google Shifted a 'Minimum' of 6 Million Votes in 2020	Other	Conservative
t3_jzyhdn	The Great Relocation: Americans Are Relocating By The Millions Because They Can Feel What Is Coming	Other	Conservative
t3_k096yy	AOC and Ted Cruz clash over stalled COVID-19 relief bill	Other	Conservative
t3_k06pu6	Andrew Cuomo Absolutely Deserves An Emmy Award -- Cuomo is America’s greatest governor on television--and its worst in real life.	Other	Conservative
t3_k06shu	Lone Michigan Canvasser Holdout: 'Whoever Threatens the Most Wins'	Other	Conservative
t3_k01jah	Republican Maryland governor says no one has a 'constitutional right to walk around without a mask'	Other	Conservative
t3_k03tho	War has and is being waged principally against our culture -- against our values, beliefs, and mores. It has been and is against the fundamentals of a healthy society. The assaults are against what’s organic to a vital society: marriage, family, and children, neighborhood and community.	Other	Conservative
t3_k02cf8	Pompeo Predicts ‘Many’ More Mideast Peace Deals: ‘We Broke Glass’	Other	Conservative
t3_k0fh0y	Pennsylvania, Arizona and Michigan state leglislatures to hold hearings on 2020 election	Other	Conservative
t3_k05smd	PA's Thanksgiving liquor sales mandate is just bizarre	Other	Conservative
t3_k06dyp	The Coming Anti-COVID Restriction Backlash	Other	Conservative
t3_jzvxbq	Rudy Giuliani on Break with Sidney Powell: 'We're Pursuing Two Different Theories'	Other	Conservative
t3_k002s3	SCOTUS issues new circuit assignments - “justices can opt to bring cases from their circuit straight to the Supreme Court.”	Other	Conservative
t3_k0btwo	All SUNY Students Must Test Negative for COVID Before Thanksgiving Break: Chancellor	Other	Conservative
t3_jzysdb	Good ol’ progressive liberals pushing for segregation in college universities.	Other	Conservative
t3_k04204	Cooper’s Office Now Claims He Meant To Say All Republicans Are Racist, Not Mentally Disabled	Other	Conservative
t3_k0f82l	Thousands in Georgia Registered at Postal, Commercial Addresses, Portraying Them as Residences, Researcher Says	Other	Conservative
t3_jzxcny	On Coronavirus, We Must Not Allow Politics to Dictate Science - The New American	Other	Conservative
t3_k06z4h	3rd major COVID-19 vaccine shown to be effective and cheaper	Other	Conservative
t3_k05pg0	Border Security is Crucial for National Security	Other	Conservative
t3_k0f5vv	New Congresswoman Creates a Furor by Asking About Her Second Amendment Rights	Other	Conservative
t3_k0e5rw	Black Republican Opponent Expected to Defeat Stockton’s Popular Democratic Mayor Michael Tubbs	Other	Conservative
t3_k0f3x1	New Virginia study finds online schooling is severely damaging students' academic achievement	Other	Conservative
t3_k04xql	Swiss Doctors Asking Vulnerable To Sign “Do Not Resuscitate” Orders	Other	Conservative
t3_k0gnnd	Woke media outlet tries to make a funny video about white stereotypes and it's the most racist thing you'll watch today	Other	Conservative
t3_k0e821	Group Files Emergency Petition in Wisconsin After Identifying 150,000 Potentially Fraudulent Ballots	Other	Conservative
t3_k0e1wa	Errors, 'Scams' Led California To Send Millions In COVID Unemployment Benefits To Prisoners, Death Row Inmates	Other	Conservative
t3_k0dh1k	It doesn't end with COVID. Matt Hancock in the UK wants to use NHS testing system to fight flu after Covid.	Other	Conservative
t3_k0g153	Edward Solomon reverse-engineered the Dominion Voting Algorithm	Other	Conservative
t3_k0fkwk	Republicans should make AOC House Speaker | Spectator USA	Other	Conservative
t3_k0eqx8	US Drafts List of 89 China Firms With Military Ties	Other	Conservative
t3_k0fvav	Cammack: 'Only in America' Could I Go from Homelessness to Congress	Other	Conservative
t3_jzyc64	What Gavin Newsom’s Inevitable Political Doom Means for Democrats - American Greatness	Other	Conservative
t3_k0c74s	Ohio lawmakers say elective medical procedures could be postponed amid ‘exponential’ surge in COVID-19 cases	Other	Conservative
t3_jzwuzq	Cooperate with China or World War 3: Kissinger	Other	Conservative
t3_k0ga53	Allison Pearson: Leftists who dominate our institutions get to define what constitutes offensive behaviour, then they come up with a new “ism”	Other	Conservative
t3_jzzjmx	Covid-19: China pushes for QR code based global travel system	Other	Conservative
t3_k07vyg	Why Philly Gym Owners Are Protesting Un-Real New Regulations	Other	Conservative
t3_k0eo86	CDC talks about COVID Camps	Other	Conservative
t3_k0ayuw	Republican Maryland governor says no one has a 'constitutional right to walk around without a mask'	Other	Conservative
t3_k072ev	International Flyers May Soon Need to Get Virus Vaccinations	Other	Conservative
t3_k00ina	Rudy Giuliani Explains Why He Distanced Himself From Sidney Powell	Other	Conservative
t3_k08gxz	The Skyrocketing National Debt is Highly Problematic	Other	Conservative
t3_k0d6er	Raphael Warnock reportedly said racism is America’s ‘pre-existing condition’	Other	Conservative
t3_k0b1lq	Maryland Gov. Larry Hogan expands coronavirus snitch line: ‘There’s no constitutional right’ to go maskless	Other	Conservative
t3_k06bbf	Risk v. Profit: Uncle Sam needs a better way to budget for federal lending.	Other	Conservative
t3_k0gi2f	Oregon Governor: Snitch On Your Neighbors For Violating Thanksgiving COVID Orders	Other	Conservative
t3_k0geb9	Martin Wolf: What the world can learn from the Covid-19 pandemic	Other	Conservative
t3_k0fxl4	BLM pressures Democrats to embrace bill described as 'roadmap for prison abolition'	Other	Conservative
t3_k0cdgj	Rand Paul: No DOJ Investigation into Funding Behind ‘The Thugs’ Who Attacked Republicans After RNC Event in August	Other	Conservative
t3_k0a425	Ballots cast by the dead emerge in extremely tight Brindisi-Tenney race	Other	Conservative
t3_k00l9s	Where American Workers Donated This Presidential Election	Other	Conservative
t3_k0eqho	Justin Haskins: Democratic socialists grow stronger, weakening Dems with losses in swing districts	Other	Conservative
t3_k0crt9	How to Start Curbing Violent Crime by Lt Col Jeff Cooper	Other	Conservative
t3_k06gh5	Sen. Feinstein to Step Down from Judiciary Committee After Backlash from Progressives	Other	Conservative
t3_k0eqk1	The Corona Virus Pandemic, an Analysis: Part 1 By Dr. Roger Hodkinson (this is the Canadian pathologist who went off in a public health meeting a little while ago)	Other	Conservative
t3_k0gthn	Jason Riley: The Political Class’s Hypocrisy Long Predates Covid-19	Other	Conservative
t3_k0efw5	Women and girls are about to be portrayed in textbooks a lot differently	Other	Conservative
t3_k0b3fu	Dow Jones Surpasses 30,000 for the First Time	Other	Conservative
t3_k0ajdu	University System Mandates 140,000 Students Test Negative For COVID-19 Before They Can Leave For Thanksgiving	Other	Conservative
t3_k0gtyq	The DOJ and FBI will Never Investigate or Prosecute any Democrat.	Other	Conservative
t3_k0d4w6	After Fending Off Pandemic Challenger, Planned Parenthood Retains Title For Most Americans Killed In 2020	Other	Conservative
t3_k0ccod	Redfield projects COVID-19 vaccine to be rolled out by 'end of the second week in December'	Other	Conservative
t3_k0gwq1	Julie Kelly: Something Rotten in Pennsylvania	Other	Conservative
t3_k0gcz7	Melanie Phillips: Covid cronyism shows state machine is broken	Other	Conservative
t3_k0euj2	The new silent majority, watch democrats raise the voting age to 90+	Other	Conservative
t3_k004hg	Ex-MSNBC producer: Andrew Yang was on 'list' of 2020 Dems banned from appearing on Lawrence O'Donnell's show	Other	Conservative
t3_k0gf70	Joseph Ladapo: Too Much Caution Is Killing Covid Patients	Other	Conservative
t3_k0fqw0	Narcissists love being pandemic essential workers They post more about work on social media, feel more important (probably the epidemiologists and pathologists as well)	Other	Conservative
t3_k0fhen	Even social media sites tried to block links to the news.	Other	Conservative
t3_k08ch8	RNC Chair: Democrats used COVID to remove election safeguards	Other	Conservative
t3_k00ilt	Apple Security Chief Offered iPads to Police as a Bribe for Gun Permits, Prosecutors Allege	Other	Conservative
t3_k0fv5x	Man Catches Flu, Dies, From Eating Outside In The Cold To Avoid Getting COVID-19 (satire)	Other	Conservative
t3_k0cgns	Expunging an electoral stain: U.S. voting must re-establish pre-pandemic integrity	Other	Conservative
t3_k0g7ub	The Thieves Who Stole Our Election Got Sloppy	Other	Conservative
t3_k0fw2z	Peer-reviewed hydroxychloroquine study finds 84% fewer hospitalizations among early treated outpatients	Other	Conservative
t3_k0ac7f	Vaccine tracking	Other	Conservative
t3_k0bj4j	On Thanksgiving, Democrats Demand The Ultimate Family Separation Policy -- Life is too short to live it in fear of dying.	Other	Conservative
t3_k0b3oo	AOC Blames Republicans for Democrats Delaying Additional COVID Relief	Other	Conservative
t3_k075oi	Will The Supreme Court Defend Religious Liberty From Pandemic Tyrants?	Other	Conservative
t3_k03w3s	CNN Lets Lincoln Project Stooge Advocate Revoking Republican Canvasser's Legal License	Other	Conservative
t3_jzzqlp	By Every Legal Means Necessary	Other	Conservative
t3_jzvrgz	Chinese Regime's Media Outlet Continues Paying US Media Millions to Publish Its Propaganda. "China Daily’s expenses from May 1 to Oct. 31 this year were above $4.4 million ... around $3.1 million was spent on printing &amp; advertising"	Other	Conservative
t3_k0b9vs	Dick Morris to Newsmax TV: Stats Prove Ballot Stuffing	Other	Conservative
t3_k06k7z	Presidential Election Isn’t Over Yet, Conservative Leaders Say -- Until “every legal vote” is counted.	Other	Conservative
t3_jzvzbu	Hillbilly Elegy': Caught Between Hollywood and a Hard Place	Other	Conservative
t3_jzvn07	Dianne Feinstein Paid the Price for Being Too Nice to Amy Coney Barrett	Other	Conservative
t3_jzvmzj	Guess Who is Having Thanksgiving Dinner With His Elderly Mother?	Other	Conservative
t3_k0cvkl	Get Ready Millennial’s; You’re About To Be Sorely Disappointed with Your Vote	Other	Conservative
t3_k0bv2d	USA Election 2020 Was Rigged: The Evidence - Patrick Byrne	Other	Conservative
t3_k09og9	Violent crime surges as police funding plummets | One America News Network	Other	Conservative
t3_k06l85	Tucker Carlson: Here's how the Democrats 'rigged' the 2020 election	Other	Conservative
t3_k053va	A Quick Tutorial On How Dominion Can Alter Your Vote Straight From The Horses Mouth	Other	Conservative
t3_jzxm2l	Constitutional experts: Fraud could put election outcome in state legislators' hands -- Analysis reveals lawmakers have 'total authority' to select electors	Other	Conservative
t3_jzx8pa	Berlin Woman 'Forgives' African Migrant Who Bit Off Part of Her Face	Other	Conservative
t3_jzvuk4	A Crisis of Trust -- Irrespective of who puts his hand on the Bible at the January 20th inauguration to take the oath of office as president of the United States, we’re sure to experience a troubling crisis of trust in our divided country.	Other	Conservative
t3_k09gfg	Dominion VP Explains How to Alter Votes	Other	Conservative
t3_k04p10	MSNBC Defends Rev. Jeremiah Wright Saying, “Not God Bless America! God Damn America!”	Other	Conservative
t3_jzz54q	They think you're stupid. The Great Reset.	Other	Conservative
t3_jzw4ch	Chinese President Xi Jinping Pushes For Global Tracking System Using QR Codes	Other	Conservative
t3_k03sbw	Tucker Carlson: The 2020 Election Was Not Fair, "The System Was Rigged Against One Candidate"	Other	Conservative
t3_k09x1u	Patrick Byrne of Overstock has been poring through the data: This election was rigged — deeply « JoNova	Other	Conservative
t3_k047n5	Socialism Failed Miserably For The American Pilgrims, Just Like It Does Everywhere -- Private property rights and personal responsibility saved the Plymouth colony from the edge of extinction and laid the economic foundation for a free and prosperous nation.	Other	Conservative
t3_k00976	Started a more lax conservative hang out, not all politics by any means but plenty of channels and All are welcome.	Other	Conservative
t3_jzvyqr	Antiracism Icon Robin DiAngelo Paid More Than Black Woman for Same Job	Other	Conservative
t3_jzvmzc	Poll: Overwhelming Majority Back GOP Senate Majority	Other	Conservative
t3_k0472k	How The New York Times Became A Propaganda Bullhorn For The Left -- ‘The news business is highly competitive. If the leader has abandoned its own standards and history of fair and rigorous reporting, why should the others be any different?’	Other	Conservative
t3_k038hk	A Quick Tutorial On How Dominion Can Alter Your Vote Straight From The Horses Mouth	Other	Conservative
t3_jzvvyt	Socialist delegate proposes all future marijuana tax revenue in Virginia be used for reparations	Other	Conservative
t3_jzvvuu	Gun Grabbers Demand Unprecedented “Executive Actions”	Other	Conservative
t3_jzvmzv	What's Odd About That Story of a Nurse Who Trashed Her Dying COVID Patients	Other	Conservative
t3_k071or	Are they aware that if Thanksgiving gets canceled, it will become a regular work day for millions? **UP NEXT: Why the Left Hates Food**	Other	Conservative
t3_k0427y	Court: Texas, Louisiana Can End Planned Parenthood Funding	Other	Conservative
t3_jzv50n	HBO: ‘I’m A Little Shy’, Shows 4-Year-Old boy Prompted To say he's a Girl	Other	Conservative
t3_jzw41k	Pope's Encyclical Is Like Hindu Scriptures'	Other	Conservative
t3_jzvcz2	Removal of Election Safeguards in Arizona Eroded Voter Integrity: Tea Party Official	Other	Conservative
t3_jzxo5l	Dick Morris: Stats Prove Ballot Stuffing	Other	Conservative
t3_jzvmmo	Explosive: New Data Points to VOTER FRAUD in Montgomery County, PA	Other	Conservative
t3_jzzmvb	Democrats Push To Keep Schools Closed So Kids Will Be Dumb Enough To Accept Socialism	Other	Conservative
t3_k0r668	Fox News daytime ratings drop by 32% in two weeks since the election	Other	Conservative
t3_k0rwgx	‘Transhood’ Documentary Shows Parents Brainwashing 4-Year-Olds Into Transgenderism -- New HBO documentary depicts parents propagandizing their children in radical gender theory and robbing them of life in their natural bodies.	Other	Conservative
t3_k0j3lb	Several employees cried when they learned their company would be publishing Jordan Peterson's new book	Other	Conservative
t3_k0jdb0	NYC Mayor de Blasio fines synagogue $15K for massive secret wedding, says house of worship will be closed down if there's 'any further illegal activity'	Other	Conservative
t3_k0rvsa	A 90-Year-Old Woman Killed Herself To Avoid Another COVID-19 Lockdown. She’s Not Alone -- In a tragic irony, the prospect of another 'life-saving' lockdown has drained some senior citizens of their will to live. Assisted suicides and depression are up.	Other	Conservative
t3_k0sp76	Jack Dorsey: 'Let Me Be Clear: Twitter Is A Platform For ANY And ALL Ideas I Wholeheartedly Agree With'	Other	Conservative
t3_k103xp	Crowd Erupts in Grasps and Laughter at Vote Anomaly	Other	Conservative
t3_k0pzpf	And the Emmy for Most Deaths goes to…	Other	Conservative
t3_k0uva9	TESLA CEO, Elon Musk overtakes Bill Gates to become the world’s second-richest man after his net worth rose by $100B in a year during pandemic	Other	Conservative
t3_k0wr05	Defiant NY gym owner, US Marine rips up $15,000 fine for violating coronavirus restrictions	Other	Conservative
t3_k0o7b1	YouTube Bows to Transgender Activists, Deletes Candace Owens Podcast.	Other	Conservative
t3_k0qupx	Penguin Random House staffers broke down in tears over release of Jordan Peterson book: report	Other	Conservative
t3_k0kdxr	Breaking!! Group Files Emergency Petition in Wisconsin After Identifying 150,000 Potentially Fraudulent Ballots found by statistician Matthew Braynard and mathematician Steven Miller. (New video in comments with complete statistical results in all contested states!)	Other	Conservative
t3_k0y9ro	Ballot Chain of Custody Destroyed in Delaware County, PA	Other	Conservative
t3_k0x58b	After warnings to avoid travel, Denver Mayor, Mike Hancock flies to visit family for Thanksgiving	Other	Conservative
t3_k0yua3	BREAKING: Judge Blocks Pennsylvania Certification!!!	Other	Conservative
t3_k0jc0r	California paid up to $1 billion in fraudulent unemployment claims to prisoners — including death row inmates	Other	Conservative
t3_k0q9xh	Appeals Court Rules Texas, Louisiana Can Cut Medicaid Funding to Planned Parenthood	Other	Conservative
t3_k0jd2p	New Virginia study finds online schooling is severely damaging students' academic achievement	Other	Conservative
t3_k0jb4k	Vermont to question schoolchildren over Thanksgiving gatherings, and require quarantine for violators	Other	Conservative
t3_k0z94o	Governor Newsom Orders Police To Go Door To Door Arresting Anyone Not Depressed And Alone	Other	Conservative
t3_k0wqao	Black Lives Matter Leader Killed in Carjacking	Other	Conservative
t3_k0usrg	Gov. Andrew Cuomo blasts NYPD for refusing to enforce Thanksgiving restrictions: Those people aren't real law enforcement officers	Other	Conservative
t3_k0r8zj	Now that fascism has been defeated in America, we can finally enforce COVID lockdowns without resistance. Our nation is finally free to lockdown to save ourselves from a virus with a .001% fatality rate.	Other	Conservative
t3_k0xw1a	PENNSYLVANIA "Judge Patricia McCullough ordered the state to not take any further steps to complete the certification of the presidential race... She also blocked the certification of *ALL* the other election results."	Other	Conservative
t3_k0zvm1	Pennsylvania state judge sides with GOP, halting election certification	Other	Conservative
t3_k0wfq1	Judge Blocks Certification of Pennsylvania Election Results	Other	Conservative
t3_k0r5g3	Staff of Canadian publishing company reportedly cry over decision to publish Jordan Peterson's new book	Other	Conservative
t3_k11fhk	Barack Obama accuses Republicans of creating 'sense that white males are victims'	Other	Conservative
t3_k0zfys	Judge Blocks Certification of Pennsylvania Election Results	Other	Conservative
t3_k0tcaw	Michigan ramps up threats to prosecute vote-fraud WITNESSES	Other	Conservative
t3_k122cs	Rudy Guiliania and Ellis nail it at the legislature voter fraud hearing in Pennsylvania	Other	Conservative
t3_k0sub3	Forcing The Sick And Elderly To Die Alone Is Crueler Than COVID-19	Other	Conservative
t3_k0mhzq	Lin Wood Subpoenas Georgia Officials For Video Evidence	Other	Conservative
t3_k0wq8d	Buildings Lit Up Blood Red to Protest Christian Persecution	Other	Conservative
t3_k0rnmx	Ted Cruz Goes Head To Head With Queen AOC – She Blames Republicans For Relief Stalemate, But Ted Spotlights Their Filibuster	Other	Conservative
t3_k0whvf	Sidney Powell To File Lawsuit Wednesday in Georgia Alleging Massive Voter Fraud	Other	Conservative
t3_k0miwa	Patrick Byrne lays out summary of the Dominion-related evidence he has provided Sidney Powell ahead of her filing suit in GA. While additional angles of attack are hinted at by Powell, this is what she's working from regarding Dominion.	Other	Conservative
t3_k0jco2	In GA, during (late?) Sept, Dominion’s radical Leftist Eric Coomer made a “critical software change” to GA’s Dominion voting machines “without adequate testing or certification from the U.S. Election Assistance Commission”. From this 9/29/20 AJC story	Other	Conservative
t3_k0rvcr	Following The Election, Facebook Tightens Choke On News Outlets It Disagrees With -- Sources such as CNN, The New York Times, NPR, and others benefitted from Zuckerberg’s changes, receiving more traffic and distribution on the site while conservative news artificially lost page views and reach.	Other	Conservative
t3_k0kguy	OAN Responds After YouTube Temporarily Bans, Demonetizes Outlet Over 'Unlisted' COVID-19 Video	Other	Conservative
t3_k12tyj	Michigan County Commission Backs Gretchen Whitmer Impeachment	Other	Conservative
t3_k0xhuf	Pittsburgh Judge Halts Further Election Certification Steps	Other	Conservative
t3_k11r3w	WATCH: Voter Fraud and Election Meddling Evidence Floods Social Media	Other	Conservative
t3_k0z0wc	Thousands of "Votes" in Georgia Used False Address	Other	Conservative
t3_k133fs	Hungary PM Orban denounces George Clooney as a puppet of Soros	Other	Conservative
t3_k0zj9d	New ‘Study’ Claims ‘Far-Right Terrorism’ is ‘Bigger Threat to West Than Islamic State’	Other	Conservative
t3_k0lvqq	Democrats keep getting caught breaking their own coronavirus rules	Other	Conservative
t3_k0wkx2	“It’s a good day for freedom” - South Dakota’s government is not taking the lead in mandating CDC protocols	Other	Conservative
t3_k0k6y8	New Mexico governor shuts down grocery stores for two weeks	Other	Conservative
t3_k11qj5	Gun-toting Congresswoman-elect Lauren Boebert may carry Glock at Capitol	Other	Conservative
t3_k0zykq	Portland's Black BLM Activists Say They're Done With 'White' Antifa, Want 'Separation'	Other	Conservative
t3_k12dov	Denver mayor couldn't even wait a whole hour to fly to Mississippi for Thanksgiving after warning people to 'avoid travel, if you can'	Other	Conservative
t3_k0sz2v	Nevada Lawsuit Claiming Illegal Ballots Cast Has a Trial Date December 3rd	Other	Conservative
t3_k109jk	Data scientist slams 'inherently biased' media for glossing over COVID spikes in blue states	Other	Conservative
t3_k0nkgh	Commentary: Harvard Researchers: Nearly Half of Young Adults Showing Signs of Depression Amid Restrictions	Other	Conservative
t3_k11mtb	Black Lives Matter activist who helped lead Louisville marches shot dead	Other	Conservative
t3_k0lp3i	Republicans Sue to Stop Wisconsin Vote Certification	Other	Conservative
t3_k0l6o7	Kamala's Replacement In the Senate Could Be Determined By a Critical Person From Her Past: Former San Francisco Mayor and Assembly Speaker Willie Brown	Other	Conservative
t3_k13x2m	Pennsylvania witnesses allege massive amount of fraud in today's hearing.	Other	Conservative
t3_k0xjty	Judge Blocks Certification of Pennsylvania Election Results Until Friday Hearing	Other	Conservative
t3_k11u1c	ICE says double-murder suspect was protected by California sanctuary city	Other	Conservative
t3_k0yrcc	Thousands in Georgia Used False Address For Voting: Researcher	Other	Conservative
t3_k0w3nt	BREAKING: TREASON: GA Gov. Kemp and CA Gov. Newsom bought off by communist China in covid supplies kickback and money laundering schemes	Other	Conservative
t3_k0kfnp	Is fame going to Gov. Andrew Cuomo’s head?	Other	Conservative
t3_k0xv3k	Depression rate in the United States triples during COVID pandemic, research shows	Other	Conservative
t3_k0pvj3	Sharyl Attkisson on Big Tech Censorship: Sheep Are Happy to Live in Artificial Reality	Other	Conservative
t3_k0xzxm	Suicide Claimed More Lives in October Than 10 Months of COVID-19 in Japan, Report Shows | Jon Miltimore	Other	Conservative
t3_k0vpyy	Rep. Ilhan Omar turns in worst underperformance for House candidate in the country	Other	Conservative
t3_k0k8t2	U. of Virginia Student Newspaper: Stand Up to 'Racist' Family at Thanksgiving	Other	Conservative
t3_k0k0mj	New Petition filed w/court from AZ GOP: filed a petition today with the Court to allow early inspection	Other	Conservative
t3_k0xooo	Los Angeles County Health Officials Can’t Provide Data To Support Their New Outdoor Dining Restrictions	Other	Conservative
t3_k12rya	Dominion Techie Worked For CCP Military Proxy Flagged By U.S. Govt For ‘Malicious Cyber Activity’	Other	Conservative
t3_k0x6mv	GOP Chair Christiana asks DA to review mail-in ballot envelopes, requests from nursing homes	Other	Conservative
t3_k0x2rj	India ban more Chinese apps and China Criticize | Flash News	Other	Conservative
t3_k0rbgt	‘Faulty Upload’ Changes Unofficial Vote Totals In AZ, Gets Fixed	Other	Conservative
t3_k1493x	Staffers Crying Over Jordan Peterson Book Cured By Forcing Them To Read Jordan Peterson Book	Other	Conservative
t3_k0yhkx	Judge Blocks Certification of Pennsylvania Election Results	Other	Conservative
t3_k0yb0m	Pennsylvania judge halts election certification amid mail-in vote fight	Other	Conservative
t3_k0sv4m	For Anti-Racism, San Diego Schools Will Teach Black, Hispanic Kids Less	Other	Conservative
t3_k0ry42	LA Public Health unable to provide data to support outdoor dining restrictions when pressed by county leader	Other	Conservative
t3_k12j3o	TREASON: GA Gov. Kemp and CA Gov. Newsom bought off by communist China in covid supplies kickback and money laundering schemes	Other	Conservative
