Name	Title	Coding	Data Collected
t3_k1i78k	PA Lt. Governor to Trump lawyer Giuliani: Where's the voter fraud? | Rudy Giuliani and Donald Trump are still attacking Pennsylvania's election results. The commonwealth's Lt. Governor John Fetterman says the evidence for that fraud simply does not exist.		26-11-20
t3_k1fqxm	Biden predicted a GOP 'epiphany' after the election. Trump's standing in the way.		26-11-20
t3_k19487	"Over phone, Trump tells Pennsylvania hearing U.S. election must be ‘turned around’"		26-11-20
t3_k17yc5	Biden Urged to 'Honor Indigenous Sovereignty and Immediately Halt' Fossil Fuel Pipelines		26-11-20
t3_k1guvu	Bidens Highlight 'Sacrifice' of Staying Home for Thanksgiving While Trump Urges Americans to Gather		26-11-20
t3_k1pktd	Donald Trump says he will leave the White House if Joe Biden is confirmed by electoral college		26-11-20
t3_k1gsph	Biden to face test over access to sensitive information as he inherits Trump's secret server		26-11-20
t3_k1gw51	Trump’s baseless election fraud claims in Georgia turn Senate runoffs into a ‘high-wire act’ for Republicans		26-11-20
t3_k1p3nm	Trump Supporters Want to Boycott the Georgia Runoffs. Is Their Threat Genuine?		26-11-20
t3_k1m6vv	Teddy Roosevelt relative joins mockery of Trump ‘elite strike force’ lawyer for misquoting his ancestor: The former president’s great-grandson mocked Jenna Ellis’s ‘ifea’ defence for misquote		26-11-20
t3_k1cb5e	Trump Retweets Rep. Matt Gaetz Urging Him to Pardon Himself		26-11-20
t3_k1720h	Biden promises some student loan forgiveness. Student borrowers hope he delivers.		26-11-20
t3_k1o9e2	Ex-Trump Lawyer Sidney Powell Mocked For Typo-Laden Lawsuits		26-11-20
t3_k1l51b	They’re Baaack: Trump and Allies Still Refuse Election Loss		26-11-20
t3_k1ndvj	Error-riddled lawsuit filed in Georgia by Ex-Trump lawyer		26-11-20
t3_k1ofbw	Justice Department appeals order it cannot rep. Trump in E. Jean Carroll case		26-11-20
t3_k1mojr	Trump administration removes experts from Defense Policy Board		26-11-20
t3_k1ie4m	‘A polite coup d’etat’: Trump and allies continue baseless claims on U.S. election		26-11-20
t3_k1g86b	They're baaack: Trump and allies still refuse election loss		26-11-20
t3_k1powx	Trump says it will be 'a very hard thing' to concede to Biden		26-11-20
t3_k1p8x2	US election result: Trump comes step closer to conceding as he says he will respect Electoral College vote		26-11-20
t3_k1gz8v	Secluded and deluded: Trump’s post-election actions show a mad-monarch mindset		26-11-20
t3_k1oemk	‘I know this isn’t the way we hoped we’d spend our holiday’: Bidens send a Thanksgiving message to the nation		26-11-20
t3_k1a37f	"Trump fixates on bogus election claims, leaves Americans struggling without Covid relief"		26-11-20
t3_k1h61e	"Trump Races to Weaken Environmental and Worker Protections, and Implement Other Last-Minute Policies, Before Jan. 20"		26-11-20
t3_k1ep1i	Trump Tweets Bogus Poll Backing His Refusal to Concede		26-11-20
t3_k1p2pk	‘Loser’: How a Lifelong Fear Bookended Trump’s Presidency. The president’s inability to concede the election is the latest reality-denying moment in a career preoccupied with an epithet.		26-11-20
t3_k1jqka	"New Rule Would Allow U.S. to Use More Methods for Executions — The rule, which would permit methods including firing squads and electrocution, comes as the administration rushes to execute five more prisoners before President Trump’s term ends."		26-11-20
t3_k1j9gh	"Citing conspiracy theories, Michigan GOP electors ask court to name Trump winner"		26-11-20
t3_k1e1r5	A sweet Thanksgiving after all: America has rebuffed Trump's assault on democracy		26-11-20
t3_k1ndor	"Donald Trump should pardon Joe Exotic and himself to combat ‘radical left bloodlust’, says congressman"		26-11-20
t3_k1l7ht	"DOJ to Appeal Judge's Injunction Against 'Cruel, Unprecedented Policy' of Deporting Migrant Children | The Trump administration—which has denied the severity of the coronavirus pandemic and seized infants from their parents—claims it is acting in the interest of public health and children."		26-11-20
t3_k1eyky	They’re baaack: Trump and allies still refuse election loss		26-11-20
t3_k1q2fd	"After Trump retweets call to pardon himself, Fox News asks ""can he?"""		26-11-20
t3_k16xcm	"Biden victory in hand, Black church get-out-the-vote workers assess the future"		26-11-20
t3_k1qmwz	Noam Chomsky: Trump Has Revealed the Extreme Fragility of American Democracy		26-11-20
t3_k1po3b	"Trump Is Leaving the White House. Meanwhile, He’s Escalating His Execution Spree."		26-11-20
t3_k1ik5o	Trump’s Last Act: Risking National Security to Honor the Confederacy — He promises to veto the Defense Appropriations Authorization Act if it forces Pentagon to change the names of bases and ships.		26-11-20
t3_k1jara	Trump Rushes to Weaken Environmental and Worker Protections Before January 20		26-11-20
t3_k1igbf	Trump Is Trying to Bring Back Firing Squads		26-11-20
t3_k19nd4	Biden and Harris to skip big Thanksgiving celebrations		26-11-20
t3_k17428	What happens if Trump gets pardon-happy in his final days in office		26-11-20
t3_k16m05	Journalist Carl Bernstein says Sen. Rob Portman despises Trump. Spokeswoman says that's not true.		26-11-20
t3_k1ezsv	Joe Biden Defends His Cabinet Choices: 'This Is Not A Third Obama Term'		26-11-20
t3_k1pwhs	Trump says he will leave if electoral college votes for Biden		26-11-20
t3_k1h3fq	No Pardon Can Save Trump’s Terrible Thanksgiving		26-11-20
t3_k15p9e	Donald Trump still believes US election was ‘rigged’		26-11-20
t3_k1e6zb	Only a quarter of Republicans believe Donald Trump should concede		26-11-20
t3_k1dp4g	"Barack Obama has taken a swipe at Hispanic voters who chose Donald Trump, accusing them of ignoring the US president's ""racist"" comments."		26-11-20
t3_k1n0su	"In Georgia, Republicans juggle Biden win and Trump loyalties"		26-11-20
t3_k1pmcb	Column: Trump does his worst to make Biden's job even tougher		26-11-20
t3_k19tun	Federal Court Rejects Challenge To Trump's Push To Alter A Key Census Count		26-11-20
t3_k19s2w	Immigrant advocates to Biden: Be better than Obama		26-11-20
t3_k1ptd8	Trump says he'll leave White House if Biden declared winner of Electoral College		26-11-20
t3_k1qpk7	"In Thanksgiving Message, Trump Says ‘We’re Like a Third-World Country’ Because He Lost Election"		26-11-20
t3_k1nj9u	China is likely to be Biden’s biggest cybersecurity challenge		26-11-20
t3_k1pohl	Trump Says He Will Leave the White House if Electoral College Votes for Biden		26-11-20
t3_k1gch7	"Biden tries to spread calm, as some Democrats worry about his willingness to fight"		26-11-20
t3_k1p3lo	Trump Sought Options for Attacking Iran to Stop Its Growing Nuclear Program		26-11-20
t3_k1pgg0	"Trump Defiant in Thanksgiving Remarks, Unwilling to Concede"		26-11-20
t3_k1fqf3	Joe and Jill Biden: Our most important Thanksgiving tradition		26-11-20
t3_k1ijh0	"Trump Shared a Tweet Saying He Should Pardon Himself, and Joe Exotic"		26-11-20
t3_k1q67z	Just In: Trump says he'll leave White House if Biden declared winner of Electoral College		26-11-20
t3_k1pss6	Donald Trump says he will leave White House if electoral college votes for Joe Biden		26-11-20
t3_k1r17h	Man sues for refund of $2.5m he donated to Trump election challenge group		26-11-20
t3_k1o3jz	MIT's Ernie Moniz Is On Biden's Short List For Energy Secretary — Thrilling Energy Wonks But Disappointing Progressives		26-11-20
t3_k1jbye	Where does the Trump team go next with its legal complaints? Nowhere fast		26-11-20
t3_k1d9vf	Strongmen review: a chilling history for one nation no longer under Trump		26-11-20
t3_k1iwvy	Fact-checking Trump’s cellphone rant of election falsehoods		26-11-20
t3_k1gjjk	Biden's Next Climate Chief Will Tackle 'Existential Threat' At Home		26-11-20
t3_k1qq5l	"President Trump will spend his last months in office pardoning turkeys: President Trump will spend the last two months in office giving a pass to all the felons, chancers, and ne’er-do-wells who supported and enabled him. Strap in."		26-11-20
t3_k1c1h2	Xi Jinping calls to congratulate Joe Biden on election win		26-11-20
t3_k1hzfe	Tulsi Gabbard Urges Donald Trump to Pardon Edward Snowden and Julian Assange		26-11-20
t3_k1em7w	Bolsonaro takes swipe at Biden and again dismisses Covid deaths		26-11-20
t3_k1jy86	The Other America: The New Politics of the Poor in Joe Biden’s (and Mitch McConnell’s) USA		26-11-20
t3_k1b6nz	"In Trump and Biden, reality and fantasy collide on Thanksgiving"		26-11-20
t3_k16g6m	Flournoy gets progressive boost in Biden's search for Pentagon chief		26-11-20
t3_k1qxtt	'I'm the President of the United States!': Trump flips out on reporter		26-11-20
t3_k1ixt6	They're baaack: Trump and allies still refuse election loss		26-11-20
t3_k1kea4	"Yes, Trump can pardon himself — but it's a risky move that won't protect him from all prosecutions he could face"		26-11-20
t3_k1q0aw	Angry Trump promises rally in battleground state of Georgia		26-11-20
t3_k1a2et	Biden seeks unity as Trump stokes fading embers of campaign		26-11-20
t3_k1h510	Trump set for precedent breaking lame-duck period		26-11-20
t3_k1qwrl	"Trump Says He’s Not Thankful, Refuses To Say If He Will Attend Biden Inauguration"		26-11-20
t3_k1o6fk	"Joe Biden dreams of a healing nation. For now, a dream is about all he’s got"		26-11-20
t3_k1qiwk	Trump says he'll travel to Georgia to support Republican Senate candidates in runoff election		26-11-20
t3_k1eidz	"Defeat Trump. OK, Now Comes the Hard Part."		26-11-20
t3_k1iro9	Julian Assange’s partner appeals to Trump to pardon him		26-11-20
t3_k1dr3y	Trump's next two months of mayhem		26-11-20
t3_k1qr9c	Overseas celebrations after Biden-Harris win		26-11-20
t3_k1j4uj	Vaccine skepticism emerges as early test for Biden		26-11-20
t3_k1eelw	"As Biden administration ramps up, Trump legal effort drags on"		26-11-20
t3_k1qf53	Angry Trump promises rally in battleground state of Georgia		26-11-20
t3_k1ik8e	"Biden, Trump celebrate Thanksgiving quietly at home as pandemic rages"		26-11-20
t3_k1dp1j	"The Biden Presidency Already Has Its First Conspiracy Theory: The Great Reset : Usually, you become president before the crazy starts. But Biden still has weeks to go till he assumes office."		26-11-20
t3_k1hoai	"Polling Shows Why Trump Will Retain His Bully Pulpit With the GOP Base Even After He Leaves Office: GOP voters see the president -- not his allies in Congress -- as their champion, and most would back him in 2024."		26-11-20
t3_k1gqzc	Trump can be the greatest loser		26-11-20
t3_k1edco	"Joe Biden considers Roger Ferguson to lead National Economic Council, Gary Gensler for Deputy Treasury Secretary"		26-11-20
