Name	Title	Coding
t3_jzta4e	Trump Administration To Start Transition Process For Biden	
t3_jzfqzc	"Do Trump-Supporters Live in an Alternate Universe? Actually a huge number of Americans have a false impression of reality because they are being told lies by their media. The people who constantly hear these lies do live in an ""alternate reality."""	
t3_jzqpbm	Rush Limbaugh criticizes Trump legal team for promising 'bombshells' and failing to deliver	
t3_jzms1q	Pro-Trump Attorney Lin Wood Urges Republicans Not To Vote In Georgia Senate Runoff -- Unless GOP candidates help overturn the presidential election results in the state.	
t3_jzti5c	GSA Sends Letter to Biden Making Resources Available for Transition	
t3_jz9dqx	Lou Dobbs Warns the GOP: Republican Party ‘Will Be Gone and Done’ If They Don’t Stand With President Trump	
t3_jzlwxs	Bombshell: Biden takes min 98% of a 23,487 vote batch at 12:18AM in GA	
t3_jzjbne	Sidney Powell Confirms Non-Affiliation With Trump Legal Team, Vows to Continue Fraud Fight	
t3_jzk9j0	"Sidney Powell Responds to Trump Campaign's Statement Saying She's Not Part of Legal Team -- Powell said her fight will go on anyway and closed her statement with the hashtag, ""#KrakenOnSteroids"""	
t3_jzjzln	A Neighbor You Like Probably Voted For Trump	
t3_jzitza	Why The Left Can Be So Ridiculously Self-Righteous Without Realizing It -- What we saw in the lead up to the elections, and what we’ll witness for years to come, is utter contempt for Trump voters and conservatives in general.	
t3_jzjptq	Two-thirds of GOP voters support Trump running for president in 2024: survey	
t3_jznypc	Trump campaign takes Pennsylvania election fight to federal appeals court	
t3_jzjlmh	Democrat House Losses Stemmed From Trump Increasing Voter Turnout: Rep. Richmond	
t3_jzbqm7	Trump campaign demands recount, signature matching in Georgia	
t3_jzpd7w	JUST IN: Third Circuit Court of Appeals Grants Expedited Review For Team Trump’s Appeal in Pennsylvania	
t3_jzi0vw	5 More Ways Joe Biden Magically Outperformed Election Norms	
t3_jzloh0	Watergate journalist Carl Bernstein outs 21 Republican senators who 'privately' expressed 'extreme contempt' for Trump.	
t3_jzijpr	Trump Pulls Out Of Military Transparency Treaty With Russia, Europe	
t3_jzu0rh	Rush Limbaugh On Trump’s Legal Team: ‘They Promised Blockbuster Stuff And Then Nothing Happened’	
t3_jzqca2	Trump scores two wins as Michigan legislature, federal appeals court agree to election reviews	
t3_jznr0d	Appeals Court Grants Expedited Review of Trump Campaign's Pennsylvania Lawsuit	
t3_jzua12	GSA notifies Joe Biden that Trump administration is ready to start transition process	
t3_jzn4sl	Biden proposes John Poulos, CEO and President of Dominion Voting Systems, as Surgeon General and Head of Covid Analytics. Dominion will now be solely in charge of recording and keeping an exact count of what has become the most deadly virus in the history of the world.	
t3_jzi8g6	Trump’s legal team’s statement on Sydney Powell was made to focus on the upcoming Supreme Court case. There are two separate legal pathways. One on equal protection and PA voting rules (most important right now). The second is Dominion software which will take longer.	
t3_jzu8wb	Trump accepts transition to Biden can begin	
t3_jzo4tp	Journalist Carl Bernstein names 21 GOP senators who 'privately expressed their disdain' for Trump	
t3_jzmj9c	Political Enemy List Trump Accountability Project Publicly Posted on Their Website	
t3_jzpdpe	Trump's election lawsuit leads to 3rd Circuit grant for expedited review	
t3_jzjgop	Open Letter Calls on Harvard to Create 'System of Accountability' for Inviting Trump Admin Alums to Campus	
t3_jzpzzc	Janet Yellen Is Biden’s Pick for Treasury Secretary	
t3_jzl6re	5 More Ways Joe Biden Magically Outperformed Election Norms	
t3_jzntsc	GOP Former National Security Officials Urge Party to Demand Trump Concession	
t3_jzkul5	Trump: More Votes Than Voters in Key Swing States	
t3_jzq15s	Rush Limbaugh: Trump Needs to Hold Rallies in Georgia	
t3_jzmy0e	'Joe Biden is a very weak President, could start wars': Chinese government advisor | World News - Times of India	
t3_jzhelc	Mike Flynn Jr. adds twist to Trump team’s statement on Sidney Powell: ‘Give this the 24hr rule …’	
t3_jzud9p	Bernstein names 21 Republican senators who privately expressed contempt for Trump	
t3_jzrhs0	Biden's Treasury Secretary: Janet Yellen	
t3_jzkxnl	Professor causes uproar asking Biden voters to unfriend him	
t3_jzmvum	Appeals Court Grants Expedited Review of Trump Campaign's Pennsylvania Lawsuit	
t3_jzaqqe	An statement from Senator Toomey regarding the Pennyslvania Federal Court decision regarding the Trump campaign lawsuit.	
t3_jzqyu6	Joel Kotkin: The Green End Game Runs Through Biden	
t3_jzo3u5	Obama's third term: Biden reveals first cabinet picks	
t3_jzaje9	Scranton dedicates 'Joe Biden Way' to honor president-elect	
t3_jzq2wb	Sidney Powell responds to Trump Campaign legal statement with agreement but an “epic” lawsuit is still coming this week	
t3_jzhbcz	The Death Star Strategy: Is Trump Contemplating The Ultimate Constitutional Trick Shot?	
t3_jzu0lg	Walter Mead: Biden’s Foreign-Policy Team Takes Shape	
t3_jznsl5	Biden secretary of state pick Blinken criticized over Iraq War, consulting work	
t3_jzexf7	Trump’s gains in North Philly show Latino voters are not a ‘gimme’ for Democrats	
t3_jzu5h2	The Socio-Political Legacy 0f Trump	
t3_jznbrr	U.S. Election: Trump legal team distances itself from lawyer after controversial comments - National | Globalnews.ca	
t3_jzsxow	Trump Lawyer: Michigan Legislature Agrees to Hold Election Review Hearings	
t3_jzrh4s	Hours After Biden Picks Blinken For Secretary Of State – His Closet Door Swings Open On Iraq And Consulting	
t3_jzrc5e	Rep. Nunes Worried Biden Will Shut Down Durham Investigation	
t3_jzdaid	Report: Maryland Gov. Larry Hogan, Anti-Trump Hero, Paid for Flawed Coronavirus Tests from South Korea	
t3_jzcm4f	Report: Biden to Name Russia Hoaxer, CNN Analyst Tony Blinken Secretary of State	
t3_jz8xh4	Trump campaign to appeal dismissal of election lawsuit in Pennsylvania	
t3_jzlu2s	All Republicans should support President Trump's legal fights -- Any who believe that buddying up to the Biden team is a symbol of unity, and better for America, have already abandoned Trump, conservatism, and America.	
t3_jzk5a1	A Circuit Breaker on Election Night? (...nearly 30 percent of Democrat voters think the election was stolen from Trump)	
t3_jzieod	GOP Can't Let Trump-Hating Squishes Take Over the Party Now	
t3_jzjii3	Mark Levin: Letting Trump's legal efforts play out far better than 'what the Democrats are doing to our institutions'	
t3_jztzoa	The mullah report: is Biden bringing back the Iran Deal? | Spectator USA	
t3_jzt2hb	Data: Trump's Anti-Globalism, Pro-Police Message Wins Over Hispanics	
t3_jzsh0c	Trump Lawyer: Michigan Legislature Agrees to Hold Election Review Hearings	
t3_jzl08r	Biden's Surge In Polls Motivated By Fear	
t3_jzkyjm	NY Mag Scientifically Proves Biden Supporters Are Racist	
t3_jztwv2	Revolving Door: Obama Staffers Who Joined NBC, MSNBC, and CNN, Now Headed to Biden Admin	
t3_jzrsl7	"DuPont’s Shaped Biden’s ""Views"" (no experience!) on Business"	
t3_jzrfhk	Biden &amp; Corporate Charters: A Radical, Regressive Proposal	
t3_jzqrab	Poll: Americans Want Biden to Stay Out of Trump Investigations &amp; Pass on Progressive Policies for Now	
t3_jzkwq8	Study: Biden won thousands of illegal votes by noncitizens	
t3_jzbe4j	Orwell's 1984 is prophetic: How the leftists are trying to change and erase President Trump and history	
t3_jz90wi	Obamas Collaborating on Anti-Trump Netflix Serie	
t3_jzhhqb	"Once an election has been shown dirty, all voters have been disenfranchised- ""Joe Biden won illegal votes from thousands of noncitizens, study shows"""	
t3_jzt98m	Appeals Court Grants Expedited Review of Trump Campaign's Pennsylvania Lawsuit	
t3_jzrtvc	N.Y. Times op-ed admits: Trump was correct, reopen the schools	
t3_jzicud	Here Comes the Biden Blame Game - If the double-dip recession hits next year, Biden will remind us over and over that it’s Donald Trump’s fault. He’ll be wrong.	
t3_jz995u	"President Trump in virtual G-20 remarks: ""The Paris Accord was not designed to save the environment -- it was designed to kill the American economy."""	
t3_jzt6dy	Appeals court to review Trump's Pennsylvania case -- Legal team on track with plan to reach Supreme Court	
t3_jz8s6s	"Mail in ballots come in envelopes. They have creases. ""Ga Poll Worker Describes Pristine Mail In Ballots, 98% for Biden"""	
t3_jzth0n	Seven Letter Poll: 79 Percent of Trump Voters Say Election 'Stolen'	
t3_jzsv52	Hunter Biden Arrives At White House Dressed As Turkey In Hopes Of Being Pardoned By Trump	
